"","Countryname","Country","H_HIS_Score","H_HIS_Score_norm","H_cases_controlled","H_test_and_trace","H_high_vulnerability","H_workplace_prevention","H_manage_imported_cases","H_community_understanding","H_Oxrollback_score","H_Oxrollback_score_norm","H_Covidproj_Current_Deaths","H_Covidproj_Projected_Deaths_._Mean","H_Covidproj_Projected_Deaths_._1M","H_Covidproj_Additional_Deaths_._Mean","Additional_Deaths_._1M","H_Covidproj_Additional_Deaths_.._of_Current_Deaths.","H_Covidproj_Projected_Deaths_._2.5th_Percentile","H_Covidproj_Projected_Deaths_._97.5th_Percentile","H_Covidproj_Projected_Deaths_._1M_norm","H_Covidgrowth_biweeklydeaths","H_Covidgrowth_biweeklycases","H_Covidgrowth_deathsnorm","H_Covidgrowth_casesnorm","H_new_cases_smoothed_per_million","H_new_deaths_smoothed_per_million","H_new_cases_smoothed_per_million_norm","H_new_deaths_smoothed_per_million_norm","F_Proteus_Score","F_Proteus_Score_norm","F_Fewsnet_Score","F_Fewsnet_Score_norm","F_fpv_alt","F_Artemis_Score","F_Artemis_Score_norm","D_DSSI","D_WB_Overall_debt_distress","D_WB_DSSI_Save","D_WB_Overall_debt_distress_norm","D_IMF_debt2017","D_IMF_debt2018","D_IMF_debt2019","D_IMF_debt2020","D_IMF_debt2021","D_IMF_debt2020.2019","D_IMF_debt2020.2019_norm","D_Country..N.175.","D_iso2c","D_Region","D_Classification","D_Summary.of.support..reference.links.at.the.right.end.of.the.table.for.details.","D_Announced..estimated.fiscal.support.package.","D_fiscalgdp","D_Wage..employment..support","D_Cash..transfers","D_Credit.schemes..guarantees...business..support","D_Tax.delays..deferrals","D_Tax.cuts..cancellations..exemptions..credits","D_Interest.rate.cuts.liquidity.measures..other.monetary.measures","D_Specific.support.for.importers.and.exporters","D_Reduced.cost.of.digital.financial.transactions","D_Government.link.to.announce.economic.support","D_SME.Data","D_SME.Business.advice","D_SME.Business.climate","D_SME.Business.costs","D_SME.Debt.finance","D_SME.Demand","D_SME.Employment.support","D_Other.SME.finance","D_SME.Tax.support","D_Social.Data","D_Cash.transfers","D_Multiple.cash.Transfers","D_Single.Transfer","D_Conditional.Targeted.Transfer","D_Unconditional.Universal.transfer","D_Essential.Service.support..e.g...food.provision..utility.support.","D_Health.insurance","D_Social.insurance","D_Wage.subsidy","D_Labour.regulations","D_Tax.data","D_Accelerated.refunds","D_Business.income.tax","D_Customs..import.and.other.miscellaneous.taxes","D_Filing.payment.deadline.extension","D_Individual.income.tax","D_Loss.relief","D_Payroll.taxes","D_PE.and.place..of.management","D_Suspension.of.tax.audits","D_Transfer..pricing","D_VAT.and.other.indirect.taxes","D_WHT","D_Summary.of.lockdown.measures","D_Work.from.home.directive","D_Retail.closure","D_Restaurant.closure","D_Factory.closure","D_Construction.closure","D_Government.Link","D_fiscalgdpnum","D_fiscalgdpnum_norm","Fr_FSI_Score","Fr_FSI_Security.Apparatus","Fr_FSI_Factionalized.Elites","Fr_FSI_Grievance","Fr_FSI_Economy","Fr_FSI_Economic.Inequality","Fr_FSI_Human.Flight.and.Brain.Drain","Fr_FSI_State.Legitimacy","Fr_FSI_Public.Services","Fr_FSI_Human.Rights","Fr_FSI_Demographic.Pressures","Fr_FSI_Refugees.and.IDPs","Fr_FSI_External.Intervention","Fr_FSI_2019minus2020","Fr_FSI_Score_norm","Fr_FSI_2019minus2020_norm","Fr_INFORM_Fragility_Score","Fr_INFORM_Fragility_Score_norm","Fr_REIGN_couprisk3m","Fr_REIGN_couprisk3m_norm","Fr_GPI_Score","Fr_GPI_Score_norm","Fr_ACLED_fatal_last30d","Fr_ACLED_fatal_oneyear30d","Fr_ACLED_fatal_oneyearmonthlyav","Fr_ACLED_fatal_threeyearmonthlyav","Fr_ACLED_fatal_same_month_difference","Fr_ACLED_fatal_month_annual_difference","Fr_ACLED_fatal_month_threeyear_difference","Fr_ACLED_fatal_same_month_difference_perc","Fr_ACLED_fatal_month_annual_difference_perc","Fr_ACLED_fatal_month_threeyear_difference_perc","Fr_ACLED_event_last30d","Fr_ACLED_event_oneyear30d","Fr_ACLED_event_oneyearmonthlyav","Fr_ACLED_event_threeyearmonthlyav","Fr_ACLED_event_same_month_difference","Fr_ACLED_event_month_annual_difference","Fr_ACLED_event_month_threeyear_difference","Fr_ACLED_event_same_month_difference_perc","Fr_ACLED_event_month_annual_difference_perc","Fr_ACLED_event_month_threeyear_difference_perc","Fr_ACLED_fatal_same_month_difference_perc_norm","Fr_ACLED_fatal_month_annual_difference_perc_norm","Fr_ACLED_fatal_month_threeyear_difference_perc_norm","Fr_ACLED_event_same_month_difference_perc_norm","Fr_ACLED_event_month_annual_difference_perc_norm","Fr_ACLED_event_month_threeyear_difference_perc_norm","Fr_state6m","Fr_nonstate6m","Fr_oneside6m","Fr_state6m_norm","Fr_nonstate6m_norm","Fr_oneside6m_norm","Fr_political_regime_type","Fr_political_terror_scale","Fr_institutions_WGI_gov","Fr_institutions_VDEM_corrupt","Fr_security_neighbour_conflict","Fr_security_yrsinceconf","Fr_inequality_ethnic","Fr_inequality_social_power","Fr_socialtension_fractions","Fr_economic_gdp","Fr_economic_natural_resource","Fr_number_flags","Fr_at_risk","Fr_in_conflict","Fr_not_at_risk","Fr_WB_structural_norm","M_Fuel_Imports_perc","M_Food_Imports_perc","M_Travel_Tourism_perc","M_Remittance_perc","M_Reserves","M_ODA_perc","M_Gsavings_perc","M_Economic_Dependence_Score","M_Financial_Resilience_Score","M_Economic_and_Financial_score","M_Economic_and_Financial_score_norm","M_GDP_WB_2017","M_GDP_WB_2018","M_GDP_WB_2019","M_GDP_WB_2020","M_GDP_WB_2021","M_GDP_WB_2019minus2020","M_GDP_IMF_2019","M_GDP_IMF_2020","M_GDP_IMF_2021","M_GDP_IMF_2019minus2020","M_GDP_WB_2019minus2020_norm","M_GDP_IMF_2019minus2020_norm","M_Country","M_Date","M_fiscal","M_ratecut","M_reserve_req","M_macrofin","M_othermonetary","M_bopgdp","M_otherbop","M_CESI_Index","M_CESI_Index_norm","NH_UKMO_TOTAL.RISK.NEXT.12.MONTHS","NH_UKMO_TOTAL.RISK.NEXT.6.MONTHS","NH_UKMO_Temperature","NH_UKMO_Rainfall","NH_UKMO_Tropical.Cyclone","NH_UKMO_Temperature..1.Warmer..5.Near.normal.","NH_UKMO_Rainfall..2.Wetter..3.Drier..5.Near.normal.","NH_UKMO_Tropical.Cyclone..5.TC.forecast.","NH_UKMO_INFORM_RISK_Flood","NH_UKMO_INFORM_RISK_Tropical.Cyclone.1","NH_UKMO_INFORM_RISK_Drought","NH_UKMO_INFORM_RISK_Locust..based.on.FAO.forecasts.","NH_INFORM_RISK_UKMO_Vuln","NH_UKMO_INFORM_OCCURENCExRISK12m_Flood","NH_UKMO_INFORM_OCCURENCExRISK12m_Tropical.Cyclone","NH_UKMO_INFORM_OCCURENCExRISK12m_Drought","NH_UKMO_INFORM_OCCURENCExRISK12m_Locust","NH_UKMO_X","NH_UKMO_INFORM_OCCURENCExRISK6m_Flood","NH_UKMO_INFORM_OCCURENCExRISK6m_Tropical.Cyclone","NH_UKMO_INFORM_OCCURENCExRISK6m_Drought","NH_UKMO_INFORM_OCCURENCExRISK6m_Locust","NH_UKMO_INFORM_OCCURENCExRISK6mplusCLIMATE_Flood","NH_UKMO_OCCURENCExRISK6mplusCLIMATE_Tropical.Cyclone","NH_UKMO_OCCURENCExRISK6mplusCLIMATE_Drought","NH_UKMO_OCCURENCExRISK6mplusCLIMATE_Locust","NH_UKMO_TOTAL.RISK.NEXT.6.MONTHS_norm","NH_UKMO_TOTAL.RISK.NEXT.12.MONTHS_norm","NH_GDAC_Date","NH_GDAC_Hazard_Status","NH_GDAC_Hazard_Severity","NH_GDAC_Hazard_Type","NH_GDAC_Hazard_Score_Norm","NH_INFORM_Crisis_name","NH_INFORM_Crisis_ID","NH_INFORM_CRISIS_Type","NH_INFORM_Crisis_Severity_Score","NH_INFORM_Crisis_Type_Number","NH_INFORM_Crisis_Norm","NH_Hazard_Score","NH_Hazard_Score_norm","S_OCHA_Added.Social.Protection.coverage","S_OCHA_Added.SP.adequacy","S_OCHA_Added.Social.Protection.coverage.1","S_OCHA_Added.SP.adequacy.1","S_OCHA_SP.Index","S_OCHA_Population.density","S_OCHA_Population.living.in.urban.areas","S_OCHA_Population.living.in.slums....of.urban.population.","S_OCHA_household.size","S_OCHA_IDP..refugees.and.returnees...percentage.of.population.","S_OCHA_Displaced.population","S_OCHA_Density.Index","S_OCHA_Access.to.cities","S_OCHA_Internal.connectedness..Road.density.","S_OCHA_Movement","S_OCHA_Transmission","S_OCHA_Human.Development.Index","S_OCHA_Multidimensional.Poverty.Index","S_OCHA_Poverty","S_OCHA_Poverty.index","S_OCHA_food.insecurity.as.percenatge.of.population","S_OCHA_Food.insecurity.score","S_OCHA_Population.age.65.....","S_OCHA_Demography","S_OCHA_Probability.....of.dying.between.30.70.from.cardiovasular.disease..cancer..diabetes.or.chronic.respiratory.disease","S_OCHA_known.co.mortality.risk.factors","S_OCHA_Diabetes.prevalance","S_OCHA_Diabetes.prevalence","S_OCHA_Age.Standardized.Prevalence.of.CVD","S_OCHA_Incidence.of.Tuberculosis","S_OCHA_Comorbidities","S_OCHA_Risk.factors","S_OCHA_Covid.vulnerability.index","S_OCHA_Covid.vulnerability.index_norm","Fr_conflict_acaps","H_health_acaps","NH_natural_acaps","F_food_acaps","RELIABILITY_SCORE_EXISTING_RISK","RELIABILITY_SCORE_EMERGING_RISK"
"1","Libya","LBY",25.7,8.86,0,0.2,NA,NA,0.8,0.3,0.3,0,NA,NA,NA,NA,NA,NA,NA,NA,NA,30.6894889103182,11.6712326585222,2.04596592735455,0.778082177234813,110.231,1.684,10,8.42,0.301,3.42105263157895,NA,NA,0,NA,NA,NA,NA,NA,NA,-43.464,-0.194,8.8,-7.2,-19.1,-16,10,"Libya","LY","Middle East and North Africa","Upper-Middle-Income Economy","The IMF reported that the Government will implement a package of LD 500 million in covid related spending, however how this money will be spent has yet to specified. As of the 5th of April, there are no government documents outlining fiscal or monetary responses.","350 million USD","1% of GDP",NA,NA,NA,NA,NA,NA,NA,NA,"Click here",TRUE,NA,TRUE,NA,NA,NA,NA,NA,NA,TRUE,NA,NA,NA,NA,NA,TRUE,NA,NA,NA,NA,NA,NA,NA,NA,NA,NA,NA,NA,NA,NA,NA,NA,NA,"Libya is also having an ongoing civil war, impacting the nations capacity to respond to the virus. The country’s borders have been closed, large public gatherings banned, and travel restrictions instituted, including between cities. On April 15, the Government of National Accord imposed a 24-hour curfew for a period of 10 days beginning on April 17",NA,NA,NA,NA,NA,"Click Here",1,9.38628158844765,7.9,9.5,9.7,7.8,8,5.3,5.7,9.8,6.9,9.4,5.3,8,9.8,3.1,9.85815602836879,0,8.5,10,0.0011431811,6.6857881724362,3.285,10,23,97,186.75,64.9444444444444,-74,-163.75,-41.9444444444444,-76.2886597938144,-87.6840696117805,-64.5851154833191,32,49,159.5,54.5,-17,-127.5,-22.5,-34.6938775510204,-79.9373040752351,-41.2844036697248,0,0,0,0,0,0,0.639195936892801,0.922009215534993,0.520741612146259,7.70279909846859,10,6.01059445923227,"0",4.888888836,2.083333492,"0.784333348",1,1,".","-1.009888887","0.791999996","9.70563221","33.14443588",7,NA,"In Conflict",NA,10,NA,NA,3,NA,10,NA,NA,3,10,6.5,10,NA,NA,NA,NA,NA,NA,"9.9","-58.7","80.7",-68.6,NA,10,"Libya","2020-09-09",1.694,0,0,0,0,0,0,-3.69785045622865,10,25.5,0,"Hot",NA,NA,1,NA,NA,2.6,0,5,0,5.1,13.26,0,25.5,0,"x",0,0,0,0,0,0,0,0,0,4.29944095038435,NA,NA,NA,NA,NA,"Complex crisis in Libya","LBY001","Multiple crises country",4.1,3,0,8.2,9,NA,NA,NA,NA,NA,1.9,8,NA,NA,4.8,4.8,4.9,6.8,0.3,3.6,4.2,3.9,2.6,NA,3.3,4.4,2.2,4,1.1,20.1,6.7,10.2,4.6,5,0.7,4.3,3.8,4,4.375,10,0,0,0,0.1,0.2
"2","Sudan","SDN",26.2,8.76,0.1,0.6,NA,NA,0.8,NA,0.5,4.76190476190474,NA,NA,NA,NA,NA,NA,NA,NA,NA,-78.3699059561128,-69.542570319159,0,0,0.14,0,0.0280000000000005,0,0.576,10,4,10,10,0.412665588,10,NA,NA,NA,NA,-6.473,-7.877,-10.8,-16.9,-20.6,-6.1,10,"Sudan","SD","Sub-Saharan Africa","Lower-Middle Income Economy","As of the 5th of April, no fiscal or monetary measures have been reported. However, the Federal Ministry of Health has banned transportation between cities, and instated a curfew from rom 6:00 p.m. to 6:00 a.m. local time.",NA,NA,NA,NA,NA,NA,NA,NA,NA,NA,"Click here",NA,NA,NA,NA,NA,NA,NA,NA,NA,TRUE,NA,NA,NA,NA,NA,TRUE,NA,NA,NA,NA,TRUE,NA,"Announced",NA,"Implemented","Implemented",NA,"Implemented","Implemented",NA,NA,NA,NA,"The Government has implemented a number of containment measures, including shutting down international borders, closing schools, and implemented a curfew.",NA,NA,NA,NA,NA,"Click Here",NA,NA,8.7,8.4,9.4,9.4,8.1,8,8,9.3,8.3,8.9,9.1,9.3,8.6,-3.1,10,10,6.6,7.57575757575757,0.0048243369,10,2.995,10,217,46,76,26.5,171,141,190.5,371.739130434783,185.526315789474,718.867924528302,119,149,91.0833333333333,34.0833333333333,-30,27.9166666666667,84.9166666666667,-20.1342281879195,30.6495882891125,249.144254278729,10,6.18421052631579,10,0,0.766239707227815,3.11430317848411,0.832929907221683,0.831652255250241,0.782281260215816,10,10,9.74687514594023,".",4.722222328,6.891025543,"0.768999994",1,1,"0.752999961","0.787777722","0.714699984","8.355672836","4.661174774",7,NA,"In Conflict",NA,10,NA,NA,3,0,0,NA,4.7,3,1.56666666666667,2.28333333333333,2.10131332082551,4.3,-2.3,-2.6,-4,0.5,-1.4,"-2.5","-7.2","-3",-4.7,0,4.53846153846154,"Sudan","2020-09-09",5.83033718783403,0,0,0,1,0,0,-1.59139587613132,9.91927059538026,64.8,74.5,"Hot","Dry",NA,1,3,NA,8,0,6.9,9,7.2,57.6,0,49.68,64.8,"0",57.6,0,49.68,64.8,57.6,0,74.52,64.8,9.93929691148022,10,NA,NA,NA,NA,NA,"Complex crisis in Sudan","SDN001","Complex crisis",4.6,3,0,6.5,6.875,7.448155525,1.051388924,0.7,0,0.7,4.2,3.5,10,9,7.4,7.4,6.8,6.9,0.1,3.5,5.2,8,9.1,1.3,6.1,14.5,7.2,4,1.1,26,10,22.1,10,6,1.4,6.9,4.6,4.9,8.125,10,0,0,0,0.1,0.2
"3","Afghanistan","AFG",32.3,7.54,0,0.2,NA,NA,0.2,0.3,0.2,0,NA,NA,NA,NA,NA,NA,NA,NA,NA,63.1147540983606,49.7578692493947,4.20765027322404,3.31719128329298,1.064,0.037,0.2128,0.184999999999999,0.661,10,3,10,0,0.476335221,10,"Yes","High","0.2%",10,-0.63,1.502,-1,-4,-2,-3,6,"Afghanistan","AF","South Asia","Low-Income Economy","Money has been allocated to cover immediate expenses related to the epidemic, and the Government has stated that additional fiscal support measures will be implemented as the situation develops. As of the 5th of April, there is no further information regarding these additional measures.","285 million USD","2.9% of GDP",NA,NA,NA,NA,NA,NA,NA,NA,"Click here",NA,NA,NA,NA,NA,NA,NA,NA,NA,TRUE,NA,NA,NA,NA,NA,TRUE,NA,TRUE,TRUE,NA,TRUE,NA,NA,NA,NA,NA,NA,NA,NA,"Implemented",NA,NA,NA,"On March 28 the Capital, Kabul, went into lockdown where residents were unable to leave their house without a valid  reason. All restaurants, hotels, sauna, cafes, public bathing centers, shrines, gyms, parks and other stores will were closed, with the exceptions of grocery stores and banks. The lockdown was initially planned for 3 weeks, but has been extended. Other cities and provinces are in varying degrees of lockdown, but most have required all but non essential businesses to close.",TRUE,TRUE,TRUE,TRUE,TRUE,NA,2.9,8.014440433213,8.6,9.9,8.9,7.5,8.3,7.7,7.5,9,9.5,7.6,9,9.3,8.6,-2.1,10,8.88888888888889,7.3,8.75420875420875,0.00058941577,2.7847287636393,3.574,10,1954,2963,2460,894.833333333333,-1009,-506,1059.16666666667,-34.0533243334458,-20.5691056910569,118.364686161296,454,829,908.166666666667,324.611111111111,-375,-454.166666666667,129.388888888889,-45.2352231604343,-50.0091759955955,39.8596611329796,0,0,1.97274476935494,0,0,0.498245764162245,NA,NA,NA,NA,NA,NA,"-1",4.888888836,9.29487133,"0.907999992",1,1,"0.015","0.19544445","0.769299984","7.467392445","0.670973718",6,NA,"In Conflict",NA,10,4,6,NA,3,1.7,8,4.4,5,4.275,4.6375,10,2.7,1.8,2.9,-5.5,1,-8.4,"3","-3","4.5",-6,9.90483743061063,6.2051282051282,"Afghanistan","2020-09-10",2.9,0,0,0,1,0,0,-1.74329958083151,10,66.4,99.5,"Hot","Wet",NA,1,2,NA,7.2,0,7.9,4,8.4,60.48,0,66.36,33.6,"0",60.48,0,66.36,33.6,90.72,0,99.54,50.4,10,10,NA,NA,NA,NA,NA,"Complex crisis in Afghanistan","AFG001","Complex crisis",4.5,3,0,8.8,9.75,8.820582327,NA,0.9,0,0.9,5.9,2.5,7.9,10,7,7,6.7,1.9,1,1.5,4.1,8,9,NA,8.5,27.9,10,3,0.6,29.8,10,9.2,4,5,3.4,5.6,5,4.5,6.45833333333333,10,0,0,0,0,0.1
"4","Mozambique","MOZ",28.1,8.38,0.2,0.6,NA,NA,0.5,0.4,0.4,2.38095238095237,NA,NA,NA,NA,NA,NA,NA,NA,NA,200,112.779212481031,10,7.51861416540206,6.403,0.037,1.2806,0.184999999999999,0.592,10,3,10,0,0.303404623,10,"Yes","In distress","2.0%",10,-2.923,-6.906,-0.2,-7.7,-6.1,-7.6,10,"Mozambique","MZ","Sub-Saharan Africa","Low-Income Economy","To ease liquidity conditions, the central bank reduced reserve requirements by 150 basis points for both foreign currency and domestic currency deposits (to 11.5 percent and 34.5 percent respectively) on March 16. On March 22, it announced measures to support financial markets and encourage prudent loan restructuring by: (i) introducing a foreign currency credit line for institutions participating in the Interbank Foreign Exchange Market, in the amount of US$ 500 million, for a period of nine months; and (ii) waiving the constitution of additional provisions by credit institutions and financial companies in cases of renegotiations of the terms and conditions of the loans, before their maturity, for clients affected by the pandemic, until December 31","71 million USD","0.5% of GDP",NA,NA,TRUE,NA,NA,TRUE,NA,NA,NA,NA,NA,NA,NA,NA,NA,NA,NA,NA,TRUE,NA,NA,NA,NA,NA,NA,NA,TRUE,NA,NA,TRUE,NA,NA,NA,NA,"Implemented",NA,NA,NA,NA,NA,NA,NA,"In March the Government introduced measures to slow the spread of the virus, including banning gatherings of more than 50 people and school closures. On the 30th of March these measures were increased, to include closure of non-essential shops or, where applicable, their reduction in activity - as well as directing the industrial sector toward the production of goods necessary for the prevention and mitigation of the Covid-19 pandemic.",TRUE,TRUE,TRUE,NA,NA,"Click Here",0.5,9.74729241877256,7.6,6.8,7.1,5.3,8.3,9.5,7.4,7.3,9.4,5.3,9.8,7.6,7.9,3.1,9.32624113475177,0,4.6,4.20875420875421,0.000584615575,2.75091327383821,2.099,4.49028163427212,119,31,95.75,32.7777777777778,88,23.25,86.2222222222222,283.870967741935,24.2819843342037,263.050847457627,38,17,44.1666666666667,15.1111111111111,21,-6.16666666666666,22.8888888888889,123.529411764706,-13.9622641509434,151.470588235294,9.46236559139785,0.809399477806789,4.38418079096045,3.08823529411765,0,1.89338235294118,0.62829589449006,0.149858468858829,0.642919293637223,7.54708420700086,0.712263840840414,7.75598990910319,"5",2.888888836,18.42948723,"0.535333335",0,1,"0.097999997","-1.089333296","0.693199992","7.11106348","18.84356308",4,NA,"In Conflict",NA,10,5,4,3,0,0.4,9,4.9,4,3.575,3.7875,8.87429643527205,3.7,3.4,2.2,1.3,3.6,-0.9,"2.2","2.2","4.7",0,0,0,"Mozambique","2020-09-10",4.96246179494304,19.6078431372549,7.8525641025641,3.47318699638789,1,0,1,-0.00187709410724313,6.64916630581503,54,80.9,"Hot","Dry",NA,1,3,NA,6.3,5.2,7.6,0,7.1,44.73,36.92,53.96,0,"0",44.73,36.92,53.96,0,44.73,36.92,80.94,0,10,9.27847658979734,"2020","active","orange","drought",10,"Southern Africa Regional Food Security Crisis","REG012","Regional crisis",3.7,3,0,6.5,6.875,6.312861502,NA,0.6,NA,0.6,5.2,3.6,8.5,5.9,0.2,0.2,4.7,3.1,0.4,1.8,3.2,9.3,9.6,6.3,8.4,5.9,3,3,0.6,18.4,5.6,3.3,0.7,10,10,6.6,5.2,4.2,5.20833333333333,0,0,0,0,0,0
"5","Niger","NER",32.2,7.56,0.9,0.2,NA,NA,1,0.6,0.7,9.52380952380948,NA,NA,NA,NA,NA,NA,NA,NA,NA,0.01,0.01,0.000666666666667481,0.000666666666667481,0.077,0,0.0153999999999996,0,0.606,10,3,10,0,0.216210932,10,"Yes","Moderate","0.2%",7,-4.122,-3.005,-3.6,-4.2,-3.3,-0.6,1.2,"Niger","NE","Sub-Saharan Africa","Low-Income Economy","the BCEAO (the regional central bank) announced the following monetary and macro-financial measures with the aim of mitigating the negative economic impact of the Covid-19 crisis by: (i) providing CFAF 340 billion additional liquidity to bring the total liquidity made available to banks by weekly and monthly auctions to CFAF 4,750 billion; (ii) extending the collateral framework to access the BCEAO’s refinancing to include CFAF 1,050 billion of bank loans to prequalified 1,700 private companies that could thus benefit from better financing conditions, and (iii) setting-up a framework with the banking system to support firms with repayment difficulties. Other policy announcements included: (i) allocating FCFA 25 billion to the trust fund of the West African Development Bank (BOAD) to increase the amount of concessional loans to eligible countries to finance urgent investment and equipment expenses; (ii) communicating on the special program for refinancing bank credits granted to SMEs; (iii) initiating negotiations with firms issuing electronic money to encourage its usage; and (iv) ensuring adequate provision of banknotes for satisfactory ATM operation.",NA,"18.4% of GDP",NA,NA,TRUE,NA,NA,TRUE,NA,NA,NA,NA,NA,NA,NA,NA,NA,NA,NA,NA,TRUE,TRUE,NA,NA,NA,NA,TRUE,NA,NA,NA,NA,NA,NA,NA,NA,NA,NA,NA,NA,NA,NA,NA,NA,NA,"The  country's largest outbreak has been in the capital, and much of the country's lockdown efforts aim to prevent the spread of the virus from the capital to other regions - through travel restrictions and quarantines. President declared a state of emergency on the 27th of March, and issued a curfew to shorten work hours and ban large gatherings.",NA,NA,NA,NA,NA,NA,18.4,0,7.9,8.8,8.9,7.8,6.8,7.7,7.3,7,9.2,6.9,8.7,8.4,7.8,-1,9.85815602836879,4.81481481481481,6,6.56565656565656,0.00124236125,7.38447340309769,2.394,6.83062276874256,17,8,94.5833333333333,31.75,9,-77.5833333333333,-14.75,112.5,-82.0264317180617,-46.4566929133858,24,16,35.1666666666667,12.1666666666667,8,-11.1666666666667,11.8333333333333,50,-31.7535545023697,97.2602739726027,3.75,0,0,0,0,0,0.761636555031247,0.618751894685225,0.725250068323897,9.45195078616067,7.41074135264607,8.93214383319853,"5",3.5,26.28205109,"0.628666699",1,1,"0.003333333","-1.229555607","0.651799977","6.796789169","13.34413528",6,NA,"In Conflict",NA,10,NA,NA,0,0,NA,NA,3.9,0,1.95,0.975,0,4.9,6.5,6.3,1,8.1,-5.3,"5.8","1","8.1",-4.8,4.98810467882633,4.66666666666667,"Niger","2020-09-10",2.53131519518228,17.2413793103448,0,2.7,1,0,0,-1.26745273719729,9.25282496404618,52.5,71.4,"Hot",NA,NA,1,NA,NA,7.4,0,6.7,7,7.1,52.54,0,47.57,49.7,"0",52.54,0,47.57,49.7,52.54,0,71.355,49.7,9.52571542925756,9.01642208245982,NA,NA,NA,NA,NA,"Regional Boko Haram Crisis","REG001","Regional crisis",3.8,3,0,7.3,7.875,21.38065487,3.376694494,2.4,0.1,2.4,4.2,1.6,6.9,9.8,1.4,1.4,4.8,7.3,0.3,3.8,4.3,10,10,4.5,8.2,3.4,1.7,3,0.6,20,6.7,2.4,0.2,7,1.6,3.9,4.8,4.5,6.45833333333333,0,0,0,0,0,0.1
"6","Algeria","DZA",23.6,9.28,0,0.3,NA,NA,1,NA,0.4,2.38095238095237,1698,1943,45,245,6,14,1750,2289,0.423760877790389,0.907715582450837,-30.7377518315018,0.0605143721633894,0,4.822,0.186,0.964400000000001,0.93,0.282,2.96650717703349,NA,NA,0,NA,NA,NA,NA,NA,NA,-6.647,-4.468,-5.1,-15,-10.1,-9.9,10,"Algeria","DZ","Middle East and North Africa","Upper-Middle-Income Economy","Taxes for individuals and businesses have been postponed until April 20. The reserve bank have lowered the reserve requirement ratio from 10 percent to 8 percent. As of April 3, no additional monetary measures have been reported.","542 million USD","0.3% of GDP",NA,NA,NA,TRUE,NA,TRUE,NA,NA,NA,TRUE,NA,TRUE,TRUE,TRUE,NA,TRUE,TRUE,TRUE,TRUE,TRUE,TRUE,NA,TRUE,NA,TRUE,NA,TRUE,NA,NA,TRUE,NA,NA,NA,"Implemented",NA,NA,NA,NA,NA,NA,NA,NA,NA,NA,NA,NA,NA,NA,NA,0.3,9.89169675090253,6.2,6.3,7.8,7.5,6.2,5.7,5.8,8.3,5.1,6.3,4.5,7.1,4,-0.6,6.84397163120567,3.33333333333333,4.9,4.71380471380471,0.00250093895,10,2.219,5.44228480761603,5,0,2.91666666666667,0.972222222222222,5,2.08333333333333,4.02777777777778,0.01,71.4285714285714,414.285714285714,188,103,175.666666666667,60.75,85,12.3333333333333,127.25,82.5242718446602,7.02087286527515,209.465020576132,0,0,0,2.0631067961165,0.175521821631877,2.61831275720165,0.55430490277738,0.23148617676099,0.270686480955498,6.49007003967686,1.87837395372843,2.43837829936426,"2",2.555555582,32.05128098,"0.730000019",1,1,"0.280000001","-0.698777795","0.339399993","9.391448975","13.90524483",6,NA,"In Conflict",NA,10,NA,NA,3,0,3.2,NA,2,3,1.73333333333333,2.36666666666667,2.4765478424015,1.3,1.4,0.8,-6.4,1.9,-7.2,"0.7","-5.2","6.2",-5.9,8.00158604282316,6.07692307692308,"Algeria","2020-09-10",-2.2,14.2857142857143,40,0,1,6,1,1.61018943807439,3.3326747100134,15.6,23.4,"Hot","Wet",NA,1,2,NA,5.2,0,4.1,4,3,15.6,0,12.3,12,"0",15.6,0,0,12,23.4,0,0,18,3.12187312387432,2.56988120195667,NA,NA,NA,NA,NA,NA,NA,NA,NA,NA,NA,4.9,4.875,NA,NA,NA,NA,NA,4.2,7.3,NA,NA,0.2,0.2,3.9,6,0.4,3.2,3.6,2.9,NA,0.1,1.5,0,0,6,2.2,14.2,2.8,6.7,2.6,5,1.3,2.9,2.2,2.9,0,0,0,0,0,0.1,0.3
