"97","Burundi","BDI",22.8,9.44,1,0.3,NA,NA,0.8,0,0.5,4.76190476190474,NA,NA,NA,NA,NA,NA,NA,NA,NA,0.01,0.01,0.000666666666667481,0.000666666666667481,0.024,0,0.00479999999999947,0,0.573,9.92822966507177,1,1,0,NA,NA,"Yes","…","0.1%",NA,-7.201,-5.274,-6,-9,-6.8,-3,6,"Burundi","BI","Sub-Saharan Africa","Low-Income Economy","As of the 3rd of April, no fiscal or monetary measures have been reported","150 million USD","4.7% of GDP",NA,NA,NA,NA,NA,NA,NA,NA,"Click here",NA,NA,NA,NA,NA,NA,NA,NA,NA,NA,NA,NA,NA,NA,NA,NA,NA,NA,NA,NA,NA,NA,NA,NA,NA,NA,NA,NA,NA,NA,NA,NA,NA,"There has only been limited attempts to control the spread the virus. Borders have remained open, although there are restrictions for people entering from at risk counties. Citizens have been instructed to watch their hands regularly.",NA,NA,NA,NA,NA,NA,4.7,6.71480144404332,8.2,8.3,7.9,7.6,8.5,7.3,5.9,9.1,7.9,9.1,9.2,8.5,8.5,-0.2,10,1.85185185185185,6.3,7.07070707070707,0.00198471235,10,2.52,7.83022610075367,17,9,23.5,8.08333333333333,8,-6.5,8.91666666666667,88.8888888888889,-27.6595744680851,110.309278350515,32,56,57.5833333333333,20.75,-24,-25.5833333333333,11.25,-42.8571428571429,-44.4283646888567,54.2168674698795,2.96296296296296,0,1.83848797250859,0,0,0.677710843373493,0.392668994623166,0.285981837074709,0.617813927131237,4.1809856374738,2.65688338678156,7.39734181616053,"-1",4.111111164,8.17307663,"0.945666671",1,4,"0","0.153555557","0.295100003","6.606153965","16.48086548",7,"At Risk",NA,NA,7,4,4,0,0,0.2,NA,5.3,2.66666666666667,1.83333333333333,2.25,1.95121951219512,0.5,1.6,1.8,1,2.3,-0.8,"1.8","-5.5","4.2",-7.3,0,7.87179487179487,"Burundi","2020-09-10",2.75,0,0,0,0,0,0,-3.64310920910208,10,32.8,32.8,NA,NA,NA,NA,NA,NA,3.7,0,4.9,0,6.7,24.79,0,32.83,0,"0",24.79,0,32.83,0,24.79,0,32.83,0,4.37595890867854,5.57477288609364,NA,NA,NA,NA,NA,NA,NA,NA,NA,NA,NA,4.9,4.875,NA,NA,NA,NA,NA,8.8,1.3,5.4,7.1,1.2,1.2,4.8,10,2.3,6.2,5.5,9.7,9.7,7.2,8.9,14.7,7.4,2,0,22.9,8.6,5.1,1.7,6,2.1,4.6,6.7,6.1,10,0,0,0,0,0.1,0.2
"98","Cambodia","KHM",39.2,6.16,1,0.2,NA,NA,0.5,0.8,0.6,7.14285714285711,NA,NA,NA,NA,NA,NA,NA,NA,NA,0.01,0.01,0.000666666666667481,0.000666666666667481,0,0,0,0,0.548,9.33014354066986,NA,NA,0,NA,NA,"No","Low","0.8%",3,-0.775,0.717,0.4,-1.9,-1.7,-2.3,4.6,"Cambodia","KH","East Asia and Pacific","Lower-Middle Income Economy","The IMF has reported additional fiscal spending in the health care sector, of approximately 70 million USD. The Government has also announced tax concessions and credit support to businesses, and low-interest loans to banks. Income support will be provided for Government workers who are laid off as a result of the virus, but there is no current plan for more general wage support. The National Bank of Cambodia has also undertaken measures to increase liquidity, such as lowering interest rates. The IMF also reports that the Government has suspended exporting white rice, to ensure that there sufficient local supply.","450 million USD","2% of GDP",TRUE,NA,TRUE,NA,NA,TRUE,NA,NA,"Click Here",TRUE,NA,NA,NA,TRUE,TRUE,NA,NA,NA,TRUE,TRUE,NA,TRUE,TRUE,NA,TRUE,NA,TRUE,TRUE,NA,TRUE,NA,NA,"Implemented","Implemented",NA,NA,NA,NA,NA,NA,NA,"Implemented",NA,NA,NA,NA,NA,NA,NA,2,8.66425992779783,6.7,6.7,8.6,6,5,5.9,6.9,8.4,7.7,7.3,5.9,4.8,7.1,-2.3,7.73049645390071,9.62962962962963,7,8.24915824915825,0.000444528165,1.76405245170172,2.066,4.22848076160254,0,0,0.75,0.25,0,-0.75,-0.25,0.01,-100,-100,12,5,9,3.13888888888889,7,3,8.86111111111111,140,33.3333333333333,282.300884955752,0,0,0,0,0,0,NA,NA,NA,NA,NA,NA,"-1",2.888888836,25.16025734,"0.89533335",1,8,"0.02","0.635555565","0.210500002","8.162067413","1.783658385",4,"At Risk",NA,NA,7,NA,NA,6,3,0.8,5,3.8,6,3.15,4.575,10,7,7.5,7.1,-1,6,-8.1,"7","-1.6","6.1",-8.6,9.42902458366376,9.53846153846154,"Cambodia","2020-08-13",2.7085671530116,30.9090909090909,27.0833333333333,2.24466891133558,1,0,0,-0.489476598424404,7.65230086999238,40.9,40.9,NA,NA,NA,NA,NA,NA,9.5,4,4.6,0,4.3,40.85,17.2,19.78,0,"0",40.85,17.2,19.78,0,40.85,17.2,19.78,0,5.45660729771196,6.98986722571628,NA,NA,NA,NA,NA,NA,NA,NA,NA,NA,NA,4.2,4,3.085970529,12.5388145,0.2,2,0.2,6.5,2.3,5.3,6.5,0,0,4.1,2.9,1.8,2.4,3.2,6.4,8.1,NA,7.3,0,0,5,1.7,21.1,7.4,6.4,2.4,4,5.9,4.9,4.1,3.7,3.125,0,0,0,0,0,0.3
"99","China","CHN",48.2,4.36,0,0.5,NA,NA,0.8,NA,0.4,2.38095238095237,4738,4789,3,51,0,1,4738,5205,0,-64.2857142857143,-1.81818181818182,0,0,0.015,0,0.00300000000000011,0,0.28,2.91866028708134,NA,NA,0,NA,NA,NA,NA,NA,NA,-3.835,-4.655,-6.4,-11.2,-9.6,-4.9,9.8,"China (Mainland)","CN","East Asia and Pacific","Upper-Middle-Income Economy","
Liquidity support by increasing funds for reverse repurchase operations; extensions on stock pledges and bond maturity dates of debt; hedging tools for A-share market; lowered bank reserve requirement.
VAT reduced from 3 percent to 1 percent for small businesses until the end of May; VAT cut on supplies related to the outbreak.CIT losses incurred in 2020 will be provided with a longer tax loss carry-forward period (i.e., 8 years, vs the standard 5 years). Full refund of carried forward excess input VAT balances may be granted to enterprises engaged in production of supplies for COVID-19 protection and containment.
","672 billion USD","4.5% of GDP",NA,TRUE,TRUE,NA,TRUE,TRUE,NA,TRUE,NA,TRUE,NA,TRUE,NA,TRUE,TRUE,TRUE,TRUE,TRUE,TRUE,TRUE,TRUE,TRUE,TRUE,NA,TRUE,NA,TRUE,TRUE,NA,TRUE,NA,"Implemented","Implemented","Implemented","Implemented","Implemented","Implemented",NA,NA,NA,"Implemented",NA,NA,NA,NA,NA,NA,NA,NA,4.5,6.85920577617328,5.8,5.8,7.2,7.4,3.9,6.4,4.3,8.8,4.8,9.3,5.6,4,2.4,-1.2,6.13475177304964,5.55555555555556,3.8,2.86195286195286,0.0001857171,0,2.217,5.4264180880603,0,0,0.416666666666667,0.138888888888889,0,-0.416666666666667,-0.138888888888889,0.01,-100,-100,144,128,240.166666666667,83.4444444444444,16,-96.1666666666667,60.5555555555556,12.5,-40.0416377515614,72.5699067909454,0,0,0,0.3125,0,0.907123834886818,NA,NA,NA,NA,NA,NA,"-7",3.888888836,67.94872284,"0.529333353",1,11,"0.083400004","0.199444443","0.153799996","9.482087135","1.416705251",4,"At Risk",NA,NA,7,4,3,4,0,2.4,NA,1.2,3.66666666666667,1.2,2.43333333333333,2.77673545966229,6.8,6.6,6.1,1,6.9,-5.1,"6.1","1.2","9.2",-4.9,4.67089611419508,4.79487179487179,"China","2020-09-10",4.5,15.625,11.1111111111111,8.46383108910891,1,0,1,0.153208627699759,6.33010968951912,25.2,0,"Hot","Wet",NA,1,2,NA,8.4,8.1,4.6,0,3,25.2,24.3,13.8,0,"x",0,0,0,0,0,0,0,0,0,4.24703004891684,NA,NA,NA,NA,NA,NA,NA,NA,NA,NA,NA,7,7.5,63.05300071,36.82996305,7.5,7,7.5,7.2,5.9,2.8,NA,0,0,4,3,1,2,3,3,5,0.1,2.7,0,0,11,5,17,4.7,9.2,4,4,1.1,3.5,4.5,3.8,3.54166666666667,0,0,0,0,0.1,0.3
"100","Comoros","COM",27.2,8.56,NA,NA,NA,NA,NA,NA,NA,NA,NA,NA,NA,NA,NA,NA,NA,NA,NA,0.01,0.01,0.000666666666667481,0.000666666666667481,2.136,0,0.427200000000001,0,0.502,8.22966507177034,NA,NA,0,NA,NA,"Yes","Moderate","0.2%",7,0.351,-1.038,-2.2,-3.8,-2.7,-1.5,3,"Comoros","KM","Sub-Saharan Africa","Lower-Middle Income Economy","On the 30th of March, the Government announced a 30% reduction in taxes and custom tariffs for essential items, such as food and medicine. The President also announced that from the 1st of April the central banks reserve ratio would be reduced to 5%, for a period of 5 months. On the 4th of April the President announced establishing several bipartisan committees to respond to covid, one of which will focus on financial and economic affairs.",NA,NA,NA,NA,NA,NA,TRUE,TRUE,TRUE,NA,"Click here",NA,NA,NA,NA,NA,NA,NA,NA,NA,TRUE,TRUE,NA,NA,NA,NA,NA,NA,NA,NA,NA,NA,NA,NA,NA,NA,NA,NA,NA,NA,NA,NA,NA,NA,"According to the IMF, the  Government has restricted gatherings to no more than 20 people and closed the borders and implemented a curfew from 8PM - 5PM in the main province. Currently, there are few restrictions on businesses with the president  explaining that the dominance of the informal economy makes it difficult to implement business restrictions.",NA,NA,NA,NA,NA,"Click Here",NA,NA,6.8,6.5,8,4.5,7.3,7,6.5,7.4,7.5,5.8,7.9,5.8,7.1,-0.4,7.90780141843971,2.59259259259259,7.9,9.76430976430976,0.00107865655,6.2312380421926,NA,NA,NA,NA,NA,NA,NA,NA,NA,NA,NA,NA,NA,NA,NA,NA,NA,NA,NA,NA,NA,NA,NA,NA,NA,NA,NA,NA,0.0124916509800537,0.0101481718331781,0.02326187897805,0,0,0,"9",1.333333373,5.288461685,"0.762333333",0,22,"0","-1.035666704","0","7.947842598","2.400998831",2,NA,NA,"Not At Risk",0,NA,NA,3,4,1,NA,5.1,3,3.36666666666667,3.18333333333333,6.15384615384616,3.8,3.4,1.9,-1.4,3.2,-3.3,"1.9","-1.2","3.1",-3.1,1.81601903251388,2.48717948717949,NA,NA,NA,NA,NA,NA,NA,NA,NA,NA,NA,15.7,0,NA,NA,NA,NA,NA,NA,0.1,2.9,1,0,5.4,0.54,15.66,5.4,0,"x",0,0,0,0,0,0,0,0,0,2.58735150244584,NA,NA,NA,NA,NA,NA,NA,NA,NA,NA,NA,1.6,0.75,1.982875719,13.22422071,0,2.1,0,8.8,2.9,7.7,8.4,0,0,5.6,5.8,3.6,4.7,5.1,7.9,8.2,1.8,6,0,0,3,0.6,22.9,8.6,12.3,5.7,5,0.6,5,3.6,4.4,6.04166666666667,0,0,0,0,0,0.5
"101","Congo","COG",23.6,9.28,0,0.2,NA,NA,1,NA,0.4,2.38095238095237,NA,NA,NA,NA,NA,NA,NA,NA,NA,19.9779249448124,-87.5001512639617,1.33186166298749,0,1.76,0.026,0.352,0.130000000000001,0.576,10,NA,NA,0,NA,NA,"Yes","In distress","1.3%",10,-7.387,6.617,5.8,5.7,6.1,-0.1,0.199999999999999,NA,NA,NA,NA,NA,NA,NA,NA,NA,NA,NA,NA,NA,NA,NA,NA,NA,NA,NA,NA,NA,NA,NA,NA,NA,NA,NA,NA,NA,NA,NA,NA,NA,NA,NA,NA,NA,NA,NA,NA,NA,NA,NA,NA,NA,NA,NA,NA,NA,NA,NA,NA,NA,NA,NA,NA,NA,NA,7.7,7.3,6.7,8.1,7.8,8.4,7.1,9.1,8.6,8.1,8,6.7,6.2,-0.4,9.50354609929078,2.59259259259259,7.8,9.59595959595959,0.00127477145,7.61279054178709,2.323,6.26735422451408,0,0,0.166666666666667,0.0555555555555556,0,-0.166666666666667,-0.0555555555555556,0.01,-100,-100,3,0,1.08333333333333,0.361111111111111,3,1.91666666666667,2.63888888888889,0.01,176.923076923077,730.769230769231,0,0,0,0,0,0,0.144268020675332,0.0920416137928062,0.0820539246183047,0.632400295361887,0,0,"-4",3.666666746,11.53846169,"0.813666642",1,3,"0.379999995","0.325777799","0.87470001","8.348763466","35.40151978",8,NA,"In Conflict",NA,10,NA,NA,0,NA,0.2,NA,6.4,0,3.3,1.65,0,-1.8,1.6,-0.9,-6.2,-1.1,-5.3,"-0.9","-2.3","3.4",-1.4,4.98810467882633,0.307692307692305,"Republic of Congo","2020-09-10",0.136470588235294,11.9047619047619,0,2.22586961529601,1,0,0,-1.52966198110815,9.79226594641991,52.5,52.5,NA,NA,NA,NA,NA,NA,8.6,0,0.5,0,6.1,52.46,0,3.05,0,"0",52.46,0,0,0,52.46,0,0,0,7.00420252151291,9.01642208245982,NA,NA,NA,NA,NA,NA,NA,NA,NA,NA,NA,3,2.5,NA,NA,NA,NA,NA,4,6.7,5.3,5.8,3,3,5,3.1,0.1,1.6,3.3,5.9,8.5,0.3,4.9,0,0,3,0.6,16.7,4.5,6,2.2,5,6.8,4.6,4.8,4,4.375,0,0,0,0,0,0.4
"102","France","FRA",68.2,0.359999999999999,0,0.7,NA,NA,0,0.4,0.3,0,31447,34839,520,3392,51,11,31504,49839,9.40976163450624,166.100809610864,51.4020106916701,10,3.42680071277801,159.691,0.913,10,4.565,0.116,0,NA,NA,0,NA,NA,NA,NA,NA,NA,NA,NA,NA,NA,NA,NA,NA,"France","FR","Europe and Central Asia","High-Income Economy","
Liquidity plan for startups:short terms refinancing scheme, early payment of tax credits, accelerated payment of already-planned investments; guarantees over cash flow costs.Suspension of payments for some taxes; direct tax payments delayed for three months.The extension does not apply for value added tax (VAT), assimilated taxes or withholdings of employees’ individual income taxes by employers.

","120 billion USD","6% of GDP",NA,TRUE,TRUE,TRUE,NA,NA,NA,TRUE,NA,TRUE,TRUE,NA,TRUE,TRUE,NA,NA,NA,NA,TRUE,TRUE,NA,NA,TRUE,NA,TRUE,NA,TRUE,NA,NA,TRUE,"Implemented/Proposed","Announced/Implemented","Implemented","Implemented",NA,NA,NA,NA,NA,NA,NA,NA,NA,NA,NA,NA,NA,NA,NA,6,5.77617328519856,2.5,3.8,1.9,6.7,3.4,3.1,2.2,1.2,1.3,1.3,1.9,2.5,1.2,-1.5,0.283687943262411,6.66666666666667,2.8,1.17845117845118,0.00034153621,1.03851455086719,1.892,2.84807616025387,NA,NA,NA,NA,NA,NA,NA,NA,NA,NA,NA,NA,NA,NA,NA,NA,NA,NA,NA,NA,NA,NA,NA,NA,NA,NA,NA,NA,NA,NA,NA,NA,"9",1.5,88.94230652,"0.083666667",0,57,"0.014","-1.976999998","0.103200004","10.61631775","0.041400641",0,NA,NA,"Not At Risk",0,4,3,3,0,0.3,NA,3.6,3.33333333333333,1.3,2.31666666666667,2.25140712945591,NA,NA,NA,NA,NA,NA,"1.3","-7.2","4.5",-8.5,NA,9.41025641025641,"France","2020-09-10",13.0457010516271,0,100,28.64,1,0,0,1.7726708975596,2.99840290168611,17.9,0,NA,NA,NA,NA,NA,NA,6.4,0,2.3,0,2.8,17.92,0,6.44,0,"x",0,0,0,0,0,0,0,0,0,2.97169811320755,NA,NA,NA,NA,NA,NA,NA,NA,NA,NA,NA,2.1,1.375,NA,NA,NA,NA,NA,7,8,NA,0.7,0.7,0.7,4.1,4.2,10,7.1,5.6,0,NA,0,0,0,0,20,10,10.6,0.4,4.8,1.6,3,0.1,1.3,0.6,3.1,0.625,0,0,0,0,0.1,0.5
"103","Gabon","GAB",20,10,0,0.5,NA,NA,1,0.4,0.5,4.76190476190474,NA,NA,NA,NA,NA,NA,NA,NA,NA,0.01,0.01,0.000666666666667481,0.000666666666667481,3.209,0.064,0.6418,0.32,0.434,6.60287081339713,NA,NA,0,NA,NA,NA,NA,NA,NA,-1.699,-0.211,1.9,-2.7,-1.3,-4.6,9.2,"Gabon","GA","Sub-Saharan Africa","Upper-Middle-Income Economy","The IMF has reported the governments projections are to spend 17 billion FCFA on Covid related activities, with FCFA 4 billion already placed in a fund to prevent the spread of the virus. As of the 4th of April, there is no information directly from the Government regarding these measures, how they may be directed and when they will come into effect. The Bank of Central African States has lowered interest rates, and will take actions to increase banks liquidity.","20 million USD","0.74% of GDP",NA,NA,NA,NA,NA,NA,NA,NA,"Click here",NA,NA,NA,NA,NA,NA,NA,NA,NA,TRUE,NA,NA,NA,NA,NA,TRUE,NA,TRUE,NA,NA,NA,NA,NA,NA,NA,NA,NA,NA,NA,NA,NA,NA,NA,"The Government has responded by: bans on social gatherings, travel restrictions and a night time curfew. However, there has been minimal impact on economic activity.",NA,NA,NA,NA,NA,"Click Here",0.74,9.57400722021661,5.8,5.1,8.3,2.9,5.7,5.6,5.5,7.8,6,7.2,6.6,3.6,4.8,-1.3,6.13475177304964,5.92592592592593,6.8,7.91245791245791,0.00072217616,3.7199736055745,2.112,4.59341531138437,0,0,0.333333333333333,0.111111111111111,0,-0.333333333333333,-0.111111111111111,0.01,-100,-100,4,1,2.66666666666667,0.916666666666667,3,1.33333333333333,3.08333333333333,300,50,336.363636363636,0,0,0,0,0,0,0.0454895631791432,0.0361791067970374,0.0290441356165092,0,0,0,"3",3,18.10897446,"0.805666685",1,55,"0","-0.730444431","0.768999994","9.397938728","16.34646034",5,"At Risk",NA,NA,7,NA,NA,0,0,NA,0,NA,0,0,0,0,0.5,0.8,3.3,-3.2,-2.6,-6.5,"3.4","-1.2","3.6",-4.6,6.8913560666138,4.41025641025641,"Gabon","2020-09-10",1.94,11.9047619047619,0,2.22222222222222,1,0,0,-1.43632276917226,9.60023993151023,16.3,16.3,NA,NA,NA,NA,NA,NA,4.8,0,1.5,0,3.4,16.32,0,5.1,0,"x",16.32,0,0,0,16.32,0,0,0,2.17463811620306,2.69217330538085,NA,NA,NA,NA,NA,NA,NA,NA,NA,NA,NA,3.4,3,51.83428286,20.75546794,6.1,3.7,6.1,3.1,8.9,4.1,5.2,0,0,4.3,6.5,0.1,3.3,3.8,4,6.9,0.3,3.7,0,0,4,1.1,14.4,2.9,6,2.2,5,9.6,4.9,4.9,4.4,6.04166666666667,0,0,0,0,0.1,0.3
"104","Gambia","GMB",34.2,7.16,0.5,0.5,NA,NA,1,NA,0.7,9.52380952380948,NA,NA,NA,NA,NA,NA,NA,NA,NA,83.4071687474829,-57.4361029293301,5.56047791649886,0,6.621,0.296,1.3242,1.48,0.472,7.51196172248804,NA,NA,0,NA,NA,"Yes","High","0.7%",10,-4.98,-6.197,-2.6,-2.4,-2.1,0.2,0,"Gambia","GM","Sub-Saharan Africa","Low-Income Economy","The IMF has reported that the Government has reallocated 500 million dalasi from the Health Budget to respond to COVID 19.  As of the 4th of April, there is no information directly from the Government regarding these measures, how they may be directed and when they will come into effect.  In February, the Central Bank reduced its monetary policy rate to 12%, and increased the standing deposit facility rate to 3%.","9 million USD","0.5% of GDP",NA,NA,NA,NA,NA,TRUE,NA,NA,"Click here",NA,NA,NA,NA,NA,NA,NA,NA,NA,TRUE,NA,NA,NA,NA,NA,TRUE,NA,NA,NA,NA,NA,NA,NA,NA,NA,NA,NA,NA,NA,NA,NA,NA,NA,"A state of emergency was declared on March 27, leading to the closure of all non-essential public and private businesses, with was extended by an additional 45 days on  April 4. Public gatherings are limited to 10 people.",NA,NA,NA,NA,NA,"Click Here",0.5,9.74729241877256,6.9,6,7.7,2.9,8.1,6,7.6,7.5,7.2,8.1,8.4,6.3,6.4,-1.7,8.08510638297872,7.40740740740741,4.7,4.37710437710438,0.000904659075,5.00549412110666,1.908,2.97500991669972,0,0,0.333333333333333,0.111111111111111,0,-0.333333333333333,-0.111111111111111,0.01,-100,-100,4,0,2.25,0.75,4,1.75,3.25,0.01,77.7777777777778,433.333333333333,0,0,0,0,0,0,0.0287495193381288,0.0161066701334636,0.0346997499687384,0,0,0,"-0.5",2.111111164,23.71794891,"0.401666671",0,38,"0","-0.517222226","0.78640002","7.771370888","5.806406975",1,NA,NA,"Not At Risk",0,7,5,5,4,0.3,NA,5,5.66666666666667,3.1,4.38333333333333,10,4.8,6.6,6,2.5,6.5,-3.5,"6","2.5","6.5",-3.5,2.13322759714512,3,"The Gambia","2020-09-10",3.201269035533,20,13.3333333333333,1.65241116751269,1,4.39819514946419,1,1.16225178653935,4.25421326137122,31.8,31.8,NA,NA,NA,NA,NA,NA,3.5,0,3.2,6,5.3,18.55,0,16.96,31.8,"0",18.55,0,16.96,31.8,18.55,0,16.96,31.8,4.24254552731639,5.40006988120196,NA,NA,NA,NA,NA,NA,NA,NA,NA,NA,NA,2.1,1.375,NA,NA,NA,NA,NA,7.8,6.1,2.9,10,0.2,0.2,5.4,4.6,4.1,4.4,4.9,8.8,9.1,1,6.3,4.3,2.1,3,0.6,20.4,6.9,1.9,0,7,3.2,4.3,5.3,5.1,8.95833333333333,0,0,0,0,0,0.3
"105","Germany","DEU",66,0.799999999999999,0,0.7,NA,NA,0.8,0.3,0.4,2.38095238095237,9423,9719,117,296,4,3,9435,10856,1.78584941354521,55.4559043348281,30.2580347443207,3.69706028898854,2.01720231628804,20.911,0.07,4.1822,0.35,0.111,0,NA,NA,0,NA,NA,NA,NA,NA,NA,NA,NA,NA,NA,NA,NA,NA,"Germany","DE","Europe and Central Asia","High-Income Economy","
Reduced hours compensation benefits, tax related liquidity assistance to businesses (tax deferrals, enforcement measures such as penalties for late payments waved), expansion of existing liquidity programmes. 

Additional measures are to be decided upon by 27th March (Merkel’s cabinet has already approved, but parliament and Bundesrat need to approve as well). These measures will include: Direct subsidies up to 15K to small business owners/freelancers, no eviction of people not able to pay rent, stabilization of larger companies from a special fund (eventually government direct investment up to 100 billion Euro), loosening of bankruptcy rules. 

There is also direct support of 30 billion Euro to health system. 

","175 billion USD","4.9% of GDP",TRUE,TRUE,TRUE,TRUE,NA,NA,TRUE,TRUE,"Click here",TRUE,NA,TRUE,NA,TRUE,NA,NA,NA,NA,TRUE,TRUE,NA,NA,TRUE,NA,NA,NA,TRUE,TRUE,NA,TRUE,NA,"Announced/Implemented",NA,"Implemented","Announced","Implemented","Implemented","Implemented",NA,NA,"Implemented",NA,NA,NA,NA,NA,NA,NA,NA,4.9,6.57039711191336,1.9,2.6,2.6,4.3,1.3,2.1,2.1,0.5,1,0.8,1.1,4.3,0.5,-1.5,0,0,2.3,0.336700336700337,0.00029119458,0.683877525530718,1.547,0.111067036890123,NA,NA,NA,NA,NA,NA,NA,NA,NA,NA,NA,NA,NA,NA,NA,NA,NA,NA,NA,NA,NA,NA,NA,NA,NA,NA,NA,NA,NA,NA,NA,NA,"10",1,94.2307663,"0.025",0,69,"0","-2.512444496","0.168200001","10.79472828","0.065426551",0,NA,NA,"Not At Risk",0,3,3,4,0,0.2,NA,2.9,3.33333333333333,1.03333333333333,2.18333333333333,1.65103189493433,NA,NA,NA,NA,NA,NA,"0.6","-7","5.2",-7.6,NA,8.25641025641026,"Germany","2020-08-27",20.321516902443,0,100,44.7466528604711,1,0,0,2.82410932593342,0.835287024275306,20.7,0,NA,NA,NA,NA,NA,NA,6.1,0,0.5,0,3.4,20.74,0,1.7,0,"x",0,0,0,0,0,0,0,0,0,3.46086652690426,NA,NA,NA,NA,NA,NA,NA,NA,NA,NA,NA,1.3,0.375,NA,NA,NA,NA,NA,7.9,7.7,0,0.3,1.7,1.7,3.5,6.6,10,8.3,5.9,0,NA,0,0,0,0,21,10,12.1,1.4,10.4,4.7,3,0.1,2.3,1.2,3.5,2.29166666666667,0,0,0,0,0.1,0.5
"106","Kiribati","KIR",19.2,10,NA,NA,NA,NA,NA,NA,NA,NA,NA,NA,NA,NA,NA,NA,NA,NA,NA,NA,NA,NA,NA,NA,NA,NA,NA,0.399,5.76555023923445,NA,NA,0,NA,NA,"No","High","...",10,11.638,-1.148,8.8,-18.7,1,-27.5,10,"Kiribati","KI","East Asia and Pacific","Lower-Middle Income Economy","As of the 25th of April, there is no information regarding financial or monetary responses to covid.",NA,NA,NA,NA,NA,NA,NA,NA,NA,NA,NA,NA,NA,NA,NA,NA,NA,NA,NA,NA,NA,NA,NA,NA,NA,NA,NA,NA,NA,NA,NA,NA,NA,NA,NA,NA,NA,NA,NA,NA,NA,NA,NA,NA,NA,NA,NA,NA,NA,NA,NA,NA,NA,NA,NA,NA,NA,NA,NA,NA,NA,NA,NA,NA,NA,NA,NA,NA,NA,NA,NA,0.00019221471,0,NA,NA,NA,NA,NA,NA,NA,NA,NA,NA,NA,NA,NA,NA,NA,NA,NA,NA,NA,NA,NA,NA,NA,NA,NA,NA,NA,NA,NA,NA,NA,NA,NA,NA,".",1,41.18589783,".",0,69,".",".","0.051100001","7.618767262","0.082353242",0,NA,NA,"Not At Risk",0,NA,NA,5,3,NA,8,NA,5,5.5,5.25,10,NA,NA,NA,NA,NA,NA,"2.3","0","2.2",-2.3,NA,1.46153846153846,NA,NA,NA,NA,NA,NA,NA,NA,NA,NA,NA,15.6,0,NA,NA,NA,NA,NA,NA,0.1,0,3.8,0,4.1,0.41,0,15.58,0,"0",0,0,0,0,0,0,0,0,0,2.56988120195667,NA,NA,NA,NA,NA,NA,NA,NA,NA,NA,NA,2.1,1.375,4.571458667,5.617563362,0.3,0.5,0.3,7.2,5.4,NA,NA,0,0,4.2,7.2,9.3,8.3,6.2,5.8,NA,1.3,3.5,0,0,4,1.1,28.4,10,22.5,10,5,7.5,8.1,4,5.1,8.95833333333333,0,0,0,0,0,0.7
"107","Korea DPR","PRK",70.2,0,NA,NA,NA,NA,NA,NA,NA,NA,NA,NA,NA,NA,NA,NA,NA,NA,NA,NA,NA,NA,NA,NA,NA,NA,NA,0.519,8.63636363636364,NA,NA,0,NA,NA,NA,NA,NA,NA,NA,NA,NA,NA,NA,NA,NA,"North Korea","KP","East Asia and Pacific","Low-Income Economy",NA,NA,NA,NA,NA,NA,NA,NA,NA,NA,NA,NA,NA,NA,NA,NA,NA,NA,NA,NA,NA,NA,NA,NA,NA,NA,NA,NA,NA,NA,NA,NA,NA,NA,NA,NA,NA,NA,NA,NA,NA,NA,NA,NA,NA,NA,NA,NA,NA,NA,NA,NA,NA,NA,7.5,8.3,8.5,5.5,8.6,7.2,4.1,9.9,8.3,9.4,6.8,4.1,9.5,-2.5,9.14893617021276,10,8.2,10,0.000583594405,2.74371953197561,2.921,10,0,0,0.0833333333333333,0.0277777777777778,0,-0.0833333333333333,-0.0277777777777778,0.01,-100,-100,1,1,2.66666666666667,0.888888888888889,0,-1.66666666666667,0.111111111111111,0,-62.5,12.5,0,0,0,0,0,0,NA,NA,NA,NA,NA,NA,"-10",5,4.166666508,"0.739666641",1,66,"0","0.512333333","0.0392",".",".",5,"At Risk",NA,NA,7,NA,NA,NA,NA,NA,NA,NA,NA,NA,NA,NA,NA,NA,NA,NA,NA,NA,NA,NA,NA,NA,NA,NA,NA,NA,NA,NA,NA,NA,NA,NA,NA,NA,NA,40.7,40.7,NA,NA,NA,NA,NA,NA,7.4,6.5,3.3,0,5.5,40.7,35.75,18.15,0,"0",40.7,35.75,0,0,40.7,35.75,0,0,5.42992462143953,6.95492662473795,NA,NA,NA,NA,NA,"Complex crisis in DPRK","PRK001","Complex crisis",4.1,3,0,4.4,4.25,NA,NA,NA,NA,NA,7.8,6.2,NA,4.8,0,0,4.7,6.3,2.8,4.6,4.6,8.4,NA,NA,8.4,0,0,9,3.9,7.8,0,6.4,2.4,4,9.3,3.9,6.2,5.4,10,10,0,0,0,0.3,0.7
"108","Kuwait","KWT",46.1,4.78,0,0.6,NA,NA,1,0.6,0.5,4.76190476190474,590,740,176,150,36,25,610,938,2.90200529701097,22.6019845644984,-6.05444350326506,1.50679897096656,0,146.585,0.669,10,3.345,0.185,0.645933014354066,NA,NA,0,NA,NA,NA,NA,NA,NA,6.266,9.045,4.8,-11.3,-14.1,-16.1,10,"Kuwait","KW","Middle East and North Africa","High Income Economy","The Government has allocated a several support measures including: postponing social security contributions; removing government fees on certain sectors; and providing loans and financing for businesses and banks.","1.6 billion USD","1.5% of GDP",NA,NA,TRUE,NA,TRUE,NA,NA,NA,NA,TRUE,NA,NA,NA,TRUE,NA,NA,NA,TRUE,TRUE,NA,NA,NA,NA,NA,NA,NA,TRUE,NA,NA,TRUE,NA,"Implemented",NA,"Implemented",NA,NA,NA,NA,NA,"Implemented",NA,NA,NA,NA,NA,NA,NA,NA,NA,1.5,9.02527075812274,4.2,3.3,7.5,3.8,2.4,3.9,3.3,7.3,1.8,7,4.1,2.6,3.9,-2.3,3.29787234042553,9.62962962962963,5.6,5.89225589225589,0.000526826535,2.34381216800095,1.794,2.07060690202301,0,0,0,0,0,0,0,0.01,0.01,0.01,3,0,1.16666666666667,0.388888888888889,3,1.83333333333333,2.61111111111111,0.01,157.142857142857,671.428571428571,0,0,0,0,0,0,NA,NA,NA,NA,NA,NA,"-7",2,47.2756424,"0.542333305",1,28,"0.029999999","0.137444437","0.660399973","10.57350922","35.4748497",4,"At Risk",NA,NA,7,0,4,3,0,1.1,NA,2.8,2.33333333333333,1.3,1.81666666666667,0,-4.7,1.2,0.4,-5.4,1.1,-5.8,"0.7","-1.1","3.4",-1.8,5.78112609040444,0.820512820512818,"Kuwait","2020-09-09",1.5,45.4545454545455,19.2307692307692,0.033781398698163,1,0,0,-0.463117602369552,7.59807271802437,4.3,0,NA,NA,NA,NA,NA,NA,1.3,0,3.1,0,1.4,1.82,0,4.34,0,"x",0,0,0,0,0,0,0,0,0,0.595737246680642,NA,NA,NA,NA,NA,NA,NA,NA,NA,NA,NA,1.2,0.25,NA,NA,NA,NA,NA,7.9,10,NA,NA,0,0,6,4.9,5.2,5.1,5.5,1.9,NA,NA,1.9,0,0,3,0.6,17.4,4.9,12.2,5.7,4,0.5,3.8,2.8,4.2,5.20833333333333,0,0,0,0,0.1,0.3
"109","Luxembourg","LUX",43.8,5.24,0,0.9,NA,NA,0,0.4,0.3,0,124,137,223,13,21,10,128,157,3.79114642451759,0.01,0.01,0.000666666666667481,0.000666666666667481,167.053,0,10,0,0.091,0,NA,NA,0,NA,NA,NA,NA,NA,NA,NA,NA,NA,NA,NA,NA,NA,"Luxembourg","LU","Europe and Central Asia","High-Income Economy","Tax payment delays; tax cancellation available for successful application up to two months of tax.","16 billion USD","15% of GDP",NA,NA,NA,TRUE,TRUE,NA,NA,NA,NA,TRUE,NA,NA,NA,TRUE,NA,TRUE,TRUE,TRUE,TRUE,TRUE,NA,TRUE,TRUE,NA,NA,NA,NA,TRUE,NA,TRUE,NA,NA,NA,"Implemented/Proposed",NA,NA,NA,"Implemented","Implemented",NA,NA,NA,NA,NA,NA,NA,NA,NA,NA,15,0,1.6,1,3.4,2.4,1.5,1.1,1.6,0.5,1.4,1.2,1.3,2.8,0.5,-1.6,0,0,1.7,0,0.000241371185,0.332891262373085,NA,NA,NA,NA,NA,NA,NA,NA,NA,NA,NA,NA,NA,NA,NA,NA,NA,NA,NA,NA,NA,NA,NA,NA,NA,NA,NA,NA,NA,NA,NA,NA,NA,NA,"10",1,93.58974457,"0.061333332",0,69,"0","-2.396666765","0.530200005","11.50759602","0.01316187",0,NA,NA,"Not At Risk",0,3,4,0,0,0,NA,3.9,2.33333333333333,1.3,1.81666666666667,0,NA,NA,NA,NA,NA,NA,"2.3","-4.9","4.8",-7.2,NA,7.74358974358974,"Luxembourg","2020-09-10",19.0093374152635,0,0,20.24,1,0,0,-0.0609121632000305,6.77061868175316,2.6,0,NA,NA,NA,NA,NA,NA,2,0,0,0,1.3,2.6,0,0,0,"x",0,0,0,0,0,0,0,0,0,0.29874213836478,NA,NA,NA,NA,NA,NA,NA,NA,NA,NA,NA,0.4,0,NA,NA,NA,NA,NA,8,9.1,NA,1,0.6,0.6,4.7,2.6,10,6.3,5.5,0,NA,0,0,0,0,14,6.7,10,0,5,1.7,4,0.1,1.5,0.7,3.1,0.625,0,0,0,0,0.1,0.5
