"90","Saint Lucia","LCA",35.3,6.94,NA,NA,NA,NA,NA,NA,NA,NA,-100,130.767535743848,0,8.71783571625652,38.12,0,7.624,0,NA,NA,NA,NA,NA,NA,NA,NA,NA,NA,NA,5,5,183.629,5,0,0,0,0,3.9,NA,"9.8","Low","NO DATA",NA,"NO DATA",NA,"NO DATA",NA,"NO DATA",NA,"NO DATA",NA,"NO DATA",NA,"-16.9 %","High","NO DATA",NA,"0.3 %","Low","Closed due to COVID-19","High","NO DATA",NA,"0.00%","Medium","NO DATA",NA,"NO DATA",NA,"NO DATA",NA,"NO DATA",NA,0.1,"Low",0.1,"Low",0.5,"Low","NO DATA",NA,"NO CRISIS","Low",4.75,0,NA,NA,NA,NA,NA,NA,NA,NA,NA,NA,NA,NA,NA,NA,NA,NA,NA,NA,NA,NA,NA,NA,NA,NA,NA,0,NA,NA,NA,NA,NA,NA,NA,NA,NA,NA,NA,NA,-2.215,-0.997,-2.2,-8.2,-3.3,-6,10,NA,NA,NA,NA,NA,NA,NA,NA,NA,NA,NA,NA,4.5,2.38095238095238,0,0,5,0,5,NA,NA,7,0,0.5,0,4.9,7,1.35,4.175,10,2.2,1.4,1.4,-8.8,8.3,-10.2,"1.7","-8.5","6.9",-10.2,10,10,10,0,NA,NA,NA,NA,NA,NA,NA,NA,NA,NA,NA,10.3,15.5,"Hot","Dry","TC risk",1,3,4,0.1,4.7,0.5,0,2.2,0.22,10.34,1.1,0,"0",0,10.34,0,0,0,15.51,0,0,2.06790741111334,1.64395527603075,NA,NA,NA,NA,NA,2.6,2.66666666666667,2.24661479079955,5.61653697699887,0,NA,NA,NA,NA,NA,8.2,1.9,1.3,NA,0,0,2.9,6.4,10,8.2,5.5,3.1,1.7,NA,2.4,0,0,NA,NA,18.8,5.9,11.6,5.3,4,0.1,3.8,3.1,4.3,5.625,3.1,4.42857142857143,"-16.9 %","High","NO DATA",NA,"NO DATA",NA,10,NA,NA,"LCAPOV1","International poverty rate ($1.9 in 2011 PPP)",4.479902,4.373724,4.373724,5.433172,4.746514,4.580246,"16:43:10  5 Oct 2020","LAC",183.629,0.0243964842154562,0.023818263999695,0.023818263999695,0.0295877666381672,0.0258483899601915,0.0249429338503178,24.223019102257,0.576950263847214,4.8446038204514,10,"Unemployment rate","Unemployment rate can be defined by either the national definition, the ILO harmonized definition, or the OECD harmonized definition. The OECD harmonized unemployment rate gives the number of unemployed persons as a percentage of the labor force (the total number of people employed plus unemployed). [OECD Main Economic Indicators, OECD, monthly] As defined by the International Labour Organization, unemployed workers are those who are currently not working but are willing and able to work for pay, currently available to work, and have actively searched for work. [ILO, http://www.ilo.org/public/english/bureau/stat/res/index.htm]","Percent of total labor force",NA,NA,NA,NA,NA,NA,NA,NA,NA,NA,"0",NA,NA,NA,NA,NA,NA,NA,NA,NA,NA,NA,NA,NA,NA,NA,NA,NA,NA,NA,NA,NA,NA,NA,NA,NA,NA,NA,NA,NA,NA,NA,NA,NA,0,0,0,0,0.2,0.4
"91","Solomon Islands","SLB",20.7,9.86,NA,0,NA,NA,1,NA,0.5,4.76190476190474,NA,NA,NA,NA,0,0,0,0,20210106,NA,33.89,NA,25,NA,35.26,NA,NA,7.09384615384615,7.5,NA,NA,NA,NA,NA,NA,NA,NA,5.6,NA,"0.0","Low","44","Medium","Total border closure","Low","Recommend closing (or significantly reduce volume/route ...","Medium","Recommend not leaving house","Medium","Government is replacing less than 50% of lost salary (or if a flat sum, it  ...","Medium","1","Medium","-5.0 %","High","NO DATA",NA,"3.9 %","Medium","Fully open","Low","NO DATA",NA,"NO DATA",NA,"Coordinated public information campaign (e.g. across traditional and social ...","Low","No testing policy","High","No contact tracing","High","NO DATA",NA,0.1,"Low",1.9,"Low",0.8,"Low","NO DATA",NA,"NO CRISIS","Low",9,0,0.54,9.13875598086125,NA,NA,NA,NA,NA,NA,NA,NA,NA,NA,NA,NA,NA,NA,NA,NA,NA,NA,NA,NA,NA,NA,NA,0,NA,NA,NA,NA,NA,NA,NA,NA,"Moderate","Moderate","Jun-20",7,-4.478,0.676,-2.7,-7.3,-7.8,-4.6,9.2,2.6,8.23104693140794,7.5,NA,NA,NA,NA,NA,NA,NA,NA,NA,3.5,7.14285714285714,10,0,5,NA,5,4,5,4,0,1.2,7,NA,4.33333333333333,2.73333333333333,3.53333333333333,7.72983114446529,3.7,3.9,2.7,-6.7,-0.3,-9.4,"1.2","-2.1","3.8",-3.3,10,6.6,6.7,0,NA,NA,NA,NA,NA,NA,NA,NA,NA,NA,NA,16.4,16.4,NA,NA,NA,NA,NA,NA,0.1,4.1,3.3,0,4,0.4,16.4,13.2,0,"0",0,16.4,0,0,0,16.4,0,0,2.18797945433927,2.70964360587002,NA,NA,NA,NA,NA,5.8,8,2.87422218668489,7.18555546671222,0,1.583380809,24.64380769,0,4.5,0,4.6,2.4,NA,NA,0,0,2.3,4.3,0.3,2.3,2.3,7.1,NA,2.5,4.8,0,0,4,1.1,23.8,9.2,19,9.4,5,1.4,6.3,3.7,3,0.208333333333332,5.9,8.42857142857143,"-5.0 %","High","NO DATA",NA,"Government is replacing less than 50% of lost salary (or if a flat sum, it  ...","Medium",10,NA,0,NA,NA,NA,NA,NA,NA,NA,NA,NA,NA,NA,NA,NA,NA,NA,NA,NA,NA,NA,NA,NA,"Unemployment rate","Unemployment rate can be defined by either the national definition, the ILO harmonized definition, or the OECD harmonized definition. The OECD harmonized unemployment rate gives the number of unemployed persons as a percentage of the labor force (the total number of people employed plus unemployed). [OECD Main Economic Indicators, OECD, monthly] As defined by the International Labour Organization, unemployed workers are those who are currently not working but are willing and able to work for pay, currently available to work, and have actively searched for work. [ILO, http://www.ilo.org/public/english/bureau/stat/res/index.htm]","Percent of total labor force",NA,NA,NA,NA,NA,NA,NA,NA,NA,NA,"0",NA,NA,NA,NA,NA,NA,NA,NA,NA,NA,NA,NA,NA,NA,NA,NA,NA,NA,NA,NA,NA,NA,NA,NA,NA,NA,NA,NA,NA,NA,NA,NA,NA,0,0,0,0,0,0.6
"92","United Arab Emirates","ARE",46.7,4.66,0,0.9,NA,NA,0.5,0.5,0.5,4.76190476190474,-8.34021737369812,24.1943757767278,0,1.61295838511519,178.095,0.332,10,1.66,20210106,NA,59.78,NA,50,NA,61.28,NA,NA,3.11076923076923,5,870,843,9890.4,674,27,2.72991992234894,29.080118694362,2.9080118694362,2.5,NA,"176.0","High","45","Medium","Quarantine arrivals from high-risk regions","Medium","Recommend closing (or significantly reduce volume/route ...","Medium","No measures","High","No income support","High","2","Low","-6.6 %","High","NO DATA",NA,"-1.5 %","Medium","Fully open","Low","NO DATA",NA,"NO DATA",NA,"Coordinated public information campaign (e.g. across traditional and social ...","Low","Open public testing (eg “drive through” testing available to asymptomatic p ...","Low","Comprehensive contact tracing - done for all cases","Low","NO DATA",NA,0,"Low",0,"Low",0,"Low","NO DATA",NA,"NO CRISIS","Low",1.25,10,0.203,1.07655502392344,NA,NA,NA,NA,NA,NA,NA,NA,NA,NA,NA,NA,NA,NA,NA,NA,NA,NA,NA,NA,NA,NA,NA,0,NA,NA,0.05,0.06,NA,0.06,7,NA,NA,NA,NA,NA,-1.991,1.966,-0.8,-11.1,-7.1,-10.3,10,2,8.66425992779783,5,2.98611111111111,62.5,50,29.9714285714286,1,0,0,1.67189514650419,3.05766930247372,NA,NA,0,0,5,NA,5,3,3,4,NA,NA,NA,NA,3.33333333333333,NA,3.33333333333333,6.82926829268293,0.5,1.7,1.7,-4.5,1.4,-6.2,"1.3","-3.5","3.3",-4.8,10,9.6,8.2,0.329000000000001,NA,NA,NA,NA,NA,NA,NA,NA,NA,NA,NA,5.3,0,NA,NA,NA,NA,NA,NA,3.8,1.8,4.1,0,1.3,4.94,2.34,5.33,0,"x",0,0,0,0,0,0,0,0,0,0.770440251572326,NA,NA,NA,NA,NA,4.2,5.33333333333333,2.78077834063182,6.95194585157955,0,NA,NA,NA,NA,NA,7.1,8.7,NA,NA,0.1,0.1,5.3,6.2,4.7,5.5,5.4,0.7,NA,0,0.4,0,0,1,0,16.8,4.5,16.3,7.9,3,0,3.9,2.1,3.7,3.125,0.8,1.14285714285714,"-6.6 %","High","NO DATA",NA,"No income support","High",10,NA,7,NA,NA,NA,NA,NA,NA,NA,NA,NA,NA,NA,NA,NA,NA,NA,NA,NA,NA,NA,NA,NA,"Unemployment rate","Unemployment rate can be defined by either the national definition, the ILO harmonized definition, or the OECD harmonized definition. The OECD harmonized unemployment rate gives the number of unemployed persons as a percentage of the labor force (the total number of people employed plus unemployed). [OECD Main Economic Indicators, OECD, monthly] As defined by the International Labour Organization, unemployed workers are those who are currently not working but are willing and able to work for pay, currently available to work, and have actively searched for work. [ILO, http://www.ilo.org/public/english/bureau/stat/res/index.htm]","Percent of total labor force",NA,NA,NA,NA,NA,NA,NA,NA,NA,NA,"0",NA,NA,NA,NA,NA,NA,NA,NA,NA,NA,NA,NA,NA,NA,NA,NA,NA,NA,NA,NA,NA,NA,NA,NA,NA,NA,NA,NA,NA,NA,NA,NA,NA,0,0,0,0,0,0.4
"93","Azerbaijan","AZE",34.2,7.16,0,0.7,NA,NA,1,NA,0.6,7.14285714285711,-16.7926341990851,-71.3939339108407,0,0,67.87,3.057,10,10,20210106,NA,70,NA,12.5,NA,78.85,NA,NA,1.53846153846154,8.75,3343,3298,10139.175,2703,45,4.43823092115483,23.6773954864965,2.36773954864965,4,NA,"574.1","High","80","Low","Total border closure","Low","Require closing (or prohibit most people from using it)","Low","Require not leaving house with exceptions for daily exercise, grocery shopp ...","Medium","Government is replacing less than 50% of lost salary (or if a flat sum, it  ...","Medium","0","High","-4.0 %","High","6.5 %","Medium","3.0 %","Low","Partially open","Medium","NO DATA",NA,"NO DATA",NA,"Coordinated public information campaign (e.g. across traditional and social ...","Low","Testing of anyone showing COVID-19 symptoms","Medium","Comprehensive contact tracing - done for all cases","Low","-98.40%","Low",0,"Low",0,"Low",1.3,"Low","NO DATA",NA,"NO CRISIS","Low",5,0,0.335,4.23444976076555,NA,NA,NA,NA,NA,NA,NA,NA,NA,NA,NA,NA,NA,NA,NA,NA,NA,NA,NA,NA,NA,NA,NA,0,NA,NA,0.06,0.05,NA,0.05,7,NA,NA,NA,NA,NA,-1.366,5.547,8.4,-12.8,-9.7,-21.2,10,4.1,7.14801444043321,8.75,6.07195459074431,1.95901544177406,0,0,1,0.42398931546925,1,-0.508057644989272,7.63705457075095,4,4.76190476190476,0,0,10,10,10,3,4,4,0,0.6,0,3.6,3.66666666666667,1.05,2.35833333333333,2.4390243902439,0.2,1.5,2.2,-2.6,2.2,-4.8,"2.3","-2.2","0.7",-4.5,9.6,9,6.8,0.249000000000001,0,0,0.5,0,0,0,0.5,0.5,0,0.5,2.38095238095238,21.7,21.7,NA,NA,NA,NA,NA,NA,4.9,0,5.3,0,4.1,20.09,0,21.73,0,"0",20.09,0,21.73,0,20.09,0,21.73,0,2.89507037555867,3.63556953179595,NA,NA,NA,NA,NA,4.9,6.5,3.53845681626699,8.84614204066747,0,64.6436151,2.57451897,7.7,0,7.7,6.9,5.6,NA,6.4,3.4,3.4,5.6,5.5,3.1,4.3,4.9,2.9,NA,0,1.5,0,0,6,2.2,22.2,8.1,6.1,2.3,5,1.2,4.2,4.4,4.7,7.29166666666667,2.6,3.71428571428571,"-4.0 %","High","6.5 %","Medium","Government is replacing less than 50% of lost salary (or if a flat sum, it  ...","Medium",10,7,0,NA,NA,NA,NA,NA,NA,NA,NA,NA,NA,NA,NA,NA,NA,NA,NA,NA,NA,NA,NA,NA,"Unemployment rate","Unemployment rate can be defined by either the national definition, the ILO harmonized definition, or the OECD harmonized definition. The OECD harmonized unemployment rate gives the number of unemployed persons as a percentage of the labor force (the total number of people employed plus unemployed). [OECD Main Economic Indicators, OECD, monthly] As defined by the International Labour Organization, unemployed workers are those who are currently not working but are willing and able to work for pay, currently available to work, and have actively searched for work. [ILO, http://www.ilo.org/public/english/bureau/stat/res/index.htm]","Percent of total labor force",NA,4.961,4.944,4.848,6.541,5.755,5.69,5.627,5.564,5.501,"1.693",1.693,3.386,0,NA,NA,NA,NA,NA,NA,NA,NA,NA,NA,NA,NA,NA,NA,NA,NA,NA,NA,NA,NA,NA,NA,NA,NA,NA,NA,NA,NA,NA,NA,0,0,0,0,0,0.3
"94","Bahrain","BHR",39.4,6.12,0,0.8,NA,NA,0.8,0.4,0.5,4.76190476190474,-28.2051282051282,47.3929604006329,0,3.15953069337553,153.303,0.084,10,0.42,20210106,NA,67.22,NA,87.5,NA,64.1,NA,NA,1.96615384615385,1.25,353,353,1701.583,352,0,0,0.284090909090921,0.0284090909090917,3.9,NA,"143.6","High","51","Medium","Screening","Medium","No measures","High","Recommend not leaving house","Medium","Government is replacing more than 50% of lost salary (or if a flat sum, it  ...","Low","2","Low","-4.9 %","High","4.9 %","Low","0.0 %","Medium","Partially open","Medium","NO DATA",NA,"NO DATA",NA,"Coordinated public information campaign (e.g. across traditional and social ...","Low","Open public testing (eg “drive through” testing available to asymptomatic p ...","Low","Comprehensive contact tracing - done for all cases","Low","NO DATA",NA,0.1,"Low",0,"Low",0,"Low","NO DATA",NA,"NO CRISIS","Low",4.75,0,0.18,0.526315789473683,NA,NA,NA,NA,NA,NA,NA,NA,NA,NA,NA,NA,NA,NA,NA,NA,NA,NA,NA,NA,NA,NA,NA,0,NA,NA,0.04,0.05,NA,0.05,7,NA,NA,NA,NA,NA,-14.234,-11.944,-10.6,-15.7,-11.9,-5.1,10,4.2,7.07581227436823,1.25,7.03316732183504,52.2685185185185,40,28,1,0,0,1.39204472021617,3.64554575762689,NA,NA,0,0,5,3.46761710285793,5,6,3,3,NA,0.2,NA,3.3,4,1.75,2.875,4.76547842401501,4.3,1.8,1.8,-4.5,2.3,-6.3,"1.8","-3.6","3",-5.4,10,10,6.6,0,NA,NA,NA,NA,NA,NA,NA,NA,NA,NA,NA,0.1,0,NA,NA,NA,NA,NA,NA,0.1,0,0,0,1.1,0.11,0,0,0,"x",0,0,0,0,0,0,0,0,0,0,NA,NA,NA,NA,NA,0.9,0,1.36426160182137,3.41065400455341,0,NA,NA,NA,NA,NA,10,8.9,NA,NA,0,0,6.3,8,10,9,7.7,1.1,NA,NA,1.1,0,0,2,0,11.3,0.9,15.6,7.6,5,0.2,3.4,2.3,5,8.54166666666667,1.3,1.85714285714286,"-4.9 %","High","4.9 %","Low","Government is replacing more than 50% of lost salary (or if a flat sum, it  ...","Low",10,0,3,NA,NA,NA,NA,NA,NA,NA,NA,NA,NA,NA,NA,NA,NA,NA,NA,NA,NA,NA,NA,NA,"Unemployment rate","Unemployment rate can be defined by either the national definition, the ILO harmonized definition, or the OECD harmonized definition. The OECD harmonized unemployment rate gives the number of unemployed persons as a percentage of the labor force (the total number of people employed plus unemployed). [OECD Main Economic Indicators, OECD, monthly] As defined by the International Labour Organization, unemployed workers are those who are currently not working but are willing and able to work for pay, currently available to work, and have actively searched for work. [ILO, http://www.ilo.org/public/english/bureau/stat/res/index.htm]","Percent of total labor force",NA,3.58,3.932,4,4.897,3.912,3.831,3.807,3.784,3.749,"0.897",0.897,1.794,NA,NA,NA,NA,NA,NA,NA,NA,NA,NA,NA,NA,NA,NA,NA,NA,NA,NA,NA,NA,NA,NA,NA,NA,NA,NA,NA,NA,NA,NA,NA,0,0,0,0,0,0.3
"95","Bangladesh","BGD",35,7,0,0.4,NA,NA,0.8,0.5,0.4,2.38095238095237,-21.9489148087997,-32.3067649429274,0,0,5.776,0.14,1.1552,0.700000000000001,20210106,NA,69.17,NA,50,NA,72.12,NA,NA,1.66615384615385,5,8552,8444,164689.383,7599,108,0.655779978239399,12.5411238320832,1.25411238320832,5.2,NA,"17.3","Low","80","Low","Ban on high-risk regions","Medium","Require closing (or prohibit most people from using it)","Low","Require not leaving house with exceptions for daily exercise, grocery shopp ...","Medium","No income support","High","2","Low","3.8 %","Low","NO DATA",NA,"5.6 %","High","Closed due to COVID-19","High","NO DATA",NA,"NO DATA",NA,"Coordinated public information campaign (e.g. across traditional and social ...","Low","Testing of anyone showing COVID-19 symptoms","Medium","Limited contact tracing - not done for all cases","Medium","-36.36%","Low",0,"Low",0,"Low",4.4,"Medium","No hotspot","Low","High","High",8,0,0.494,8.03827751196172,NA,NA,NA,NA,NA,NA,NA,NA,NA,NA,NA,NA,NA,NA,NA,NA,NA,NA,NA,NA,NA,NA,NA,10,NA,NA,0.06,0.05,NA,0.05,7,NA,"Low","Low","May-20",3,-3.34,-4.641,-5.2,-6.4,-6,-1.2,2.4,NA,NA,5,2.0585083573487,20.8333333333333,76.3636363636364,2.72876080691643,1,0,1,1.21562868723123,4.01613955474562,3.5,7.14285714285714,0,0,5,3.22689795763573,5,NA,NA,0,3,1.1,NA,2,0,2.03333333333333,1.01666666666667,0,7.3,7.9,8.2,1.6,1,-6.6,"7.9","2","9.5",-5.9,10,10,10,3.753,0,0.5,0.5,0,1,0,0,0,1,2,9.52380952380952,58,58,"Hot","Dry",NA,1,3,NA,10,6.9,5,0,5.8,58,40.02,29,0,"0",58,40.02,29,0,58,40.02,43.5,0,7.73797611900474,9.97728860936408,NA,NA,NA,NA,NA,8.2,10,3.66925901856961,9.17314754642402,0,17.77090749,9.120266873,2,1.3,2,10,3.7,5.5,6.2,0.8,0.8,5.2,9.3,1.8,5.6,5.4,5.8,8.4,1.5,5.2,0.8,0.4,5,1.7,21.6,7.7,9.2,4,4,4,4.9,4.1,4.7,7.29166666666667,4.8,6.85714285714286,"3.8 %","Low","NO DATA",NA,"No income support","High",0,NA,7,"BGDPOV1","International poverty rate ($1.9 in 2011 PPP)",13.850406584642,13.2160593932261,12.553418696809,21.853418696809,21.7666020095565,21.3994660236571,"16:43:10  5 Oct 2020","SAR",164689.383,8.41001789692906e-05,8.02483994564853e-05,7.62248207391063e-05,0.000132694763309721,0.000132167609186784,0.000129938345956747,74.0834048844717,0.00564699425706149,10,1.1293988514123,"Unemployment rate","Unemployment rate can be defined by either the national definition, the ILO harmonized definition, or the OECD harmonized definition. The OECD harmonized unemployment rate gives the number of unemployed persons as a percentage of the labor force (the total number of people employed plus unemployed). [OECD Main Economic Indicators, OECD, monthly] As defined by the International Labour Organization, unemployed workers are those who are currently not working but are willing and able to work for pay, currently available to work, and have actively searched for work. [ILO, http://www.ilo.org/public/english/bureau/stat/res/index.htm]","Percent of total labor force",NA,NA,NA,NA,NA,NA,NA,NA,NA,NA,"0",NA,NA,0,NA,NA,NA,NA,NA,NA,NA,NA,NA,NA,NA,NA,NA,NA,NA,NA,NA,NA,NA,NA,NA,NA,NA,NA,NA,NA,NA,NA,NA,NA,0,0,0,0,0,0.3
"96","Bhutan","BTN",40.3,5.94,1,0.7,NA,NA,1,NA,0.9,10,NA,NA,NA,NA,18.144,0,3.6288,0,20210106,NA,76.94,NA,75,NA,77.24,NA,NA,0.470769230769232,2.5,0,0,771.612,0,0,0,NA,NA,4.2,NA,"5.5","Low","82","Low","Ban on high-risk regions","Medium","Require closing (or prohibit most people from using it)","Low","Require not leaving house with exceptions for daily exercise, grocery shopp ...","Medium","Government is replacing less than 50% of lost salary (or if a flat sum, it  ...","Medium","2","Low","0.6 %","Medium","NO DATA",NA,"3.6 %","Medium","Partially open","Medium","NO DATA",NA,"NO DATA",NA,"Coordinated public information campaign (e.g. across traditional and social ...","Low","Testing of anyone showing COVID-19 symptoms","Medium","Comprehensive contact tracing - done for all cases","Low","NO DATA",NA,0,"Low",0,"Low",0,"Low","NO DATA",NA,"NO CRISIS","Low",5.5,0,0.45,6.98564593301436,NA,NA,NA,NA,NA,NA,NA,NA,NA,NA,NA,NA,NA,NA,NA,NA,NA,NA,NA,NA,NA,NA,NA,0,NA,NA,0.09,NA,NA,0.09,7,NA,"Moderate","…","Oct-18",7,-4.786,-3.287,0.6,-5.5,-5.9,-6.2,10,2,8.66425992779783,2.5,1.68543279380718,0,22.2222222222222,1.37227304714989,1,0,0,-1.32855416554491,9.36065596871108,4.5,2.38095238095238,0,0,5,NA,5,NA,NA,NA,0,1.3,5,2.9,NA,2.3,2.3,2.17636022514071,6.3,3.8,3.9,1.5,1.8,-2.4,"5.3","2.7","2.9",-2.6,4.8,5.2,8.1,4.269,NA,NA,NA,NA,NA,NA,NA,NA,NA,NA,NA,17.9,17.9,NA,NA,NA,NA,NA,NA,5.1,0,0,0,3.5,17.85,0,0,0,"0",17.85,0,0,0,17.85,0,0,0,2.3880995263825,2.97169811320755,NA,NA,NA,NA,NA,3.5,4.16666666666667,3.41347367369015,8.53368418422539,0,NA,NA,NA,NA,NA,4.3,4.1,NA,NA,0,0,2.8,1.8,0.3,1.1,1.9,5.8,7.8,0.2,4.6,0,0,6,2.2,23.3,8.9,10.3,4.6,5,2.4,5.2,4.9,3.4,1.875,5.2,7.42857142857143,"0.6 %","Medium","NO DATA",NA,"Government is replacing less than 50% of lost salary (or if a flat sum, it  ...","Medium",7,NA,0,"BTNPOV1","International poverty rate ($1.9 in 2011 PPP)",1.54260800211585,1.42226415182929,1.29375143507354,1.29375143507354,1.26357596009834,1.1682006639692,"16:43:10  5 Oct 2020","SAR",771.612,0.00199920167404842,0.00184323747146142,0.00167668651482032,0.00167668651482032,0.00163757945716026,0.00151397420461217,0,0,0,0,"Unemployment rate","Unemployment rate can be defined by either the national definition, the ILO harmonized definition, or the OECD harmonized definition. The OECD harmonized unemployment rate gives the number of unemployed persons as a percentage of the labor force (the total number of people employed plus unemployed). [OECD Main Economic Indicators, OECD, monthly] As defined by the International Labour Organization, unemployed workers are those who are currently not working but are willing and able to work for pay, currently available to work, and have actively searched for work. [ILO, http://www.ilo.org/public/english/bureau/stat/res/index.htm]","Percent of total labor force",NA,3.138,NA,NA,NA,NA,NA,NA,NA,NA,"#VALUE!",NA,NA,NA,NA,NA,NA,NA,NA,NA,NA,NA,NA,NA,NA,NA,NA,NA,NA,NA,NA,NA,NA,NA,NA,NA,NA,NA,NA,NA,NA,NA,NA,NA,0,0,0,0,0,0.5
"97","Burundi","BDI",22.8,9.44,1,0.3,NA,NA,0.8,0,0.5,4.76190476190474,-100,40.190883830103,0,2.6793922553402,0.396,0,0.0792000000000002,0,20210106,NA,21.11,NA,37.5,NA,18.59,NA,NA,9.06,6.25,2,2,11890.781,2,0,0,0,0,6.5,NA,"0.4","Low","15","High","Quarantine arrivals from high-risk regions","Medium","No measures","High","No measures","High","Government is replacing less than 50% of lost salary (or if a flat sum, it  ...","Medium","1","Medium","-3.2 %","High","NO DATA",NA,"7.6 %","High","Fully open","Low","1,334,629","High","NO DATA",NA,"Public officials urging caution about COVID-19","Medium","Only those who both (a) have symptoms AND (b) meet specific criteria (eg ke ...","Medium","Limited contact tracing - not done for all cases","Medium","-70.00%","Low",3.7,"Medium",0,"Low",3.4,"Medium","No hotspot","Low","Medium","High",10,10,0.573,9.92822966507177,NA,NA,NA,NA,NA,NA,NA,NA,NA,NA,NA,NA,NA,NA,NA,NA,NA,NA,NA,NA,NA,NA,NA,0,NA,NA,0.12,0.15,NA,0.15,7,NA,"High","…","Apr-15",10,-7.201,-5.274,-6,-9,-6.8,-3,6,4.7,6.71480144404332,6.25,2.75,0,0,0,0,0,0,-3.68876770815031,10,2.5,10,10,0,1.81763658099458,6.27510028038422,6.27510028038422,4,4,0,0,0.2,NA,5.3,2.66666666666667,1.83333333333333,2.25,1.95121951219512,0.5,1.6,1.8,1,2.3,-0.8,"1.8","-5.5","4.2",-7.3,1.6,10,1.1,0,NA,NA,NA,NA,NA,NA,NA,NA,NA,NA,NA,32.8,32.8,NA,NA,NA,NA,NA,NA,3.7,0,4.9,0,6.7,24.79,0,32.83,0,"0",24.79,0,32.83,0,24.79,0,32.83,0,4.37595890867854,5.57477288609364,NA,NA,NA,NA,NA,3.6,4.33333333333333,2.58666719213051,6.46666798032627,0,NA,NA,NA,NA,NA,8.8,1.3,5.4,7.1,1.2,1.2,4.8,10,2.3,6.2,5.5,9.7,9.7,7.2,8.9,14.7,7.4,2,0,22.9,8.6,5.1,1.7,6,2.1,4.6,6.7,6.1,10,7.1,10,"-3.2 %","High","NO DATA",NA,"Government is replacing less than 50% of lost salary (or if a flat sum, it  ...","Medium",10,NA,0,"BDIPOV1","International poverty rate ($1.9 in 2011 PPP)",81.149930860692,82.3437630067136,83.4099029788549,84.9859029028828,85.5741049234649,85.9368642719069,"16:43:10  5 Oct 2020","SSA",11890.781,0.0068246089857926,0.00692500879519298,0.00701466985043749,0.00714720949808788,0.00719667656173845,0.00722718417502659,1.88946380195101,0.0132539647650387,0.377892760390202,2.65079295300775,"Unemployment rate","Unemployment rate can be defined by either the national definition, the ILO harmonized definition, or the OECD harmonized definition. The OECD harmonized unemployment rate gives the number of unemployed persons as a percentage of the labor force (the total number of people employed plus unemployed). [OECD Main Economic Indicators, OECD, monthly] As defined by the International Labour Organization, unemployed workers are those who are currently not working but are willing and able to work for pay, currently available to work, and have actively searched for work. [ILO, http://www.ilo.org/public/english/bureau/stat/res/index.htm]","Percent of total labor force",NA,NA,NA,NA,NA,NA,NA,NA,NA,NA,"0",NA,NA,NA,NA,NA,NA,NA,NA,NA,NA,NA,NA,NA,NA,NA,NA,NA,NA,NA,NA,NA,NA,NA,NA,NA,NA,NA,NA,NA,NA,NA,NA,NA,0,0,0,0,0,0.3
"98","Cambodia","KHM",39.2,6.16,1,0.2,NA,NA,0.5,0.8,0.6,7.14285714285711,NA,NA,NA,NA,0.162,0,0.0324000000000009,0,20210106,NA,43.06,NA,0,NA,49.68,NA,NA,5.68307692307692,10,0,0,16718.971,0,0,0,NA,NA,4.9,NA,"0.2","Low","43","Medium","Quarantine arrivals from high-risk regions","Medium","No measures","High","Recommend not leaving house","Medium","Government is replacing more than 50% of lost salary (or if a flat sum, it  ...","Low","1","Medium","-2.8 %","High","NO DATA",NA,"2.5 %","Low","Fully open","Low","NO DATA",NA,"NO DATA",NA,"Coordinated public information campaign (e.g. across traditional and social ...","Low","Only those who both (a) have symptoms AND (b) meet specific criteria (eg ke ...","Medium","Limited contact tracing - not done for all cases","Medium","-100.00%","Low",0,"Low",0.1,"Low",3.9,"Medium","No hotspot","Low","NO CRISIS","Low",7.25,0,0.548,9.33014354066986,NA,NA,NA,NA,NA,NA,NA,NA,NA,NA,NA,NA,NA,NA,NA,NA,NA,NA,NA,NA,NA,NA,NA,0,NA,NA,NA,NA,NA,NA,NA,NA,"Low","Low","Dec-19",3,-0.775,0.717,0.4,-1.9,-1.7,-2.3,4.6,2,8.66425992779783,10,2.7085671530116,30.9090909090909,27.0833333333333,2.24466891133558,1,0,0,-0.503503015631738,7.62748674769361,4,4.76190476190476,0,0,5,3.83230056285631,5,NA,NA,6,3,0.8,5,3.8,6,3.15,4.575,10,7,7.5,7.1,-1,6,-8.1,"7","-1.6","6.1",-8.6,10,10,10,0.292999999999999,NA,NA,NA,NA,NA,NA,NA,NA,NA,NA,NA,40.9,40.9,NA,NA,NA,NA,NA,NA,9.5,4,4.6,0,4.3,40.85,17.2,19.78,0,"0",40.85,17.2,19.78,0,40.85,17.2,19.78,0,5.45660729771196,6.98986722571628,NA,NA,NA,NA,NA,5.8,8,2.91896021136289,7.29740052840723,0,3.085970529,12.5388145,0.2,2,0.2,6.5,2.3,5.3,6.5,0,0,4.1,2.9,1.8,2.4,3.2,6.4,8.1,NA,7.3,0,0,5,1.7,21.1,7.4,6.4,2.4,4,5.9,4.9,4.1,3.7,3.125,5.8,8.28571428571428,"-2.8 %","High","NO DATA",NA,"Government is replacing more than 50% of lost salary (or if a flat sum, it  ...","Low",10,NA,3,NA,NA,NA,NA,NA,NA,NA,NA,NA,NA,NA,NA,NA,NA,NA,NA,NA,NA,NA,NA,NA,"Unemployment rate","Unemployment rate can be defined by either the national definition, the ILO harmonized definition, or the OECD harmonized definition. The OECD harmonized unemployment rate gives the number of unemployed persons as a percentage of the labor force (the total number of people employed plus unemployed). [OECD Main Economic Indicators, OECD, monthly] As defined by the International Labour Organization, unemployed workers are those who are currently not working but are willing and able to work for pay, currently available to work, and have actively searched for work. [ILO, http://www.ilo.org/public/english/bureau/stat/res/index.htm]","Percent of total labor force",NA,NA,NA,NA,NA,NA,NA,NA,NA,NA,"0",NA,NA,NA,70.8815689086914,13.9784736633301,99.4088439941406,74.7147750854492,4.9955415725708,NA,4.5732889175415,75.301025390625,NA,20.0465259552002,9.85770702362061,16.6955299377441,NA,NA,10,2.79569473266602,0.295578002929688,10,1.99821662902832,NA,1.8293155670166,10,NA,8.01861038208008,9.35230573018392,8.34776496887207,NA,NA,6.26374860127767,8.52749720255534,0,0,0,0,0,0.5
