"","Countryname","Country","H_HIS_Score","H_HIS_Score_norm","H_cases_controlled","H_test_and_trace","H_high_vulnerability","H_workplace_prevention","H_manage_imported_cases","H_community_understanding","H_Oxrollback_score","H_Oxrollback_score_norm","H_Covidgrowth_biweeklydeaths","H_Covidgrowth_biweeklycases","H_Covidgrowth_deathsnorm","H_Covidgrowth_casesnorm","H_new_cases_smoothed_per_million","H_new_deaths_smoothed_per_million","H_new_cases_smoothed_per_million_norm","H_new_deaths_smoothed_per_million_norm","H_Date","H_GovernmentResponseIndex","H_GovernmentResponseIndexForDisplay","H_EconomicSupportIndex","H_EconomicSupportIndexForDisplay","H_ContainmentHealthIndex","H_ContainmentHealthIndexForDisplay","H_E1_Income.support","H_E1_Flag","H_GovernmentResponseIndexForDisplay_norm","H_EconomicSupportIndexForDisplay_norm","H_w8forecast","H_w7forecast","H_Population","H_current","H_week_increase","H_new_death_per_m","H_add_death_prec_current","H_add_death_prec_current_norm","H_INFORM_rating.Value","H_INFORM_rating.Rating","H_covid_case_rate.Value","H_covid_case_rate.Rating","H_legal_stringency.Value","H_legal_stringency.Rating","H_international_travel.Value","H_international_travel.Rating","H_internal_movement.Value","H_internal_movement.Rating","H_stay_home.Value","H_stay_home.Rating","H_income_support.Value","H_income_support.Rating","H_debt_relief.Value","H_debt_relief.Rating","H_gdp_change.Value","H_gdp_change.Rating","H_unemployment.Value","H_unemployment.Rating","H_inflation.Value","H_inflation.Rating","H_school_close.Value","H_school_close.Rating","H_ipc_3_plus.Value","H_ipc_3_plus.Rating","H_growth_events.Value","H_growth_events.Rating","H_public_info.Value","H_public_info.Rating","H_testing_policy.Value","H_testing_policy.Rating","H_contact_trace.Value","H_contact_trace.Rating","H_growth_conflict.Value","H_growth_conflict.Rating","H_seasonal_flood.Value","H_seasonal_flood.Rating","H_seasonal_cyclone.Value","H_seasonal_cyclone.Rating","H_seasonal_exposure.Value","H_seasonal_exposure.Rating","H_ASAP_hotspot.Value","H_ASAP_hotspot.Rating","H_INFORM_severity.Value","H_INFORM_severity.Rating","H_INFORM_rating.Value_norm","H_wmo_don_alert","F_Proteus_Score","F_Proteus_Score_norm","country","F_admin_code","F_year_month","F_year","F_month","F_pop_source","F_countrypop","F_totalipc3plusabsfor","F_totalipc3pluspercfor","F_totalipc4plusabsfor","F_totalipc4pluspercfor","F_totalipc3plusabsnow","F_totalipc3pluspercnow","F_totalipc4plusabsnow","F_totalipc4pluspercnow","F_pctchangeipc3for","F_pctchangeipc4for","F_pctchangeipc3now","F_pctchangeipc4now","F_diffactfor","F_fshighrisk","F_max_ipc","F_fews_crm_norm","F_fpv_alt","F_Artemis_Score","F_Artemis_Score_norm","F_Apr","F_May","F_June","F_fpv","F_fpv_rating","F_fao_wfp_warning","D_WB_external_debt_distress","D_overall_debt_distress","D_debt_date","D_WB_external_debt_distress_norm","D_IMF_debt2017","D_IMF_debt2018","D_IMF_debt2019","D_IMF_debt2020","D_IMF_debt2021","D_IMF_debt2020.2019","D_IMF_debt2020.2019_norm","D_fiscalgdpnum","D_fiscalgdpnum_norm","D_EconomicSupportIndexForDisplay_norm","D_fiscal","D_ratecut","D_reserve_req","D_macrofin","D_othermonetary","D_bopgdp","D_otherbop","D_CESI_Index","D_CESI_Index_norm","D_CPIA.scores","D_CPIA.scores_norm","Fr_FCS_Normalised","Fr_REIGN_Normalised","Fr_Displaced_UNHCR_Normalised","Fr_BRD_Normalised","Fr_Overall_Conflict_Risk_Score","M_Fuel_Imports_perc","M_Food_Imports_perc","M_Travel_Tourism_perc","M_Remittance_perc","M_Reserves","M_ODA_perc","M_Gsavings_perc","M_Economic_Dependence_Score","M_Financial_Resilience_Score","M_Economic_and_Financial_score","M_Economic_and_Financial_score_norm","M_GDP_WB_2017","M_GDP_WB_2018","M_GDP_WB_2019","M_GDP_WB_2020","M_GDP_WB_2021","M_GDP_WB_2019minus2020","M_GDP_IMF_2019","M_GDP_IMF_2020","M_GDP_IMF_2021","M_GDP_IMF_2019minus2020","M_GDP_WB_2019minus2020_norm","M_GDP_IMF_2019minus2020_norm","M_mean_gdp_20_21_diff_norm","M_mean_gdp_imf_20_21_diff_norm","M_Spillover.risks.from.the.external.environment.outside.the.region","M_Macroeconomic.risks","M_Banking.risks","M_Public.sector.risks","M_Corporate.sector.risks","M_Household.risks","M_Market.and.liquidity.risks","M_Monetary.and.financial.conditions","M_Risk.appetite","M_macrofin_risk","M_macrofin_risk_norm","NH_UKMO_TOTAL.RISK.NEXT.12.MONTHS","NH_UKMO_TOTAL.RISK.NEXT.6.MONTHS","NH_UKMO_Temperature","NH_UKMO_Rainfall","NH_UKMO_Tropical.Cyclone","NH_UKMO_Temperature..1.Warmer..5.Near.normal.","NH_UKMO_Rainfall..2.Wetter..3.Drier..5.Near.normal.","NH_UKMO_Tropical.Cyclone..5.TC.forecast.","NH_UKMO_INFORM_RISK_Flood","NH_UKMO_INFORM_RISK_Tropical.Cyclone.1","NH_UKMO_INFORM_RISK_Drought","NH_UKMO_INFORM_RISK_Locust..based.on.FAO.forecasts.","NH_INFORM_RISK_UKMO_Vuln","NH_UKMO_INFORM_OCCURENCExRISK12m_Flood","NH_UKMO_INFORM_OCCURENCExRISK12m_Tropical.Cyclone","NH_UKMO_INFORM_OCCURENCExRISK12m_Drought","NH_UKMO_INFORM_OCCURENCExRISK12m_Locust","NH_UKMO_X","NH_UKMO_INFORM_OCCURENCExRISK6m_Flood","NH_UKMO_INFORM_OCCURENCExRISK6m_Tropical.Cyclone","NH_UKMO_INFORM_OCCURENCExRISK6m_Drought","NH_UKMO_INFORM_OCCURENCExRISK6m_Locust","NH_UKMO_INFORM_OCCURENCExRISK6mplusCLIMATE_Flood","NH_UKMO_OCCURENCExRISK6mplusCLIMATE_Tropical.Cyclone","NH_UKMO_OCCURENCExRISK6mplusCLIMATE_Drought","NH_UKMO_OCCURENCExRISK6mplusCLIMATE_Locust","NH_UKMO_TOTAL.RISK.NEXT.6.MONTHS_norm","NH_UKMO_TOTAL.RISK.NEXT.12.MONTHS_norm","NH_GDAC_Date","NH_GDAC_Hazard_Status","NH_GDAC_Hazard_Severity","NH_GDAC_Hazard_Type","NH_GDAC_Hazard_Score_Norm","NH_Hazard_Score","NH_Hazard_Score_norm","NH_multihazard_risk","NH_multihazard_risk_norm","NH_seasonal_risk_norm","S_OCHA_Added.Social.Protection.coverage","S_OCHA_Added.SP.adequacy","S_OCHA_Added.Social.Protection.coverage.1","S_OCHA_Added.SP.adequacy.1","S_OCHA_SP.Index","S_OCHA_Population.density","S_OCHA_Population.living.in.urban.areas","S_OCHA_Population.living.in.slums....of.urban.population.","S_OCHA_household.size","S_OCHA_IDP..refugees.and.returnees...percentage.of.population.","S_OCHA_Displaced.population","S_OCHA_Density.Index","S_OCHA_Access.to.cities","S_OCHA_Internal.connectedness..Road.density.","S_OCHA_Movement","S_OCHA_Transmission","S_OCHA_Human.Development.Index","S_OCHA_Multidimensional.Poverty.Index","S_OCHA_Poverty","S_OCHA_Poverty.index","S_OCHA_food.insecurity.as.percenatge.of.population","S_OCHA_Food.insecurity.score","S_OCHA_Population.age.65.....","S_OCHA_Demography","S_OCHA_Probability.....of.dying.between.30.70.from.cardiovasular.disease..cancer..diabetes.or.chronic.respiratory.disease","S_OCHA_known.co.mortality.risk.factors","S_OCHA_Diabetes.prevalance","S_OCHA_Diabetes.prevalence","S_OCHA_Age.Standardized.Prevalence.of.CVD","S_OCHA_Incidence.of.Tuberculosis","S_OCHA_Comorbidities","S_OCHA_Risk.factors","S_OCHA_Covid.vulnerability.index","S_OCHA_Covid.vulnerability.index_norm","S_INFORM_vul","S_INFORM_vul_norm","S_gdp_change.Value","S_gdp_change.Rating","S_unemployment.Value","S_unemployment.Rating","S_income_support.Value","S_income_support.Rating","S_gdp_change.Rating_norm","S_unemployment.Rating_norm","S_income_support.Rating_crm_norm","S_Indicator","S_Label","S_y2017","S_y2018","S_y2019","S_y2020","S_y2021","S_y2022","S_runtime","S_region","S_Population","S_y2017_prop","S_y2018_prop","S_y2019_prop","S_y2020_prop","S_y2021_prop","S_y2022_prop","S_pov_prop_19_20","S_pov_abs_19_20","S_pov_prop_19_20_norm","S_pov_abs_19_20_norm","S_Subject.Descriptor","S_Subject.Notes","S_Units","S_Scale","S_X2017","S_X2018","S_X2019","S_X2020","S_X2021","S_X2022","S_X2023","S_X2024","S_X2025","S_Change.in.unemployement.rate.2019.to.2020","S_change_unemp","S_change_unemp_norm","S_Household.risks","S_..of.respondents.currently.employed.working","S_..of.respondents.who.have.stopped.working.since.COVID.19.outbreak","S_..able.to.access..staple.food.item..in.the.past.7.days.when.needed....any.staple.food","S_..of.HHs.that.saw.reduced.their.remittances","S_..of.HHs.not.able.to.perform.normal.farming.activities..crop..livestock..fishing.","S_..of.HHs.able.to.pay.rent.for.the.next.month","S_..of.respondents.who.were.not.able.to.work.as.usual.last.week","S_Experienced.decrease.in.wage.income....HHs.with.wage.income.as.a.source.of.livelihood.in.the.past.12.months.","S_..of.HHs.that.experienced.change.in.total.income...decrease","S_..of.HHs.used.money.saved.for.emergencies.to.cover.basic.living.expenses","S_..of.respondents.received.government.assistance.when.experiencing.labor.income.job.loss","S_..of.HHs.sold.assets.such.as.property.during.the.pandemic.in.order.to.pay.for.basic.living.expenses","S_In.the.last.30.days..you.skipped.a.meal.because.there.was.not.enough.money.or.other.resources.for.food....","S_In.the.last.30.days..your.household.worried.about.running.out.of.food.because.of.a.lack.of.money.or.other.resources....","S_..of.respondents.currently.employed.working_norm","S_..of.respondents.who.have.stopped.working.since.COVID.19.outbreak_norm","S_..able.to.access..staple.food.item..in.the.past.7.days.when.needed....any.staple.food_norm","S_..of.HHs.that.saw.reduced.their.remittances_norm","S_..of.HHs.not.able.to.perform.normal.farming.activities..crop..livestock..fishing._norm","S_..of.HHs.able.to.pay.rent.for.the.next.month_norm","S_..of.respondents.who.were.not.able.to.work.as.usual.last.week_norm","S_Experienced.decrease.in.wage.income....HHs.with.wage.income.as.a.source.of.livelihood.in.the.past.12.months._norm","S_..of.HHs.that.experienced.change.in.total.income...decrease_norm","S_..of.HHs.used.money.saved.for.emergencies.to.cover.basic.living.expenses_norm","S_..of.respondents.received.government.assistance.when.experiencing.labor.income.job.loss_norm","S_..of.HHs.sold.assets.such.as.property.during.the.pandemic.in.order.to.pay.for.basic.living.expenses_norm","S_In.the.last.30.days..you.skipped.a.meal.because.there.was.not.enough.money.or.other.resources.for.food...._norm","S_In.the.last.30.days..your.household.worried.about.running.out.of.food.because.of.a.lack.of.money.or.other.resources...._norm","S_phone_average_index","S_phone_average_index_norm","Fr_conflict_acaps","H_health_acaps","NH_natural_acaps","F_food_acaps","RELIABILITY_SCORE_EXISTING_RISK","RELIABILITY_SCORE_EMERGING_RISK"
"1","Libya","LBY",25.7,8.86,0,0.2,NA,NA,0.8,0.3,0.3,0,16.6554557247874,-15.89982018533,1.11036371498582,0,64.575,1.913,10,9.565,20210106,NA,54.44,NA,0,NA,62.82,NA,NA,3.93230769230769,10,2016,1959,6871.287,1487,57,8.29538920438049,35.5749831876261,3.55749831876261,4.3,NA,"123.2","High","79","Medium","Screening","Medium","Require closing (or prohibit most people from using it)","Low","Require not leaving house with exceptions for daily exercise, grocery shopp ...","Medium","No income support","High","0","High","-66.7 %","High","NO DATA",NA,"22.3 %","High","Partially open","Medium","NO DATA",NA,"NO DATA",NA,"Coordinated public information campaign (e.g. across traditional and social ...","Low","Only those who both (a) have symptoms AND (b) meet specific criteria (eg ke ...","Medium","No contact tracing","High","-71.43%","Low",0,"Low",0,"Low",3.8,"Medium","No hotspot","Low","Medium","Medium",5.75,0,0.301,3.42105263157895,NA,NA,NA,NA,NA,NA,NA,NA,NA,NA,NA,NA,NA,NA,NA,NA,NA,NA,NA,NA,NA,NA,NA,0,NA,NA,NA,NA,NA,NA,NA,NA,NA,NA,NA,NA,-43.464,-0.194,8.8,-7.2,-19.1,-16,10,1,9.38628158844765,10,1.694,0,0,0,0,0,0,-3.74362471535349,10,NA,NA,10,0,8.21138659515282,0,8.21138659515282,NA,NA,3,NA,10,NA,NA,3,10,6.5,10,NA,NA,NA,NA,NA,NA,"9.9","-58.7","80.7",-68.6,NA,10,NA,0,NA,NA,NA,NA,NA,NA,NA,NA,NA,NA,NA,25.5,0,"Hot",NA,NA,1,NA,NA,2.6,0,5,0,5.1,13.26,0,25.5,0,"x",0,0,0,0,0,0,0,0,0,4.29944095038435,NA,NA,NA,NA,NA,3.7,4.5,2.49146187923103,6.22865469807759,0,NA,NA,NA,NA,NA,1.9,8,NA,NA,4.8,4.8,4.9,6.8,0.3,3.6,4.2,3.9,2.6,NA,3.3,4.4,2.2,4,1.1,20.1,6.7,10.2,4.6,5,0.7,4.3,3.8,4,4.375,2.7,3.85714285714286,"-66.7 %","High","NO DATA",NA,"No income support","High",10,NA,7,NA,NA,NA,NA,NA,NA,NA,NA,NA,NA,NA,NA,NA,NA,NA,NA,NA,NA,NA,NA,NA,"Unemployment rate","Unemployment rate can be defined by either the national definition, the ILO harmonized definition, or the OECD harmonized definition. The OECD harmonized unemployment rate gives the number of unemployed persons as a percentage of the labor force (the total number of people employed plus unemployed). [OECD Main Economic Indicators, OECD, monthly] As defined by the International Labour Organization, unemployed workers are those who are currently not working but are willing and able to work for pay, currently available to work, and have actively searched for work. [ILO, http://www.ilo.org/public/english/bureau/stat/res/index.htm]","Percent of total labor force",NA,NA,NA,NA,NA,NA,NA,NA,NA,NA,"0",NA,NA,NA,NA,NA,NA,NA,NA,NA,NA,NA,NA,NA,NA,NA,NA,NA,NA,NA,NA,NA,NA,NA,NA,NA,NA,NA,NA,NA,NA,NA,NA,NA,10,0,0,0,0,0.5
"2","Sudan","SDN",26.2,8.76,0.1,0.6,NA,NA,0.8,NA,0.5,4.76190476190474,-100,-100,0,0,0,0,0,0,20210106,NA,27.78,NA,25,NA,28.21,NA,NA,8.03384615384615,7.5,1468,1468,43849.269,1468,0,0,0,0,5.8,NA,"8.8","Low","29","Medium","Ban on high-risk regions","Medium","No measures","High","No measures","High","Government is replacing less than 50% of lost salary (or if a flat sum, it  ...","Medium","0","High","-8.4 %","High","25.0 %","High","141.6 %","High","Closed due to COVID-19","High","6,380,766","High","NO DATA",NA,"Public officials urging caution about COVID-19","Medium","Only those who both (a) have symptoms AND (b) meet specific criteria (eg ke ...","Medium","Limited contact tracing - not done for all cases","Medium","-50.00%","Low",0,"Low",0,"Low",4.6,"Medium","Hotspot","High","Very High","High",9.5,10,0.576,10,"Sudan",624,"2020_10",2020,10,"GPW Version 4 Revision 11 (2018)",45255925.53269,9343038.25019,20.6448948733601,575858.875,1.27244966978752,4397108.15629,9.71609375906766,0,0,7.9439081145366,NA,-4.51444401578801,NA,10.9288011142925,"High risk",4,10,10,0.412665588,10,NA,NA,NA,NA,NA,10,"In distress","…","Dec-17",10,-6.473,-7.877,-10.8,-16.9,-20.6,-6.1,10,NA,NA,7.5,5.83033718783403,0,0,0,1,0,0,-1.61896156348176,9.97070925293823,1.5,10,10,0,1.59851991259118,0,1.59851991259118,NA,NA,3,0,0,NA,4.7,3,1.56666666666667,2.28333333333333,2.10131332082551,4.3,-2.3,-2.6,-4,0.5,-1.4,"-2.5","-7.2","-3",-4.7,2.8,9.4,1,0,NA,NA,NA,NA,NA,NA,NA,NA,NA,NA,NA,64.8,74.5,"Hot","Dry",NA,1,3,NA,8,0,6.9,9,7.2,57.6,0,49.68,64.8,"0",57.6,0,49.68,64.8,57.6,0,74.52,64.8,9.93929691148022,10,NA,NA,NA,NA,NA,4.2,5.33333333333333,NA,NA,0,7.448155525,1.051388924,0.7,0,0.7,4.2,3.5,10,9,7.4,7.4,6.8,6.9,0.1,3.5,5.2,8,9.1,1.3,6.1,14.5,7.2,4,1.1,26,10,22.1,10,6,1.4,6.9,4.6,4.9,8.125,5.9,8.42857142857143,"-8.4 %","High","25.0 %","High","Government is replacing less than 50% of lost salary (or if a flat sum, it  ...","Medium",10,10,0,"SDNPOV1","International poverty rate ($1.9 in 2011 PPP)",11.1268301852803,12.8268091468316,14.8870463130231,20.6727983695804,20.5642629547185,20.133579754693,"16:43:10  5 Oct 2020","SSA",43849.269,0.000253751782846832,0.000292520478433325,0.000339505005500163,0.000471451379715827,0.000468976186460908,0.000459154284982333,38.8643383979798,0.0131946374215663,7.77286767959596,2.63892748431327,"Unemployment rate","Unemployment rate can be defined by either the national definition, the ILO harmonized definition, or the OECD harmonized definition. The OECD harmonized unemployment rate gives the number of unemployed persons as a percentage of the labor force (the total number of people employed plus unemployed). [OECD Main Economic Indicators, OECD, monthly] As defined by the International Labour Organization, unemployed workers are those who are currently not working but are willing and able to work for pay, currently available to work, and have actively searched for work. [ILO, http://www.ilo.org/public/english/bureau/stat/res/index.htm]","Percent of total labor force",NA,19.6,19.5,22.1,25,22,19.9,19.4,19,18.6,"2.9",2.9,5.8,NA,NA,NA,NA,NA,NA,NA,NA,NA,NA,NA,NA,NA,NA,NA,NA,NA,NA,NA,NA,NA,NA,NA,NA,NA,NA,NA,NA,NA,NA,NA,10,0,0,0,0,0.2
"3","Afghanistan","AFG",32.3,7.54,0,0.2,NA,NA,0.2,0.3,0.2,0,-30.9219579319835,11.4478832990427,0,0.76319221993618,6.44,0.239,1.288,1.195,20210106,NA,20,NA,0,NA,23.08,NA,NA,9.23076923076923,10,2393,2377,38928.341,2191,16,0.411011607198981,9.21953445915106,0.921953445915108,6.8,NA,"9.0","Low","8","High","Screening","Medium","No measures","High","No measures","High","No income support","High","0","High","-5.0 %","High","NO DATA",NA,"5.4 %","High","Fully open","Low","13,154,519","High","NO DATA",NA,"Public officials urging caution about COVID-19","Medium","Open public testing (eg “drive through” testing available to asymptomatic p ...","Low","NO DATA",NA,"-60.50%","Low",1.1,"Low",0,"Low",4.2,"Medium","No hotspot","Low","Very High","High",10,0,0.661,10,"Afghanistan",202,"2020_10",2020,10,"GPW Version 4 Revision 11 (2018)",36374157.1095,6768118.3439,18.6069420757308,0,0,2044610.4063,5.62105233159066,0,0,4.3822708770994,NA,-5.77218598819886,NA,12.9858897441402,"Not high risk",3,7,0,0.476335221,10,0.17,0.13,NA,0.13,7,10,"High","High","Apr-20",10,-0.63,1.502,-1,-4,-2,-3,6,2.9,8.014440433213,10,2.9,0,0,0,1,0,0,-1.771186495509,10,3.5,7.14285714285714,10,0,10,0.757020675414514,10,4,6,NA,3,1.7,8,4.4,5,4.275,4.6375,10,2.7,1.8,2.9,-5.5,1,-8.4,"3","-3","4.5",-6,10,10,8.1,0,NA,NA,NA,NA,NA,NA,NA,NA,NA,NA,NA,66.4,99.5,"Hot","Wet",NA,1,2,NA,7.2,0,7.9,4,8.4,60.48,0,66.36,33.6,"0",60.48,0,66.36,33.6,90.72,0,99.54,50.4,10,10,"2021-01-16","active","green","earthquake",0,6.7,9.5,3.42897593141229,8.57243982853073,0,8.820582327,NA,0.9,0,0.9,5.9,2.5,7.9,10,7,7,6.7,1.9,1,1.5,4.1,8,9,NA,8.5,27.9,10,3,0.6,29.8,10,9.2,4,5,3.4,5.6,5,4.5,6.45833333333333,7.5,10,"-5.0 %","High","NO DATA",NA,"No income support","High",10,NA,7,NA,NA,NA,NA,NA,NA,NA,NA,NA,NA,NA,NA,NA,NA,NA,NA,NA,NA,NA,NA,NA,"Unemployment rate","Unemployment rate can be defined by either the national definition, the ILO harmonized definition, or the OECD harmonized definition. The OECD harmonized unemployment rate gives the number of unemployed persons as a percentage of the labor force (the total number of people employed plus unemployed). [OECD Main Economic Indicators, OECD, monthly] As defined by the International Labour Organization, unemployed workers are those who are currently not working but are willing and able to work for pay, currently available to work, and have actively searched for work. [ILO, http://www.ilo.org/public/english/bureau/stat/res/index.htm]","Percent of total labor force",NA,NA,NA,NA,NA,NA,NA,NA,NA,NA,"0",NA,NA,NA,NA,NA,NA,NA,NA,NA,NA,NA,NA,NA,NA,NA,NA,NA,NA,NA,NA,NA,NA,NA,NA,NA,NA,NA,NA,NA,NA,NA,NA,NA,10,0,0,0,0,0
"4","Mozambique","MOZ",28.1,8.38,0.2,0.6,NA,NA,0.5,0.4,0.4,2.38095238095237,88.4615384615384,44.053934571176,5.8974358974359,2.93692897141173,5.348,0.041,1.0696,0.205,20210106,NA,47.22,NA,0,NA,54.49,NA,NA,5.04307692307692,10,245,234,31255.435,168,11,0.351938790805503,45.8333333333333,4.58333333333333,6.2,NA,"4.4","Low","56","Medium","Quarantine arrivals from high-risk regions","Medium","No measures","High","No measures","High","No income support","High","0","High","-0.5 %","Medium","NO DATA",NA,"3.6 %","Medium","Partially open","Medium","364,389","Medium","NO DATA",NA,"Coordinated public information campaign (e.g. across traditional and social ...","Low","Only those who both (a) have symptoms AND (b) meet specific criteria (eg ke ...","Medium","Comprehensive contact tracing - done for all cases","Low","-72.50%","Low",6.3,"Medium",2,"Low",6.9,"Medium","No hotspot","Low","High","High",10,0,0.592,10,"Mozambique",974,"2020_10",2020,10,"GPW Version 4 Revision 11 (2018)",31830372.25,3138205,9.85915268395895,0,0,3138205,9.85915268395895,0,0,0,NA,0,NA,0,"Not high risk",3,7,0,0.303404623,10,0.07,0,NA,0,1,10,"In distress","In distress","Apr-20",10,-2.923,-6.906,-0.2,-7.7,-6.1,-7.6,10,0.5,9.74729241877256,10,4.96246179494304,19.6078431372549,7.8525641025641,3.47318699638789,1,0,1,-0.0316971192586084,6.63637309616483,3.5,7.14285714285714,10,0,10,10,10,5,4,3,0,0.4,9,4.9,4,3.575,3.7875,8.87429643527205,3.7,3.4,2.2,1.3,3.6,-0.9,"2.2","2.2","4.7",0,1.8,0,3.6,0.183999999999999,NA,NA,NA,NA,NA,NA,NA,NA,NA,NA,NA,54,80.9,"Hot","Dry",NA,1,3,NA,6.3,5.2,7.6,0,7.1,44.73,36.92,53.96,0,"0",44.73,36.92,53.96,0,44.73,36.92,80.94,0,10,9.27847658979734,NA,NA,NA,NA,NA,5.8,8,3.42353971881941,8.55884929704852,0,6.312861502,NA,0.6,NA,0.6,5.2,3.6,8.5,5.9,0.2,0.2,4.7,3.1,0.4,1.8,3.2,9.3,9.6,6.3,8.4,5.9,3,3,0.6,18.4,5.6,3.3,0.7,10,10,6.6,5.2,4.2,5.20833333333333,7.5,10,"-0.5 %","Medium","NO DATA",NA,"No income support","High",7,NA,7,"MOZPOV1","International poverty rate ($1.9 in 2011 PPP)",62.5680029925922,62.4041132590683,62.5426153538923,63.6511528158023,63.6591351905613,63.0910595679398,"16:43:10  5 Oct 2020","SSA",31255.435,0.002001827937848,0.00199658437833511,0.00200101567467841,0.00203648270503361,0.0020367380966082,0.00201856283772534,1.77245140075686,0.00354670303552018,0.354490280151371,0.709340607104036,"Unemployment rate","Unemployment rate can be defined by either the national definition, the ILO harmonized definition, or the OECD harmonized definition. The OECD harmonized unemployment rate gives the number of unemployed persons as a percentage of the labor force (the total number of people employed plus unemployed). [OECD Main Economic Indicators, OECD, monthly] As defined by the International Labour Organization, unemployed workers are those who are currently not working but are willing and able to work for pay, currently available to work, and have actively searched for work. [ILO, http://www.ilo.org/public/english/bureau/stat/res/index.htm]","Percent of total labor force",NA,NA,NA,NA,NA,NA,NA,NA,NA,NA,"0",NA,NA,NA,NA,NA,NA,NA,NA,NA,NA,NA,NA,NA,NA,NA,NA,NA,NA,NA,NA,NA,NA,NA,NA,NA,NA,NA,NA,NA,NA,NA,NA,NA,0,0,0,0,0,0.1
"5","Niger","NER",32.2,7.56,0.9,0.2,NA,NA,1,0.6,0.7,9.52380952380948,126.336375488918,-15.7917824584491,8.42242503259452,0,1.723,0.047,0.3446,0.234999999999999,20210106,NA,29.72,NA,0,NA,34.29,NA,NA,7.73538461538462,10,175,167,24206.636,110,8,0.330487887701538,59.0909090909091,5.90909090909091,6.2,NA,"3.2","Low","31","Medium","Quarantine arrivals from high-risk regions","Medium","No measures","High","No measures","High","No income support","High","0","High","0.5 %","Medium","NO DATA",NA,"4.4 %","Medium","Fully open","Low","1,731,302","High","NO DATA",NA,"Coordinated public information campaign (e.g. across traditional and social ...","Low","Open public testing (eg “drive through” testing available to asymptomatic p ...","Low","No contact tracing","High","-65.12%","Low",0,"Low",0,"Low",4.7,"Medium","No hotspot","Low","High","High",10,0,0.606,10,"Niger",236,"2020_10",2020,10,"GPW Version 4 Revision 11 (2018)",24312523.16471,4209997.82826,17.3161699414682,0,0,5801402.21886,23.8617858770036,0,0,3.51679767750752,NA,10.062413613043,NA,-6.54561593553543,"High risk",3,10,0,0.216210932,10,0.04,NA,NA,0.04,5,10,"Moderate","Moderate","Apr-20",7,-4.122,-3.005,-3.6,-4.2,-3.3,-0.6,1.2,18.4,0,10,2.53131519518228,17.2413793103448,0,4,1,0,0,-1.28361030386562,9.26624325533639,4,4.76190476190476,10,0,10,1.71742042032854,10,NA,NA,0,0,NA,NA,3.9,0,1.95,0.975,0,4.9,6.5,6.3,1,8.1,-5.3,"5.8","1","8.1",-4.8,10,9.6,6.7,0,NA,NA,NA,NA,NA,NA,NA,NA,NA,NA,NA,52.5,71.4,"Hot",NA,NA,1,NA,NA,7.4,0,6.7,7,7.1,52.54,0,47.57,49.7,"0",52.54,0,47.57,49.7,52.54,0,71.355,49.7,9.52571542925756,9.01642208245982,NA,NA,NA,NA,NA,4.5,5.83333333333333,2.37841423000544,5.9460355750136,0,21.38065487,3.376694494,2.4,0.1,2.4,4.2,1.6,6.9,9.8,1.4,1.4,4.8,7.3,0.3,3.8,4.3,10,10,4.5,8.2,3.4,1.7,3,0.6,20,6.7,2.4,0.2,7,1.6,3.9,4.8,4.5,6.45833333333333,7.3,10,"0.5 %","Medium","NO DATA",NA,"No income support","High",7,NA,7,"NERPOV1","International poverty rate ($1.9 in 2011 PPP)",43.3659133889746,41.534905451164,40.4415310765107,42.042911423329,39.6378074879465,34.6233056388263,"16:43:10  5 Oct 2020","SSA",24206.636,0.00179148863927126,0.00171584789605479,0.00167067952261152,0.00173683412363985,0.00163747690872645,0.00143032289322755,3.95974213683599,0.00661546010283383,0.791948427367197,1.32309202056677,"Unemployment rate","Unemployment rate can be defined by either the national definition, the ILO harmonized definition, or the OECD harmonized definition. The OECD harmonized unemployment rate gives the number of unemployed persons as a percentage of the labor force (the total number of people employed plus unemployed). [OECD Main Economic Indicators, OECD, monthly] As defined by the International Labour Organization, unemployed workers are those who are currently not working but are willing and able to work for pay, currently available to work, and have actively searched for work. [ILO, http://www.ilo.org/public/english/bureau/stat/res/index.htm]","Percent of total labor force",NA,NA,NA,NA,NA,NA,NA,NA,NA,NA,"0",NA,NA,NA,NA,NA,NA,NA,NA,NA,NA,NA,NA,NA,NA,NA,NA,NA,NA,NA,NA,NA,NA,NA,NA,NA,NA,NA,NA,NA,NA,NA,NA,NA,10,0,0,0,0,0.1
