"46","Argentina","ARG",58.6,2.28,0,0.5,NA,NA,1,0.8,0.6,7.14285714285711,-24.276155940158,20.1110340520663,0,1.34073560347109,191.443,2.424,10,10,20210106,NA,74.94,NA,75,NA,74.94,NA,NA,0.778461538461539,2.5,51997,50986,45195.777,43375,1011,22.3693465874035,19.8778097982709,1.98778097982709,3.4,NA,"177.2","High","79","Medium","Ban on high-risk regions","Medium","Require closing (or prohibit most people from using it)","Low","Require not leaving house with exceptions for daily exercise, grocery shopp ...","Medium","Government is replacing less than 50% of lost salary (or if a flat sum, it  ...","Medium","2","Low","-11.8 %","High","11.0 %","Medium","0.0 %","Medium","Academic break","Low","NO DATA",NA,"-79.10%","Low","Coordinated public information campaign (e.g. across traditional and social ...","Low","Testing of anyone showing COVID-19 symptoms","Medium","Comprehensive contact tracing - done for all cases","Low","NO DATA",NA,4.1,"Medium",0,"Low",2.8,"Medium","NO DATA",NA,"NO CRISIS","Low",3.5,0,0.253,2.27272727272727,NA,NA,NA,NA,NA,NA,NA,NA,NA,NA,NA,NA,NA,NA,NA,NA,NA,NA,NA,NA,NA,NA,NA,10,NA,NA,0.51,0.49,0.47,0.47,10,NA,NA,NA,NA,NA,-6.703,-5.493,-3.9,NA,NA,NA,NA,6,5.77617328519856,2.5,6,5,0,5.32023552705127,1,0.224482511689927,0,-1.24279395961448,9.18050113913187,NA,NA,0,0,5,3.37092176670746,5,3,3,4,0,0.7,0,4.4,3.33333333333333,1.275,2.30416666666667,2.19512195121951,2.7,-2.5,-2.2,-7.3,2.1,-5.1,"-2.2","-5.7","4.4",-3.5,10,7,1,0,0.5,1,0,1,0,0,0,0,1,2.5,10,11.7,0,NA,NA,NA,NA,NA,NA,6.5,0,3.3,0,1.8,11.7,0,5.94,0,"x",0,0,0,0,0,0,0,0,0,1.88853948287911,"2021-01-19","active","green","earthquake",0,4,5,4,10,0,46.36080045,38.15037613,5.4,7.2,5.4,4,9.2,1.6,3.1,0,0,3.6,5.3,1.8,3.6,3.6,1.5,NA,0.1,0.8,0,0,11,5,15.8,3.9,5.9,2.2,3,0.5,2.4,2.9,3.2,1.04166666666667,1.8,2.57142857142857,"-11.8 %","High","11.0 %","Medium","Government is replacing less than 50% of lost salary (or if a flat sum, it  ...","Medium",10,7,0,"ARGPOV1","International poverty rate ($1.9 in 2011 PPP)",0.816471553823265,1.29678848880527,1.80802862509533,4.84350662201384,2.02516398335301,1.76528182094731,"16:43:10  5 Oct 2020","LAC",45195.777,1.80652177707502e-05,2.86926915495947e-05,4.00043708750782e-05,0.000107167238700506,4.48086993471317e-05,3.9058556752931e-05,167.888824036647,0.00671628678254277,10,1.34325735650856,"Unemployment rate","Unemployment rate can be defined by either the national definition, the ILO harmonized definition, or the OECD harmonized definition. The OECD harmonized unemployment rate gives the number of unemployed persons as a percentage of the labor force (the total number of people employed plus unemployed). [OECD Main Economic Indicators, OECD, monthly] As defined by the International Labour Organization, unemployed workers are those who are currently not working but are willing and able to work for pay, currently available to work, and have actively searched for work. [ILO, http://www.ilo.org/public/english/bureau/stat/res/index.htm]","Percent of total labor force",NA,8.35,9.2,9.825,10.981,10.11,9.69,9.369,9.19,9.15,"1.156",1.156,2.312,0,NA,NA,NA,NA,NA,NA,NA,NA,NA,NA,NA,NA,NA,NA,NA,NA,NA,NA,NA,NA,NA,NA,NA,NA,NA,NA,NA,NA,NA,NA,0,0,0,0,0,0.2
"47","Barbados","BRB",31.9,7.62,0.9,0.7,NA,NA,0.2,0.8,0.7,9.52380952380948,0.01,0.01,0.000666666666667481,0.000666666666667481,135.216,0,10,0,20210106,NA,55,NA,37.5,NA,57.69,NA,NA,3.84615384615385,6.25,7,7,287.371,7,0,0,0,0,4,NA,"5.9","Low","41","Medium","Quarantine arrivals from high-risk regions","Medium","No measures","High","No measures","High","Government is replacing less than 50% of lost salary (or if a flat sum, it  ...","Medium","2","Low","-11.6 %","High","14.9 %","Medium","2.9 %","Low","Partially open","Medium","NO DATA",NA,"NO DATA",NA,"Coordinated public information campaign (e.g. across traditional and social ...","Low","Testing of anyone showing COVID-19 symptoms","Medium","Comprehensive contact tracing - done for all cases","Low","NO DATA",NA,0.1,"Low",0.1,"Low",0.5,"Low","NO DATA",NA,"NO CRISIS","Low",5,0,0.234,1.81818181818182,NA,NA,NA,NA,NA,NA,NA,NA,NA,NA,NA,NA,NA,NA,NA,NA,NA,NA,NA,NA,NA,NA,NA,0,NA,NA,NA,NA,NA,NA,NA,NA,NA,NA,NA,NA,-4.285,-0.299,3.5,-0.6,1,-4,8,NA,NA,6.25,4.24100648712404,71.4285714285714,85.7142857142857,0,1,0,0,1.52951167154583,3.35677155377693,NA,NA,0,0,5,0.236694883775332,5,5,5,7,0,NA,NA,NA,5.66666666666667,0,2.83333333333333,4.57786116322702,NA,NA,NA,NA,NA,NA,"-0.1","-7.6","7.1",-7.5,NA,10,NA,0,NA,NA,NA,NA,NA,NA,NA,NA,NA,NA,NA,6.9,10.4,NA,NA,"TC risk",NA,NA,4,0.1,4.6,0.5,0,1.5,0.15,6.9,0.75,0,"0",0,6.9,0,0,0,10.35,0,0,1.38749916616637,1.04996505939902,NA,NA,NA,NA,NA,3.8,4.66666666666667,2.05976714390712,5.14941785976779,0,NA,NA,NA,NA,NA,9.4,3.1,NA,NA,0,0,4.2,9.9,10,10,7.1,2,2.3,NA,2.2,0,0,16,7.8,16.2,4.1,13.4,6.3,4,0,3.6,2.9,5,8.54166666666667,2.3,3.28571428571428,"-11.6 %","High","14.9 %","Medium","Government is replacing less than 50% of lost salary (or if a flat sum, it  ...","Medium",10,7,0,NA,NA,NA,NA,NA,NA,NA,NA,NA,NA,NA,NA,NA,NA,NA,NA,NA,NA,NA,NA,NA,"Unemployment rate","Unemployment rate can be defined by either the national definition, the ILO harmonized definition, or the OECD harmonized definition. The OECD harmonized unemployment rate gives the number of unemployed persons as a percentage of the labor force (the total number of people employed plus unemployed). [OECD Main Economic Indicators, OECD, monthly] As defined by the International Labour Organization, unemployed workers are those who are currently not working but are willing and able to work for pay, currently available to work, and have actively searched for work. [ILO, http://www.ilo.org/public/english/bureau/stat/res/index.htm]","Percent of total labor force",NA,9.95,10.05,10.357,14.853,12.8,11.822,11.502,11.183,10.863,"4.496",4.496,8.992,NA,NA,NA,NA,NA,NA,NA,NA,NA,NA,NA,NA,NA,NA,NA,NA,NA,NA,NA,NA,NA,NA,NA,NA,NA,NA,NA,NA,NA,NA,NA,0,0,0,0,0,0.5
"48","Bolivia","BOL",35.8,6.84,0,0.1,NA,NA,1,0.8,0.5,4.76190476190474,210.692101622067,136.83710699311,10,9.12247379954069,102.569,1.297,10,6.485,20210106,NA,47.22,NA,25,NA,50.64,NA,NA,5.04307692307692,7.5,11008,10756,11673.029,9186,252,21.5882270145992,19.8345308077509,1.98345308077509,4.9,NA,"22.0","Medium","53","Medium","Screening","Medium","Recommend closing (or significantly reduce volume/route ...","Medium","Recommend not leaving house","Medium","Government is replacing less than 50% of lost salary (or if a flat sum, it  ...","Medium","0","High","-7.9 %","High","8.0 %","Medium","1.7 %","Low","Academic break","Low","NO DATA",NA,"-77.27%","Low","Coordinated public information campaign (e.g. across traditional and social ...","Low","Only those who both (a) have symptoms AND (b) meet specific criteria (eg ke ...","Medium","Limited contact tracing - not done for all cases","Medium","NO DATA",NA,5.1,"Medium",0,"Low",4.1,"Medium","No hotspot","Low","NO CRISIS","Low",7.25,0,0.496,8.08612440191388,NA,NA,NA,NA,NA,NA,NA,NA,NA,NA,NA,NA,NA,NA,NA,NA,NA,NA,NA,NA,NA,NA,NA,0,NA,NA,0.03,0,0.01,0.01,1,NA,NA,NA,NA,NA,-7.824,-8.144,-7,-7.3,-6.9,-0.3,0.6,3,7.94223826714801,7.5,2.69929245283019,0,0,10.1943350392679,1,0,0,-1.3997868042637,9.51029301481697,3,9.52380952380952,0,0,5,1.18778448826845,5,4,3,3,0,1.5,NA,4.3,3.33333333333333,1.93333333333333,2.63333333333333,3.67729831144465,4.2,4.2,2.7,-5.9,2.2,-8.6,"2.8","-2.9","2.9",-5.7,10,10,9.2,0,NA,NA,NA,NA,NA,NA,NA,NA,NA,NA,NA,18.7,18.7,NA,NA,NA,NA,NA,NA,5.5,0,4.1,0,3.4,18.7,0,13.94,0,"0",18.7,0,13.94,0,18.7,0,13.94,0,2.49483023147222,3.1114605171209,"2021-01-05","past","green","flood",0,4.7,6.16666666666667,3.85871451984124,9.64678629960309,0,78.19620111,12.81119014,9.3,2,9.3,3.4,6.9,5.5,3.8,0,0,3.9,2.9,0.8,1.9,2.9,4.1,7.4,0.6,4,0,0,7,2.8,17.2,4.8,6.8,2.7,4,2,3.4,5.6,4.2,5.20833333333333,4.5,6.42857142857143,"-7.9 %","High","8.0 %","Medium","Government is replacing less than 50% of lost salary (or if a flat sum, it  ...","Medium",10,7,0,"BOLPOV1","International poverty rate ($1.9 in 2011 PPP)",5.77451747844624,4.48495957434697,4.3363047650615,5.89835532551647,5.17623044354239,4.68314184883908,"16:43:10  5 Oct 2020","LAC",11673.029,0.000494688865970113,0.000384215577151995,0.000371480681240618,0.000505297753095316,0.000443435071012193,0.000401193370532968,36.0226193749281,0.0133817071854698,7.20452387498561,2.67634143709395,"Unemployment rate","Unemployment rate can be defined by either the national definition, the ILO harmonized definition, or the OECD harmonized definition. The OECD harmonized unemployment rate gives the number of unemployed persons as a percentage of the labor force (the total number of people employed plus unemployed). [OECD Main Economic Indicators, OECD, monthly] As defined by the International Labour Organization, unemployed workers are those who are currently not working but are willing and able to work for pay, currently available to work, and have actively searched for work. [ILO, http://www.ilo.org/public/english/bureau/stat/res/index.htm]","Percent of total labor force",NA,4,4,4,8,4,4,4,4,4,"4",4,8,NA,56.3211975097656,NA,97.8341369628906,NA,NA,52.7777786254883,15.560640335083,NA,NA,16.7824401855469,NA,0.75020843744278,21.7004718780518,NA,8.04588535853795,NA,1.08293151855469,NA,NA,9.44444427490234,6.2242561340332,NA,NA,6.71297607421875,NA,0.37510421872139,4.34009437561035,NA,5.1750988506541,6.35019770130819,0,0,0,0,0,0.2
"49","Burkina Faso","BFA",30.1,7.98,0.8,0.3,NA,NA,1,0.6,0.7,9.52380952380948,20.8733974358974,-16.3631187008757,1.39155982905983,0,5.502,0.027,1.1004,0.135,20210106,NA,26.67,NA,0,NA,30.77,NA,NA,8.20461538461538,10,115,111,20903.278,86,4,0.191357546888101,33.7209302325581,3.37209302325581,6.3,NA,"5.8","Low","14","High","Screening","Medium","No measures","High","No measures","High","No income support","High","0","High","-2.0 %","High","NO DATA",NA,"2.0 %","Low","Fully open","Low","2,726,899","High","NO DATA",NA,"Coordinated public information campaign (e.g. across traditional and social ...","Low","Open public testing (eg “drive through” testing available to asymptomatic p ...","Low","Comprehensive contact tracing - done for all cases","Low","-86.11%","Low",0,"Low",0,"Low",3.8,"Medium","No hotspot","Low","High","High",10,10,0.524,8.75598086124402,"Burkina Faso",303,"2020_10",2020,10,"GPW Version 4 Revision 11 (2018)",20841206.0085,0,0,0,0,0,0,0,0,0,NA,0,NA,0,"Not high risk",-Inf,NA,0,0.118343647,5.91718235,-0.01,0.05,0.04,0.04,5,10,"Moderate","Moderate","Apr-20",7,-6.884,-4.355,-3,-5,-3.5,-2,4,NA,NA,10,0.790104844788597,15.5555555555556,0,1.3,1,0,0,-1.5100881645667,9.74200097950937,4,4.76190476190476,10,0,10,4.26500981573523,10,5,4,0,0,NA,6,4.2,3,3.4,3.2,6.22889305816135,6.3,6.8,5.7,2,5.8,-3.7,"5.7","2","5.8",-3.7,7.4,7.4,10,1.799,NA,NA,NA,NA,NA,NA,NA,NA,NA,NA,NA,49,49,NA,NA,NA,NA,NA,NA,4.6,0,5.8,7,7,32.2,0,40.6,49,"0",32.2,0,40.6,49,32.2,0,40.6,49,6.53725568674538,8.40496156533892,NA,NA,NA,NA,NA,3.7,4.5,2.69180038526471,6.72950096316178,0,4.280444122,17.14905856,0.3,2.9,0.3,6.2,2.9,6.5,9.8,0.4,0.4,5.2,4.7,1.4,3.1,4.1,9.5,10,4.4,8,4.9,2.5,2,0,21.7,7.8,7.3,2.9,8,0.9,4.9,4.4,4.2,5.20833333333333,6.8,9.71428571428571,"-2.0 %","High","NO DATA",NA,"No income support","High",10,NA,7,"BFAPOV1","International poverty rate ($1.9 in 2011 PPP)",39.5918804505486,37.4284846089301,35.9954093754851,37.8985082948298,38.1695702512933,37.2512773977811,"16:43:10  5 Oct 2020","SSA",20903.278,0.00189405127992598,0.00179055574962597,0.00172199830933144,0.00181304139450424,0.00182600883226513,0.00178207826532188,5.28706007894657,0.00910430851727975,1.05741201578931,1.82086170345595,"Unemployment rate","Unemployment rate can be defined by either the national definition, the ILO harmonized definition, or the OECD harmonized definition. The OECD harmonized unemployment rate gives the number of unemployed persons as a percentage of the labor force (the total number of people employed plus unemployed). [OECD Main Economic Indicators, OECD, monthly] As defined by the International Labour Organization, unemployed workers are those who are currently not working but are willing and able to work for pay, currently available to work, and have actively searched for work. [ILO, http://www.ilo.org/public/english/bureau/stat/res/index.htm]","Percent of total labor force",NA,NA,NA,NA,NA,NA,NA,NA,NA,NA,"0",NA,NA,NA,80.3480834960938,11.5633335113525,96.7287368774414,49.4601745605469,9.91870498657227,69.2106246948242,8.3205623626709,NA,NA,NA,NA,NA,NA,NA,10,2.31266670227051,1.6356315612793,7.06573922293527,3.96748199462891,6.15787506103516,3.32822494506836,NA,NA,NA,NA,NA,NA,NA,4.92394564103107,5.84789128206214,10,0,0,0,0,0.2
"50","Dominica","DMA",24,9.2,1,0.8,NA,NA,0.2,NA,0.7,9.52380952380948,NA,NA,NA,NA,0,0,0,0,20210106,NA,53.33,NA,50,NA,53.85,NA,NA,4.10307692307692,5,0,0,NA,0,0,NA,NA,NA,4.2,NA,"2.8","Low","34","Medium","Quarantine arrivals from high-risk regions","Medium","No measures","High","Require not leaving house with exceptions for daily exercise, grocery shopp ...","Medium","Government is replacing less than 50% of lost salary (or if a flat sum, it  ...","Medium","2","Low","-8.8 %","High","NO DATA",NA,"1.8 %","Low","Fully open","Low","NO DATA",NA,"NO DATA",NA,"Coordinated public information campaign (e.g. across traditional and social ...","Low","Open public testing (eg “drive through” testing available to asymptomatic p ...","Low","Comprehensive contact tracing - done for all cases","Low","NO DATA",NA,0.1,"Low",0.1,"Low",0,"Low","NO DATA",NA,"NO CRISIS","Low",5.5,0,0.388,5.50239234449761,NA,NA,NA,NA,NA,NA,NA,NA,NA,NA,NA,NA,NA,NA,NA,NA,NA,NA,NA,NA,NA,NA,NA,0,NA,NA,NA,NA,NA,NA,NA,NA,"High","…","Sep-18",10,0.272,-19.73,-9.2,-4.5,-0.6,4.6,0,NA,NA,5,NA,NA,NA,NA,NA,NA,NA,NA,NA,4.5,2.38095238095238,0,0,5,NA,5,NA,NA,6,3,1.1,NA,NA,6,2.05,4.025,9.9437148217636,-9.5,0.5,9.6,-4,4,-13.6,"9.2","-4.7","3.4",-13.9,10,10,10,5.117,NA,NA,NA,NA,NA,NA,NA,NA,NA,NA,NA,25.8,38.8,"Hot","Dry","TC risk",1,3,4,0.1,7.6,0,0,3.4,0.34,25.84,0,0,"0",0,25.84,0,0,0,38.76,0,0,5.17643919685144,4.35185185185185,NA,NA,NA,NA,NA,4.9,6.5,2.47271953183691,6.18179882959228,0,20.83974532,28.8762114,2.3,5.3,2.3,6.6,7,NA,NA,0,0,4.5,5.3,10,7.7,6.1,3.7,NA,NA,3.7,0,0,NA,NA,NA,NA,11.6,5.3,4,0,3.1,3,4.6,6.875,3.3,4.71428571428571,"-8.8 %","High","NO DATA",NA,"Government is replacing less than 50% of lost salary (or if a flat sum, it  ...","Medium",10,NA,0,NA,NA,NA,NA,NA,NA,NA,NA,NA,NA,NA,NA,NA,NA,NA,NA,NA,NA,NA,NA,NA,"Unemployment rate","Unemployment rate can be defined by either the national definition, the ILO harmonized definition, or the OECD harmonized definition. The OECD harmonized unemployment rate gives the number of unemployed persons as a percentage of the labor force (the total number of people employed plus unemployed). [OECD Main Economic Indicators, OECD, monthly] As defined by the International Labour Organization, unemployed workers are those who are currently not working but are willing and able to work for pay, currently available to work, and have actively searched for work. [ILO, http://www.ilo.org/public/english/bureau/stat/res/index.htm]","Percent of total labor force",NA,NA,NA,NA,NA,NA,NA,NA,NA,NA,"0",NA,NA,NA,NA,NA,NA,NA,NA,NA,NA,NA,NA,NA,NA,NA,NA,NA,NA,NA,NA,NA,NA,NA,NA,NA,NA,NA,NA,NA,NA,NA,NA,NA,0,0,0,0,0,0.6
"51","Egypt","EGY",39.9,6.02,0,0.7,NA,NA,0,0.4,0.3,0,102.438158856069,116.312112769366,6.82921059040462,7.75414085129106,13.052,0.556,2.6104,2.78,20210106,NA,65.56,NA,75,NA,64.1,NA,NA,2.22153846153846,2.5,14450,13424,102334.403,7741,1026,10.0259538329451,86.6683890970159,8.66683890970159,3.6,NA,"6.0","Low","66","Medium","Screening","Medium","Require closing (or prohibit most people from using it)","Low","Recommend not leaving house","Medium","Government is replacing less than 50% of lost salary (or if a flat sum, it  ...","Medium","2","Low","3.5 %","Low","8.3 %","Medium","5.7 %","High","Partially open","Medium","NO DATA",NA,"NO DATA",NA,"Coordinated public information campaign (e.g. across traditional and social ...","Low","Testing of anyone showing COVID-19 symptoms","Medium","Comprehensive contact tracing - done for all cases","Low","-48.39%","Low",4.1,"Medium",0,"Low",1.4,"Low","No hotspot","Low","High","High",4,0,0.233,1.79425837320574,NA,NA,NA,NA,NA,NA,NA,NA,NA,NA,NA,NA,NA,NA,NA,NA,NA,NA,NA,NA,NA,NA,NA,0,NA,NA,0.01,0,0,0,1,NA,NA,NA,NA,NA,-10.429,-9.41,-7.4,-7.7,-6.6,-0.3,0.6,1.8,8.8086642599278,2.5,1.8,23.5294117647059,0,2.214,1,0,1,-0.322507439045331,7.2472727906403,NA,NA,0,0,5,0,5,4,4,4,4,0.6,NA,4.9,4,3.16666666666667,3.58333333333333,7.95497185741088,4.2,5.3,5.6,3,2.1,-2.6,"5.6","2","2.8",-3.6,5.2,7.2,4.6,2.803,0,1,0,1,0,0.5,0,0,1,2.5,10,31.6,18.1,"Hot","Near-normal",NA,1,5,NA,8.1,0,3.1,0,3.9,31.59,0,12.09,0,"x",0,0,12.09,0,0,0,18.135,0,2.41478220265493,5.36512928022362,NA,NA,NA,NA,NA,4.9,6.5,3.63424118566428,9.0856029641607,0,NA,NA,NA,NA,NA,6.7,4.3,0.5,5.3,0.4,0.4,3.4,7,0.7,3.9,3.6,4.1,4.4,0.3,2.9,0,0,5,1.7,27.7,10,17.2,8.4,6,0.2,6.2,4.5,4.1,4.79166666666667,3.5,5,"3.5 %","Low","8.3 %","Medium","Government is replacing less than 50% of lost salary (or if a flat sum, it  ...","Medium",0,7,0,"EGYPOV1","International poverty rate ($1.9 in 2011 PPP)",3.80596479514798,3.90194682916106,4.11742864406958,4.29693022045843,4.39056198533859,4.19611783794689,"16:43:10  5 Oct 2020","MNA",102334.403,3.71914496354465e-05,3.81293750173249e-05,4.0235038495017e-05,4.19891072258313e-05,4.29040660484294e-05,4.10039802347495e-05,4.3595552444458,0.00017540687308143,0.87191104888916,0.0350813746162864,"Unemployment rate","Unemployment rate can be defined by either the national definition, the ILO harmonized definition, or the OECD harmonized definition. The OECD harmonized unemployment rate gives the number of unemployed persons as a percentage of the labor force (the total number of people employed plus unemployed). [OECD Main Economic Indicators, OECD, monthly] As defined by the International Labour Organization, unemployed workers are those who are currently not working but are willing and able to work for pay, currently available to work, and have actively searched for work. [ILO, http://www.ilo.org/public/english/bureau/stat/res/index.htm]","Percent of total labor force",NA,12.245,10.932,8.612,8.296,9.664,9.687,9.51,9.33,8.983,"-0.316",-0.316000000000001,0,7,59.2424850463867,40.7575149536133,98.0634155273438,NA,NA,NA,58.8444404602051,NA,NA,NA,2.18577265739441,NA,NA,NA,8.46321214948382,8.15150299072266,0.968292236328125,NA,NA,NA,10,NA,NA,NA,10,NA,NA,NA,7.51660147530692,10,10,0,0,0,0,0.3
"52","El Salvador","SLV",44.2,5.16,0,0.6,NA,NA,1,0.7,0.6,7.14285714285711,6.62341874797276,27.3051169511466,0.441561249864851,1.82034113007644,42.728,1.321,8.5456,6.605,20210106,NA,53.33,NA,75,NA,50,NA,NA,4.10307692307692,2.5,1846,1781,6486.201,1327,65,10.0212743946726,39.1107761868877,3.91107761868877,4.2,NA,"53.8","Medium","47","Medium","Screening","Medium","Recommend closing (or significantly reduce volume/route ...","Medium","Require not leaving house with exceptions for daily exercise, grocery shopp ...","Medium","Government is replacing less than 50% of lost salary (or if a flat sum, it  ...","Medium","2","Low","-9.0 %","High","9.4 %","Medium","0.2 %","Low","Closed due to COVID-19","High","NO DATA",NA,"-50.00%","Low","Coordinated public information campaign (e.g. across traditional and social ...","Low","Open public testing (eg “drive through” testing available to asymptomatic p ...","Low","Limited contact tracing - not done for all cases","Medium","-58.82%","Low",0,"Low",0.1,"Low",3.2,"Medium","No hotspot","Low","Medium","Medium",5.5,0,0.366,4.97607655502392,NA,NA,NA,NA,NA,NA,NA,NA,NA,NA,NA,NA,NA,NA,NA,NA,NA,NA,NA,NA,NA,NA,NA,0,NA,NA,0.02,0.02,0.03,0.03,5,NA,NA,NA,NA,NA,-2.392,-2.506,-2.9,-8.6,-4.6,-5.6,10,NA,NA,2.5,1.34320911847104,0,30.6818181818182,2.49453122001765,1,0,0,-1.13134351667901,8.9463793184607,NA,NA,0,0,9.56431208779111,0,9.56431208779111,4,4,4,5,0.5,0,4.5,4,2.5,3.25,6.45403377110694,2.3,2.4,2.4,-5.4,3.8,-7.8,"2.4","-5.4","4.5",-7.8,10,10,7.4,0,NA,NA,NA,NA,NA,NA,NA,NA,NA,NA,NA,11.1,16.7,NA,NA,"TC risk",NA,NA,4,3,3.7,3.7,0,3,9,11.1,11.1,0,"0",9,11.1,11.1,0,9,16.65,11.1,0,2.22800346874792,1.7837176799441,NA,NA,NA,NA,NA,6.5,9.16666666666667,3.89674443955772,9.74186109889431,0,58.09289859,25.86274396,6.9,4.7,6.9,8.3,7.2,2.5,5.2,0,0,4.6,6.9,5.3,6.1,5.4,4.5,NA,0.2,2.3,3.1,1.5,8,3.3,14,2.7,8.8,3.8,3,1.3,2.7,4,4.7,7.29166666666667,4.4,6.28571428571429,"-9.0 %","High","9.4 %","Medium","Government is replacing less than 50% of lost salary (or if a flat sum, it  ...","Medium",10,7,0,"SLVPOV1","International poverty rate ($1.9 in 2011 PPP)",1.90477493334792,1.52846948370101,1.43590338579094,2.15977407063087,1.84889612280989,1.61046245405637,"16:43:10  5 Oct 2020","LAC",6486.201,0.00029366572718729,0.000235649416923868,0.000221378182050007,0.000332979824496785,0.000285050698060372,0.000248290556221796,50.4122138023376,0.0111601642446778,10,2.23203284893556,"Unemployment rate","Unemployment rate can be defined by either the national definition, the ILO harmonized definition, or the OECD harmonized definition. The OECD harmonized unemployment rate gives the number of unemployed persons as a percentage of the labor force (the total number of people employed plus unemployed). [OECD Main Economic Indicators, OECD, monthly] As defined by the International Labour Organization, unemployed workers are those who are currently not working but are willing and able to work for pay, currently available to work, and have actively searched for work. [ILO, http://www.ilo.org/public/english/bureau/stat/res/index.htm]","Percent of total labor force",NA,7.049,6.347,6.733,9.39,9.5,8.2,7.5,7,7,"2.657",2.657,5.314,NA,58.3376655578613,NA,95.9936141967773,NA,NA,60.508228302002,8.04950428009033,NA,NA,4.81923151016235,NA,1.28533983230591,18.3035259246826,NA,8.33395222255162,NA,2.00319290161133,NA,NA,7.89835433959961,3.21980171203613,NA,NA,1.92769260406494,NA,0.642669916152954,3.66070518493652,NA,3.95519555442187,3.91039110884375,0,0,0,0,0,0.3
"53","Eritrea","ERI",22.4,9.52,1,0.5,NA,NA,0.8,NA,0.7,9.52380952380948,-100,77.1225306090217,0,5.14150204060145,1.289,0,0.2578,0,20210106,NA,71.67,NA,50,NA,75,NA,NA,1.28153846153846,5,1,1,3546.427,1,0,0,0,0,5.9,NA,"3.8","Low","75","Medium","Ban on high-risk regions","Medium","Require closing (or prohibit most people from using it)","Low","Require not leaving house with exceptions for daily exercise, grocery shopp ...","Medium","No income support","High","1","Medium","-0.6 %","Medium","NO DATA",NA,"4.7 %","Medium","Fully open","Low","NO DATA",NA,"NO DATA",NA,"Coordinated public information campaign (e.g. across traditional and social ...","Low","Only those who both (a) have symptoms AND (b) meet specific criteria (eg ke ...","Medium","Limited contact tracing - not done for all cases","Medium","-100.00%","Low",0,"Low",0,"Low",4.7,"Medium","No hotspot","Low","High","High",9.75,0,0.677,10,NA,NA,NA,NA,NA,NA,NA,NA,NA,NA,NA,NA,NA,NA,NA,NA,NA,NA,NA,NA,NA,NA,NA,0,NA,NA,NA,NA,NA,NA,NA,NA,"…","…","…",NA,-6.037,4.212,-1.5,-5,-4.5,-3.5,7,NA,NA,5,0,0,0,0,0,0,0,-3.83162449774194,10,1.5,10,10,0,5,1.39625014921776,5,NA,NA,NA,NA,NA,NA,NA,NA,NA,NA,NA,-10,13,3.7,-0.7,5.7,-4.4,"3.8","0.1","5.9",-3.7,8.8,7.4,10,0,NA,NA,NA,NA,NA,NA,NA,NA,NA,NA,NA,44,66,"Hot","Dry",NA,1,3,NA,3.1,0,8.3,5,5.3,16.43,0,43.99,26.5,"0",16.43,0,43.99,26.5,16.43,0,65.985,26.5,8.80528316990194,7.5314465408805,NA,NA,NA,NA,NA,3.7,4.5,3.06116472899939,7.65291182249846,0,NA,NA,NA,NA,NA,5.1,NA,NA,NA,0.1,0.1,2.6,4.1,0.4,2.3,2.4,9.2,NA,NA,9.2,0,0,NA,NA,23.9,9.3,5.1,1.7,6,1.2,4.6,6.9,4.7,7.29166666666667,6.3,9,"-0.6 %","Medium","NO DATA",NA,"No income support","High",7,NA,7,NA,NA,NA,NA,NA,NA,NA,NA,NA,NA,NA,NA,NA,NA,NA,NA,NA,NA,NA,NA,NA,"Unemployment rate","Unemployment rate can be defined by either the national definition, the ILO harmonized definition, or the OECD harmonized definition. The OECD harmonized unemployment rate gives the number of unemployed persons as a percentage of the labor force (the total number of people employed plus unemployed). [OECD Main Economic Indicators, OECD, monthly] As defined by the International Labour Organization, unemployed workers are those who are currently not working but are willing and able to work for pay, currently available to work, and have actively searched for work. [ILO, http://www.ilo.org/public/english/bureau/stat/res/index.htm]","Percent of total labor force",NA,NA,NA,NA,NA,NA,NA,NA,NA,NA,"0",NA,NA,NA,NA,NA,NA,NA,NA,NA,NA,NA,NA,NA,NA,NA,NA,NA,NA,NA,NA,NA,NA,NA,NA,NA,NA,NA,NA,NA,NA,NA,NA,NA,0,0,0,0,0.1,0.4
