Country,Countryname,Narrative
MNE,Montenegro,"FCV Status: Country not classed as FCV
 
IDA Status: Non-IDA recipient
 
Country Context: Because of its size, the already high costs of developing and running national institutions are compounded by a limited capacity to exploit economies of scale in the provision of public goods and services. An EU-compatible legal framework and regulatory bodies, as well as the ability to absorb EU funds, all require substantial capacity building. Montenegro is a small, open economy aspiring to join the EU by 2025. It is also an economy vulnerable to external shocks, as it relies heavily on capital inflows from abroad to stimulate its growth. At the same time, the transition to a market economy requires a reduction in the state’s footprint in the economy. Creating a favorable environment for private sector development requires restructuring state-owned enterprises (SOEs) and rationalization of public spending to reduce the cost of the state. Montenegro started negotiations with the EU in June 2012 and strives to join by 2025, ahead of the other countries in the Western Balkans. Of the 35 negotiations chapters, two have been provision-ally closed and 22 have been opened. In the latest European Commission (EC) Progress Report on Montenegro, the importance of maintaining macroeconomic stability was stressed, noting that the rapidly rising public debt and high fiscal deficits, together with high external imbalances and high unemployment, are of particular concern. Moreover, the combined effects of large-scale public infrastructure investments and several new expensive social expenditure programs challenge fiscal sustainability.  
"
NGA,Nigeria,"FCV Status: Medium-Intensity conflict
 
IDA Status: IDA-eligible
 
A key regional player in West Africa, Nigeria accounts for about half of West Africa’s population with approximately 202 million people and one of the largest populations of youth in the world. Nigeria is a multi-ethnic and culturally diverse federation which consists of 36 autonomous states and the Federal Capital Territory. With an abundance of natural resources, it is Africa’s biggest oil exporter, and has the largest natural gas reserves on the continent. The country held national elections in 2019, for the sixth consecutive time since its return to democracy in 1999. The incumbent president, Muhammadu Buhari won the elections and was sworn in for a second term on May 29, 2019. He has identified fighting corruption, increasing security, tackling unemployment, diversifying the economy, enhancing climate resilience, and boosting the living standards of Nigerians as main policy priorities his government seeks to continue to pursue in his second term up till 2023. Nigeria’s federated structure gives significant autonomy to states. Oil price volatility continues to influence Nigeria’s growth performance. Between 2000 and 2014, Nigeria’s gross domestic product (GDP) grew at an average rate of 7% per year. Following the oil price collapse in 2014-2016, combined with negative production shocks, the gross domestic product (GDP) growth rate dropped to 2.7% in 2015. In 2016 during its first recession in 25 years, the economy contracted by 1.6%. 

Since 2015, economic growth remains muted. Growth averaged 1.9% in 2018 and remained stable at 2% in the first half of 2019. Domestic demand remains constrained by stagnating private consumption in the context of high inflation (11% in the first half of 2019). On the production side, growth in 2019 was primarily driven by services, particularly telecoms. Agricultural growth remains below potential due to continued insurgency in the Northeast and ongoing farmer-herdsmen conflicts. Industrial performance is mixed. Oil GDP growth is stable, while manufacturing production is expected to slow down in 2019 due to a weaker power sector performance. Food and drink output are expected to increase, likely in response to import restrictions. Construction continues to perform positively, supported by ongoing megaprojects, higher public investment in the first half of the year, and import restrictions. Growth is too low to lift the bottom half of the population out of poverty. The weakness of the agriculture sector weakens prospects for the rural poor, while high food inflation adversely impacts the livelihoods of the urban poor. Despite expansion in some sectors, employment creation remains weak and insufficient to absorb the fast-growing labor force, resulting in high rate of unemployment (23% in 2018), with another 20% of the labor force underemployed.  Furthermore, the instability in the North and the resulting displacement of people contribute to the high incidence of poverty in the North East. Without significant structural policy reforms, Nigeria’s medium-term growth is projected to remain stable around 2%. Given that the economy is expected to grow more slowly than the population, living standards are expected to worsen. 

Growth is constrained by a weak macroeconomic framework with high persistent inflation, multiple exchange rate windows and forex restrictions, distortionary activities by the central bank, and a lack of revenue-driven fiscal consolidation results. Rising public debt, and increasingly complex policy interventions by the central bank constrain private sector credit growth. External balances are fragile to hot money movements, and fiscal buffers are exhausted, making Nigeria’s economy vulnerable to external risks. The new government has the opportunity to accelerate the pace of structural reforms to build an institutional and policy framework capable of managing the volatility of the oil sector and supporting the sustained growth of the non-oil economy. Bold reforms that could have a significant impact on the economy’s trajectory are the removal of subsidies, elimination of forex and trade restrictions, greater transparency and predictability of monetary policy and increased domestic revenue mobilization. Such reforms would help raise living standards of low-income groups while increasing spending on much needed public services. The signing of the Africa Continental Trade Agreement, after extended deliberations, may also provide some positive momentum over the medium-term. Development ChallengesWhile Nigeria has made some progress in socio-economic terms in recent years, its human capital development remains weak due to under-investment and the country ranked 152 of 157 countries in the World Bank’s 2018 Human Capital Index. Furthermore, the country continues to face massive developmental challenges, which include the need to reduce the dependency on oil and diversify the economy, address insufficient infrastructure, and build strong and effective institutions, as well as governance issues and public financial management systems. Inequality in terms of income and opportunities has been growing rapidly and has adversely affected poverty reduction. The North-South divide has widened in recent years due to the Boko Haram insurgency and a lack of economic development in the northern part of the country. Large pockets of Nigeria’s population still live in poverty, without adequate access to basic services, and could benefit from more inclusive development policies. The lack of job opportunities is at the core of the high poverty levels, of regional inequality, and of social and political unrest in the country.  
Last Updated: Oct 13, 2019"
PNG,Papua New Guinea,"FCV Status: High-Institutional and Social Fragility
 
IDA Status: IDA-eligible
 
Papua New Guinea (PNG) has a remarkable diversity of geographic and natural resources. The country occupies the eastern half of the West Pacific island of New Guinea, together with the main islands of New Britain, New Ireland, and the Autonomous Region of Bougainville, as well as another 600 smaller islands and atolls. PNG’s population of eight million people is young and growing. PNG’s growth trajectory and abundant resource potential provides a strong platform for greater economic engagement with Asia and beyond. The country’s economy remains dominated by two broad sectors: (i) the agricultural, forestry, and fishing sectors that engage most of PNG’s labor force (the majority informally); and (ii) the minerals and energy extraction sector that accounts for the majority of export earnings and GDP. To diversify PNG’s sources of revenue and increase employment, investment is needed to strengthen capacity in institutions, human capital, and physical infrastructure like electricity, telecommunications, road and other transport infrastructure that remain critical to supporting private sector-led growth. PNG has complex cultural dynamics deeply rooted in tribal and ethnic identity, traditional social institutions, and relationships to the land. These contribute to both the country’s unique challenges as well as its considerable resilience. There are limited formal job opportunities for the growing employment age population and other risks include environmental management, population growth, political fragmentation, inequalities in PNG’s resource dominated economy, and social exclusion.

 In July 2020, the World Bank forecast that – compared to previous forecasts in January – real GDP growth will drop by 4.2 percentage points (to -1.3 percent) due to weaker demand and less favorable terms of trade as a result of the COVID-19 crisis. This will lead to a larger fiscal deficit, financing gaps, and higher unemployment and poverty than previously anticipated prior to the onset of the COVID-19 pandemic. With such a highly dispersed and remote population with 87% of Papua New Guineans living in rural areas, the consequences of a COVID-19 outbreak in PNG has the potential to be devastating. The future resilience and economic growth of the country will depend on how its health system responds to the pandemic in 2020. The World Bank continues to support the Government of PNG to strengthen macroeconomic management and improve service delivery to ensure development benefits reach Papua New Guineans, particularly given 87% of Papua New Guineans live in rural areas.
Last Updated: Oct 06, 2020"
ROU,Romania,"FCV Status: Country not classed as FCV
 
IDA Status: Non-IDA recipient
 
Country Context: The economy contracted by 4.7 percent in the second half of 2020, driven by a decline of 10.5 percent in the second quarter. The weakening of external demand from Europe, alongside pandemic-related restrictions, caused industry to contract by 14.1 percent in the first half of the year. Turnover in trade and services also decreased by 17 percent in the same time frame, but high-frequency indicators point to a relatively quick rebound. The World Bank classified Romania as a high-income country for the first time, based on the 2019 data (per capita income of $12,630). This is an important development for investment rating decisions and for accession negotiations to the Organisation for Economic Co-operation and Development. The Bucharest Stock Exchange (BVB) has officially become an emerging market as of September 21, 2020, when the first two Romanian companies were included in the FTSE Global Equity Index Series (GEIS). The two Romanian companies to be included in the FTSE Global All Cap Index and three other indexes are lender Banca Transilvania (TLV) and energy producer Nuclearelectrica (SNN). Although the political scene has been impacted by the COVID-19 pandemic, local elections were held as planned on September 27 and parliamentary elections are scheduled for December 6.  
Last Updated: Oct 15, 2020"
ZAF,South Africa,"FCV Status: Country not classed as FCV
 
IDA Status: Non-IDA recipient
 
South Africa’s political transition is known as one of the most remarkable political feats of the past century. The ruling African National Congress (ANC) has been driving the policy agenda since 1994. In August 2016 the country held the most competitive local government election since 1994 in which the ANC-lost majority support in four of the metropolitan cities. Political parties negotiated coalition deals that saw the ANC unseated in the cities of Johannesburg, Pretoria and Nelson Mandela Bay. The latest general elections were held in May 2019. The South African economy grew by 1.3% in 2017 and 0.8% in 2018. The World Bank projects 2019 growth at 1.3%, accelerating further to 1.7% in 2020. Given population growth, gross domestic product (GDP) per capita growth has been close to nil since 2014, leaving little room to reduce poverty. Commodity prices remain important for South Africa, a major exporter of minerals and importer of oil. Strengthening investment, including foreign direct investment, will be critical to propel growth and create jobs. 

Key Development Challenges: South Africa has made considerable strides toward improving the wellbeing of its citizens since its transition to democracy in the mid-1990s, but progress is slowing. Based on the international poverty line of $1.90 per day, (2011 Purchasing Power Parity, exchange rates), 18.8% of South Africans were poor in 2015, following a decline from 33.8% in 1996. Factors driving this progress include, among others, real income growth, expansion of social safety nets, access to basic services including subsidized housing credit. Yet progress towards poverty reduction has slowed in recent years, with the $1.90 per day poverty rate increasing from 16.8% to 18.8% between 2011 and 2015. This is partly due to structural challenges and weak growth since the global financial crisis of 2008, but increasingly too by labor market developments that demand skills that the country’s poor currently lack. Unemployment remains a key challenge, standing at 27.6% in the first quarter of 2019. The unemployment rate is even higher among youths, at around 55.2%. South Africa remains a dual economy with one of the highest inequality rates in the world, with a consumption expenditure Gini coefficient of 0.63 in 2015. 

Inequality has been persistent, having increased from 0.61 in 1996. High inequality is perpetuated by a legacy of exclusion and the nature of economic growth, which is not pro-poor and does not generate sufficient jobs. Inequality in wealth is even higher: the richest 10% of the population held around 71% of net wealth in 2015, while the bottom 60% held 7% of the net wealth. Furthermore, intergenerational mobility is low meaning inequalities are passed down from generation to generation with little change in inequality over time. Not only does South Africa lag its peers on level of inequality and poverty, it lags on the inclusiveness of consumption growth.
Last Updated: Oct 10, 2019"
TJK,Tajikistan,"FCV Status: Country not classed as FCV
 
IDA Status: IDA-eligible
 
Country Context: Over the past decade, Tajikistan has made steady progress in reducing poverty and growing its economy. Between 2000 and 2018, the poverty rate fell from 83 percent of the population to 27.4 percent, while the economy grew at an average rate of 7 percent per year. However, the rate of job creation has not kept pace with the growing population, leaving the economy vulnerable to external shocks, and the private sector’s role in the economy remains limited, contributing to only 13 percent of formal employment and 15 percent of total investments. Non-monetary poverty indicators in rural areas remain high, as only 36 percent of the population in rural regions has access to safe drinking water. Tajikistan scores 0.53 in the Human Capital Index, which is lower than the average for its region but higher than the average for its income group. Tajikistan’s high vulnerability to climate change and natural disasters represents an additional challenge to successful economic management. Between 1992 and 2016, natural and climate-related disasters led to GDP losses of roughly US$1.8 billion, affecting almost 7 million people. The National Development Strategy (NDS) to 2030 sets a target of increasing domestic incomes by up to 3.5 times by 2030 and reducing poverty by half. This target is achievable if Tajikistan transforms its current growth model and gives the private sector more opportunities to invest, create jobs, and contribute to the economy.
"
ZMB,Zambia,"FCV Status: Country not classed as FCV
 
IDA Status: IDA-eligible
 
Zambia is large, landlocked, resource-rich country with sparsely populated land in the center of Southern Africa. It shares its border with eight countries (Angola, Botswana, Democratic Republic of Congo, Malawi, Mozambique, Namibia, Tanzania, and Zimbabwe) that serve as an expanded market for its goods. Zambia is experiencing a large demographic shift and is one of the world’s youngest countries by median age. Its population, much of it urban, is estimated at about 17.9 million and growing rapidly at 2.8% per year, partly because of high fertility, resulting in the population doubling close to every 25 years. This trend is expected to continue as the large youth population enters reproductive age, which will put even more pressure on the demand for jobs, health care and other social services.

Economic Outlook: After 15 years of significant socio-economic progress and achieving middle-income status in 2011, Zambia’s economic performance has stalled in in recent years. Between 2000 and 2014, the annual real gross domestic product (GDP) growth rate averaged 6.8%. The GDP growth rate slowed to 3.1% per annum between 2015 and 2019, mainly attributed to falling copper prices and declines in agricultural output and hydro-electric power generation due to insufficient rains. In 2019, economic growth declined significantly, from 4% (2018) to 1.4%. The services sector remained the country’s key driver of growth, growing by 3.5% in 2019, but primary and secondary sectors decreased significantly . The COVID-19 (coronavirus) pandemic has exacerbated Zambia’s macroeconomic vulnerabilities. The country is Africa’s second largest copper producer; depressed commodity markets have pushed copper prices down by about 14% through May 2020. The supply chain breakdown in major trading partners such as China and South Africa is negatively affecting domestic production and consumption. The Kwacha has depreciated by 30% since the beginning of the year, increasing external debt servicing costs and domestic inflationary pressures. 

Falling revenues and increased COVID-19-related spending will worsen the 2020 fiscal position, and falling exports and capital inflows will put additional pressure on foreign exchange reserves. As a result, the economy is projected to contract by about 4.5% in 2020. Mining and services sectors will be impacted by the global commodities demand and price outlook and increased social distancing measures to contain the COVID-19 outbreak. The current account deficit is expected to worsen to 3.4% of GDP, while lower copper export earnings and capital inflows will put pressure on reserves and the Kwacha. Domestically, increases in the number of COVID-19 cases and related social distancing measures could overwhelm the health system and result in massive business and job losses, especially in the urban informal sector. Political context: Zambia is considered a stable country with successful democratic elections held every five years. The current President is Edgar Chagwa Lungu of the Patriotic Front Party who was re-elected in August 2016, in a closely contested presidential race with his main rival, Hakainde Hichilema of the United Party for National Development (UPND). The next elections will be held in August 2021.
Last Updated: Aug 13, 2020"
ALB,Albania,"FCV Status: Country not classed as FCV
 
IDA Status: Non-IDA recipient
 
Country Context: Albania is implementing important structural reforms that will support equitable growth, raise productivity and competitiveness in the economy, create more jobs, and improve governance and public service delivery. Enhanced regional connectivity and access to regional and global markets, coupled with export and market diversification, can also help promote faster growth. In addition, the Government of Albania has been working on a broad-based reform program focused on macroeconomic and fiscal sustainability, financial sector stabilization, energy reform, social assistance and disability reform, and territorial decentralization. Albania was hit by a devastating earthquake on November 26, 2019. In response, a donor’s conference was organized in Brussels in February 2020, and roughly €1 billion was pledged from countries and international financial institutions. In the midst of these reconstruction efforts, the COVID-19 crisis is putting more pressure on the Government’s budget and response. The World Bank and other partners are cooperating to support the Government in overcoming these challenges and implementing the country’s longer-term development goals. 
Last Updated: Oct 13, 2020"
ATG,Antigua and Barbuda,"FCV Status: Country not classed as FCV
 
IDA Status: Non-IDA recipient
 
Regional context: The Caribbean is a diverse region with significant economic potential and growth opportunities. Gross National Income (GNI) per capita varies from around US$800 to over US$30,000 and some countries rely on commodity exports, while others on tourism. With its stunning scenery and vibrant cultures, the Caribbean is one of the world’s top tourist destinations. Sustainable use of ocean resources, known as the “blue economy,” offers great economic growth potential, as well as further development of the region’s services, logistics, agriculture, creative, and digital sectors. Many small economies, including those that are tourism-dependent, were maintaining a positive growth rate prior to the onset of the COVID-19 pandemic. The Caribbean has been badly impacted by the near halt in tourism. The Caribbean economy is anticipated to contract by 1.8% in 2020, and by 3.1% excluding Guyana. Many jobs are affected, and a recent high frequency phone survey in one of the Caribbean small states suggests that poverty headcounts are rising, though the magnitude and duration of this increase will depend on the pace of economic recovery. Caribbean countries are extremely vulnerable to climate change and natural disasters. Extreme weather events are common – the region experienced three Category 5 hurricanes between 2017-2019.  When a hurricane strikes, it can wipe out more than the entire annual GDP of a small island and it is often the poorest that suffer the most. Major hurricanes including Irma and Maria in 2017, and Dorian in 2019 were stark reminders. Building fiscal and financial resilience and investing in preparedness – be it physical or health-related – are critical to reduce the large human and economic costs caused by climate change, natural disasters, and other shocks, including pandemics.
Last Updated: Oct 22, 2020"
ARG,Argentina,"FCV Status: Country not classed as FCV
 
IDA Status: Non-IDA recipient
 
Argentina is one of the largest economies in Latin America with a Gross Domestic Product (GDP) of approximately US$450 billion. Argentina has vast natural resources in energy and agriculture. Within its 2.8 million square kilometers of territory, Argentina is endowed with extraordinary fertile lands, gas and lithium reserves, and has great potential for renewable energy. It is a leading food producer with large-scale agricultural and livestock industries.  In addition, Argentina has significant opportunities in some manufacturing subsectors, and innovative services in high tech industries. However, the historical volatility of economic growth and the accumulation of institutional obstacles have impeded the country’s development. The COVID.-19 pandemic and social isolation as a way to combat it aggravated the situation. Urban poverty in Argentina remains high and in the first semester it reached 40,9% of population, while extreme poverty increased to 10,5% and children poverty rose  to 56,3%. To deal with this situation, the country has prioritized social spending through various programs, including the Universal Child Allowance, a cash transfer program that reaches approximately 4 million children and adolescents up to age 18, 9.3% of the population. 

After two years of recession and strong economic weaknesses, the impact of COVID-19 has been significant in Argentina. During the second quarter of 2020, the country suffered a decline in GDP of 16.2%, the largest retraction in its history. To counteract the impacts of the crisis, the Government has implemented a package of emergency measures to protect the most vulnerable groups and help companies during the social isolation. This program has a  high fiscal cost, which is expected to bring the fiscal deficit in 2020 to more than 10% of GDP (the highest in more than three decades). Domestic economy continues to show strong macroeconomic imbalances. Annual inflation, although it has slowed since the beginning of the year, is still above 40%, despite price controls. The Government has managed to conclude the process of restructuring all its debt in foreign currency (both local and external), significantly improving the maturity profile for the next eight years. In turn, the authorities have formally begun to talk with the International Monetary Fund to agree a new program for the maturities of the Stand-By loan in the next 3 years.
Last Updated: Oct 14, 2020"
