Country,Countryname,Narrative
LBY,Libya,"FCV Status: High-Intensity conflict
 
IDA Status: Non-IDA recipient
 
The attack on Tripoli in early 2019 and the blockade of Libya’s major oil ports and terminals in January 2020 have together caused the most serious political, economic, and humanitarian crises Libya has faced since 2011. Libya’s economy was already slowing in 2019 with real GDP growth falling sharply to 2.5% from what seemed a promisingly steady recovery with record growth of 20.8% (on average) in 2017–2018. But, as military confrontation escalated in 2019/2020, oil production decreased—from 1.2 million bpd in December 2019 to 0.1 million bpd in April 2020—choking the country’s economic lifeline. The Libyan economy has now been hit by four, overlapping shocks: an intensifying conflict, which suffocates economic activity; the closure of oil fields, which puts its major income-generating activity largely on hold; decreasing oil prices, which reduce income from surviving oil fields; and the COVID-19 pandemic, which further threatens the economy, with almost 3,500 cases and 75 deaths confirmed by August 2020. 

Current Account and Foreign Exchange: In 2019, Libya’s current account continued to register surpluses for the third year in a row, largely due to the Central Bank of Libya’s (CBL’s) rationing its supply of hard currency for essential imports only, although higher hydrocarbon revenues also contributed to the surplus. Despite this surplus, by the end of 2019, foreign reserves had declined, and the dramatic drop seen since 2014 in foreign direct investments to Libya had also contributed to pressure on foreign reserves. Libya needs political resolution before economic reforms can be implemented to initiate private sector-driven growth and the generation of new jobs—the country’s only path toward sustainable, shared prosperity. In the absence of improvement on the ground, the economic downturn will deepen. Libya’s inability, or curtailed capacity, to produce and export oil might well continue for the rest of 2020 because of the closure of its oil ports and terminals—it is expected to produce a daily average of only 0.17 million barrels of oil for 2020, less than one-seventh of 2019’s production. As a result, GDP is expected to shrink by 41% in 2020. The 2020 budget partially reflects this dire situation with a large, forecasted deficit, the highest in recent years. Likewise, the government’s current account is expected to run astronomical deficits in 2020; consequently, reserves will be further depleted. Given the extreme volatility and unpredictability surrounding recent economic trends, it is not easy to forecast beyond the immediate future. After years of high inflation, the consumer price index (CPI) declined in 2019 as the exchange rate on the parallel market decreased. CPI fell by 2.2% over 2019, compared to a high average of 21.6% inflation over 2016–2018. Inflation picked up in the first two quarters of 2020, reaching 1.3% by April, as the conflict intensified, and shortages too. Libya’s currency continues to suffer on the parallel market because of political uncertainty and macroeconomic instability. The official exchange rate of the Libyan dinar (LYD) against the US dollar stood at 1.37 LYD to US$1 in August 2020, having depreciated by 1.1% compared to August 2018. The parallel exchange market often diverges from official rates but the introduction of the forex fee, while easing access to foreign exchange—especially for essential imports and family allowances—has allowed the steady convergence of the parallel and official, taxed exchange rates, bringing parallel market rates down from LYD/US$9.2 in 2017 to LYD/US$4.0 in 2019. The forex fee was reduced to 163% in August 2019, as the parallel exchange rate moved closer to the official, taxed exchange rate. Prompted by weak macroeconomic fundamentals, the lack of oil exports and decline of global oil prices, and restrictions on the sale of foreign currency imposed by the CBL, the Libyan dinar lost 54% of its value on the parallel market in the first half of 2020, reaching LYD/ US$6.17 in September 2020. 

Libya Public FinanceThe 2020 budget shows a huge deficit, due to high, rigid expenditure in a context of domestic and global health and economic crises, resulting in shocks to oil supply and demand. On March 20, the GNA adopted a budget for 2020 with an underlying deficit of LYD 29.2 billion (19.3 billion for Tripoli and 9.9 billion for Beyda), representing 90.6% of GDP, the country’s highest deficit ever. The budget estimated LYD 19.2 billion in total revenue for 2020 (59.5% of GDP), almost a third of last year’s share. Only LYD 6 billion is expected to come from the proceeds of oil, less than fifth of what they were in 2019. Projections for non-oil revenue (LYD 3.2 billion) seem overly optimistic given the dire political, social, and economic context and weak administration of customs and tax revenues. Public finances are expected to improve slightly but the inflexibility of current expenditure and volatility of oil revenue place the country’s overall fiscal stance under severe stress.
Last Updated: Oct 01, 2020"
SDN,Sudan,"FCV Status: High-Institutional and Social Fragility
 
IDA Status: IDA-eligible
 
Sudan is geographically located at the crossroads of Sub-Saharan Africa and the Middle-East and stretches across the Red Sea. Sudan shares borders with seven countries including Libya and Egypt to the North, Chad to the West, the Central African Republic to the South-West, South Sudan to the South, Ethiopia to the South-East and Eritrea to the East. The White and Blue Niles meet in Khartoum, the capital city of Sudan, and merge to become the Nile River that flows all the way to the Mediterranean Sea via Egypt. Sudan has a Sahelian belt with the desert in the far north,  fertile land in the Nile valleys, the Gezira and across the rest of the country from Darfur to Kassala via Blue Nile and Kordofan States for farming and livestock herding. For most of its independent history, the country has been beset by internal conflicts that weakened its ability to play a leadership role in the region. Under the terms of a comprehensive peace agreement in 2005, South Sudan seceded in 2011 and became the 54th independent State of Africa. 

The secession of South Sudan induced multiple economic shocks. The biggest one being the loss of the oil revenue that accounted for more than half of Sudan’s government revenue and 95% of its exports. This has reduced economic growth, and resulted in double-digit consumer price inflation, which, together with increased fuel prices, triggered violent protests in September 2013. The outbreak of civil war in South Sudan damaged both economies depriving Sudan of much needed pipeline revenues. The war in South Sudan also precipitated an increase in Sudan’s already large population of refugees and internally displaced persons with Sudan now serving as a source, destination and transit country for irregular migration, including refugees and asylum-seekers using the East African North-bound migratory route through Libya to Europe. The country hosts an estimated 763 thousand South Sudanese refugees and 159 thousand refugees and asylum seekers from Eritrea, Syria, Yemen, and Chad. The recent peace accord between the warring parties brokered by Sudan and Ethiopia appears to be holding, but the war damaged oil infrastructure, further eroding revenue availability to Sudan. Following the global oil price slump in 2015/2016, Sudan and South Sudan agreed to lower oil transit fees for South Sudanese oil via Sudan’s pipeline, as it became inefficient to export it. In December 2016, they extended their 2012 agreement on oil for three years on the same terms, except for provisions to adjust transit fees in line with global oil prices. Continuous food price hikes led to the December 2018 demonstrations which resulted in the removal of president El-Bashir from power in April 2019. This led to the formation of a Transition Government in September 2019. The power-sharing agreement between the military and civilian forces expected to last 39 months, allowed a civilian Prime Minister to lead the government under the authority of a Presidential Sovereign Council to be chaired by the military during the first 21 months followed by a civilian during the remaining 18 months.

A transitional legislative assembly is expected to be established soon. On Wednesday July 22, 2020 the Prime Minister appointed 18 civilian Governors thereby achieving a key milestone included in the Constitutional Document of the transition. Armed conflicts in Sudan’s westernmost region of Darfur have subsided but many parts of the region remain precarious because of the proliferation of arms and banditry. Efforts to settle conflict in South Kordofan and Blue Nile remain deadlocked. The Transitional Government has  engaged in peace negotiations with relevant armed groups and signed a peace deal in October 3, 2020 with Sudan Revolution Front (SRF) expected to put an end to the long-standing conflicts that divert huge resources from much needed social programs and investments in human capital to military buildup. In addition to the political and economic uncertainty, Sudan, like the rest of the world, has been experiencing the unprecedented social and economic impact of the COVID-19 (coronavirus) pandemic. The COVID-19 shock is expected to be transitory with potential recovery possible in 2021 but the overall adverse economic impact on Sudan will be substantial. The economic impact of COVID-19 includes the increased price of basic foods, rising unemployment, and falling exports. Restrictions on movement are making the economic situation worse, with commodity prices soaring across the country. According to the International Monetary Fund has already forecasted an overall economic stagnation in 2020 in Sudan. 
Last Updated: Oct 14, 2020"
AFG,Afghanistan,"FCV Status: High-Intensity conflict
 
IDA Status: IDA-eligible
 
Country Context: COVID-19 has hit Afghanistan in the midst of a difficult political transition, an intensifying conflict, and significant uncertainty regarding future grant support. Afghanistan’s economy grew by 3.9 percent in 2019, driven mainly by strong agricultural growth following recovery from drought. The economy is estimated to have contracted sharply over the first half of 2020, due to the impacts of the COVID-19 crisis. Wheat production (mostly in the subsistence sector) has supported continued agricultural growth, but industry and service output have been heavily impacted by lockdowns and border closures. A power-sharing agreement has been signed between the two parties contesting the outcome of the September 2019 presidential elections. Implementation is now underway, that has led to changes in senior staff across key ministries. While the peace talks between the Islamic Republic of Afghanistan and the Taliban has started on 12 September 2020, Taliban attacks on Afghan security forces have intensified. 

The future of international assistance remains in question. The US has substantially reduced troop numbers over 2020, with further reductions likely. Current grant pledges expire at the end of 2020, and international partners are due to consider future aid commitments at an international conference in November. Without progress towards a sustainable peace and commitments to continued grant support from international partners, medium-term prospects appear increasingly grim. Civilian causalities remain high with the United Nations Assistance Mission in Afghanistan recording 10,392 civilian casualties in 2019, and 462,803 Afghans internally displaced due to conflict. The surge in returns by an estimated 1.7 million documented and undocumented Afghan refugees during 2016-2017 remains a pressure on the country’s economy and institutions. Internal displacement and large-scale return within a difficult economic and security context pose risks to welfare for the displaced and host communities. As the international community’s financial commitment to Afghanistan at the October 2016 Brussels Ministerial Conference on Afghanistan is due to expire by the end of 2020, a new pledging conference is planned to be held at the ministerial level in November 2020 hosted by Finland. World Bank Group engagement pursues a programmatic approach to support the Afghanistan National Peace and Development Framework (ANPDF) that was presented by the Government of Afghanistan at the Brussels Conference. Advisory work and operations focus on macro-fiscal policy and management; finance, private investments and jobs creation; public sector governance and anti-corruption; human capital development and service delivery; citizen engagement and social inclusion, urban development; and infrastructure, connectivity and sustainability. 

Recent Economic Developments: Substantial improvements in development outcomes have been observed in Afghanistan since 2001, particularly in expanded access to water, sanitation and electricity, education, and health services. Macroeconomic management remains strong, government revenues have grown consistently since 2014, and the government has engaged in an impressive range of business environment and public financial management reforms. Expanded access to health, education, and infrastructure has seen rapid improvements in outcomes, with Afghanistan catching up with other low-income countries against key development indicators. While progress has been uneven, increased access to services and infrastructure has driven huge development gains. At the same time, Afghanistan continues to experience insecurity and political uncertainty. Afghanistan’s economy has been hard-hit by the outbreak of the COVID-19 virus, due to negative impacts on consumption, exports, and remittances. Conflict is ongoing, and 2019 was the sixth year in a row when civilian causalities in Afghanistan exceeded 10,000. The displacement crisis persists, driven by intensified government and Taliban operations in the context of political negotiations. The number of conflict-induced IDPs increased from 369,700 in 2018 to 462,803 in 2019. An additional 505,000 refugees returned to Afghanistan, mainly from Iran, during 2019. Following the agreement between the US and the Taliban agreement the “Agreement for Bringing Peace to Afghanistan” signed on February 29, 2020, the direct peace talks between the Islamic Republic of Afghanistan and Taliban started on 12 September but the process of a political settlement is only beginning. Meanwhile, the duration and extent of continued international security support is being questioned. 

Current international security and civilian grant support pledges are due to expire in 2020, creating uncertainty regarding future aid levels and the sustainability of security and development expenditures. This has fundamental implications for the economy, with growth and investment constrained by weak confidence. Afghanistan’s economy grew by 3.9 percent in 2019 driven by easing of drought conditions and rapid agricultural growth. Inflation remained modest at 2.3 percent. The trade deficit remains extremely large, at around 31 percent of GDP, financed mostly by grant inflows. Fiscal performance continued to improve in 2019 despite the elections with domestic revenues reaching 14.1 percent of GDP. Political uncertainties, however, dampened private sector confidence and non-agriculture growth. The basic needs poverty rate was 55 percent at the time of the last household survey (2016/17) and is expected to have worsened after the COVID-19 pandemic that hugely impacted the living condition of households. The economy is expected to contract by up to five percent in 2020 with the negative impacts of the COVID-19 virus overshadowing improvements in weather conditions. Additional substantial downside risks remain, including political instability, deterioration of security conditions, premature reduction in aid flows, and further adverse regional economic or political developments. Poverty is expected to remain high, driven by weak labor demand and security-related constraints on service delivery. 

The COVID-19 crisis will have a serious and sustained impact on Afghanistan’s economy. Recovery is expected to take several years, with new investment constrained by political uncertainties, continued insecurity, and questions around ongoing international support. With declining grants and lower revenues, fiscal space is expected to remain highly constrained over the medium-term. Available fiscal resources should be used to protect vulnerable households and maintain delivery of basic services including healthcare. Recovery could be supported by rapid action to improve the business regulatory environment, including through measures to expand access to credit. For development partners, the highest priority is ensuring continued and predictable grant support. Precipitous declines in grant flows over coming years would force major contraction in government services, undermining development outcomes and future growth prospects. Clear commitment to continued grant support is vital for any improvement in confidence and investment.
Last Updated: Oct 01, 2020"
MOZ,Mozambique,"FCV Status: Medium-Intensity conflict
 
IDA Status: IDA-eligible
 
Mozambique borders Tanzania, Malawi, Zambia, Zimbabwe, South Africa, and Eswatini. Its long, Indian Ocean coastline of 2,500 kilometers faces east to Madagascar. About two-thirds of its population of more than 29 million (2018) live and work in rural areas. It is endowed with ample arable land, water, energy, as well as mineral resources and newly discovered natural gas offshore; three, deep seaports; and a relatively large potential pool of labor. It is also strategically located; four of the six countries it borders are landlocked, and hence dependent on Mozambique as a conduit to global markets. Mozambique’s strong ties to the region’s economic engine, South Africa, underscore the importance of its economic, political, and social development to the stability and growth of Southern Africa as a whole. 

Political Context: The Front for the Liberation of Mozambique (Frelimo) and the Mozambican National Resistance (Renamo) remain the country’s main political forces, followed by the Mozambique Democratic Movement (MDM). Renamo has maintained a considerable arsenal and military bases after the peace accord of 1992, and ever since the end of the civil war, the country has registered flare-ups of armed confrontations and violence.  A new peace accord was reached in August 2019, and has been violated several times by a Renamo breakaway military faction known as  Military Junta. The new peace deal aimed  at achieving  greater pacification of the country by integrating Renamo residual fighters into the national army, and  dismantling Renamo military bases splattered around the country. Meanwhile, the government is grappling with another so-called Islamic insurgency in parts of the gas-rich province of Cabo-Delgado. Initially circumscribed to one locality, the indiscriminate killing of civilians perpetrated by the insurgents has now spread to other districts and towns  in the province. Recently (March 2020) the rebels attacked and occupied  successively the transport hub rural town of Mocimboa da Praia and the town of Quissinga. Recent estimates show the conflict has killed more than 1,000 people and forced 100,000 from their homes. The risk that violence can spread to other areas of the country should not be underestimated. Presidential, legislative, and provincial elections were held across the country on October 15, 2019, completing the country’s sixth successive general elections  since the introduction of multiparty elections in 1994 . The incumbent party, Frelimo, won the presidency and the national parliament in a landslide. Frelimo also secured a majority in all 10 provinces, thus electing governors for each province.  

Economic Outlook: The COVID-19 (coronavirus) pandemic reached Mozambique at a weak moment in its economic history, as the country attempted to recover from two major shocks: the hidden debt crisis and the devastating effects of cyclones Idai and Kenneth in 2019. In 2016, Mozambique’s track record for high growth was disrupted when large, previously unreported external borrowing came to light. The revelation of undisclosed debt dented confidence in the country, increased debt levels, and more than halved the average rate of growth. In 2019, Cyclones Idai and Kenneth caused massive damage to infrastructure and livelihoods, further lowering growth and wellbeing of the population. The pandemic presents a further setback on the country’s economic prospects. The pandemic dims the short-term growth prospects of Mozambique. The COVID-19 crisis will have a heavy impact on economic activity as social distancing and travel restrictions (domestically and globally) affect demand for goods and services. At the same time, reduced demand and prices of commodities are slowing the pace of investment in gas and coal, two key industries for Mozambique. With this, growth is expected to decline to 1.3% in 2020, down from a pre-COVID forecast of 4.3%, with significant downside risks. Mozambique is also expected to experience large external and fiscal financing gaps in 2020 and 2021 in a context characterized by exposure to external shocks and limited fiscal space. 

Development Challenges: The country’s main challenges include maintaining the macroeconomic stability considering exposure to commodity price fluctuations, and reestablishing confidence through improved economic governance and increased transparency, including the transparent handling of the hidden debt investigation. Moreover, structural reforms are needed in support of the currently struggling private sector. Another major challenge is diversifying the economy by moving away from the current focus on capital-intensive projects and low-productivity subsistence agriculture, while strengthening the key drivers of inclusion, such as improved quality education and health service delivery, which could in turn improve social indicators.  
Last Updated: Jul 01, 2020"
